input_id,link,title,category,address,open_hours,popular_times,website,phone,plus_code,review_count,review_rating,reviews_per_rating,latitude,longitude,cid,status,descriptions,reviews_link,thumbnail,timezone,price_range,data_id,images,reservations,order_online,menu,owner,complete_address,about,user_reviews,emails
24a35954-e2c5-4e5d-990a-d3e19751c547,https://www.google.com/maps/place/Alfa+Hotel/data=!4m10!3m9!1s0x30c1ec82ece4e813:0x56a2251ac6e35f6b!5m2!4m1!1i2!8m2!3d16.7831826!4d96.1540362!16s%2Fg%2F1tnzhjbd!19sChIJE-jk7ILswTARa1_jxhololY?authuser=0&hl=en&rclk=1,Alfa Hotel,Hotel,"Alfa Hotel No. 41, Yawmingyi Qr., Nawaday Road, Yangon",{},{},,01 377 960,Q5M3+7J Yangon,92,3.700000,"{""1"":4,""2"":7,""3"":29,""4"":23,""5"":29}",16.783183,96.154036,6242592830425096043,,"Unassuming hotel offering an Asian restaurant & a cafe/bar, plus warm, traditional rooms.",https://search.google.com/local/reviews?placeid=ChIJE-jk7ILswTARa1_jxhololY&q=Alfa+Hotel&authuser=0&hl=en&gl=MM,https://lh3.googleusercontent.com/gps-proxy/ALd4DhHjPuvl8EEFRt_Jz0bQeESUyzH_FyEask95yy1LsE_Jq9AFgAXt4c0HIhy3Ii40MI-3f25d92ppL0rZdVqTOXzqGIvYm-lGpOBriv-v4Ih8IUk_Y_HDXLjhSxFzl04pr9n51IDYicSnzzTTOqwaMOrhGFhvV6pH81fq5De7QGPKK1churxJLRru=w408-h272-k-no,Asia/Rangoon,,0x30c1ec82ece4e813:0x56a2251ac6e35f6b,"[{""title"":""All"",""image"":""//lh4.googleusercontent.com/ewgVvdbxxH1EfjgZVWH5OSA0xJB1VS74FdGeIMey4h_tameb7plhOANzjdrcqj4=w397-h298-k-no""},{""title"":""Rooms"",""image"":""https://lh3.googleusercontent.com/gps-cs-s/AB5caB-ZKWR56O4nArp0YgMN5ZQlotNptfWKlhk20TyNC5dnSYsTbGYevKP-0rXkGSkd8ji8RYZ9zqapntYFaU_FF77Yc4ti5Xay-Gs61XSrbUJKpm3oVUjMHDE8sJ9Z42HuR1yuVA0=w397-h298-k-no""},{""title"":""Exterior"",""image"":""https://lh3.googleusercontent.com/gps-cs-s/AB5caB_yIzkkq5-7i3JiCGVJCWDxmLp8D-SZBBYPIQWwKRfvxkGXtpvp_fO0XbWr5Ccdd_n3i_qydsfSoPi3yrA5ynByCgHKVZRnEJmfuWoTYGo5Su1urIe4ZXfQtX3KmzkXy__paMvu=w397-h298-k-no""},{""title"":""Food \u0026 drink"",""image"":""https://lh3.googleusercontent.com/gps-cs-s/AB5caB-ecrATTinsrCdABKhE6Rw39Id0niTcN6hlvbIG1wh68B_UPeGnIfYbbCulr6ZKyBQ-W2P1xxYptoEYYVL0nt3miZ-pax-Lymw_tYomDAlvIU81EOzt9wiutnq5SnLXR7Wxopds=w397-h298-k-no""},{""title"":""From visitors"",""image"":""https://lh3.googleusercontent.com/gps-cs-s/AB5caB-Hq1AvyAsxmNMnnjHm8bJyq0hUwh9FXbL_S9y8QPG85tYVlt9iX7du77NZrZzHnbrDc2DRZCdJD6Y9dDb1F-Clvlf5LvO59V_1uq6K5b_qoz4h4KF2_L8oxw7TuiRSTCmhj92KSg=w529-h298-k-no""},{""title"":""Street View \u0026 360°"",""image"":""https://lh3.googleusercontent.com/gps-cs-s/AB5caB_Hgy9jCOm2fAgl4eLRGisunFoE82bO_e2OZGdKkLe5Tc91sOAu3R5hZs5oe38uyasUpQwok15ddD0e0Wc9NGubenJVqbOLiTj02A9ibHA-CbTaEDvo89nQ7TwbpWMYsS7k7C45aA=w224-h298-k-no-pi-0-ya100.99999-ro-0-fo100""}]",null,null,"{""link"":"""",""source"":""""}","{""id"":"""",""name"":""Alfa Hotel (Owner)"",""link"":""""}","{""borough"":"""",""street"":""No. 41, Yawmingyi Qr., Nawaday Road"",""city"":""Yangon"",""postal_code"":"""",""state"":"""",""country"":""MM""}",null,"[{""Name"":""Simon T"",""ProfilePicture"":""https://lh3.googleusercontent.com/local-reviews/AJMZ0QeFH6dzZjd_ZFLhXHZKibEzXEy8hWzFB4Qa7PutLe3CnO2G7yVfjd4VSabiCQwQYo5W-g=s120-c-br100"",""Rating"":0,""Description"":""Review is for the Sapphire Bar on top of the Alpha Hotel. The hotel looks like a 3 star hotel and we had some doubts when we went into the hotel lounge. Reaching the bar on top of level 12, we were greeted by a rather bare large rooftop with chairs and tables placed loosely. The bar is literally two simple tables with different alcohol bottles displayed on it. We didn't have much hope. But the view was great and we had a good view of the padoga and full moon, which was really nice. Ordered a mojito and it was not bad at all. In other countries, this will probably get two or three stars from me but given that it is in myanmar, I think the place deserves 4 stars. Just remember that this is still a relatively new emerging market and places are still not fully commercialize yet, which is the main point. Sit back, enjoy the view, sip the cocktail which is only usd2.5, and relax. I'm sure one day, this bar will go through dramatic transformation into a high end bar with proper chairs, deco and expensive cocktails but I truly like it the way it is now. Enjoy while it lasts."",""Images"":null,""When"":""""},{""Name"":""Donn Emmanuelle Quines"",""ProfilePicture"":""https://lh3.googleusercontent.com/a-/ALV-UjVkeEqSIQhYXlRK9H5QLDluZQhC-xQO3HMf0Q7j9u-lLhtjgpo=s120-c-rp-mo-ba3-br100"",""Rating"":5,""Description"":""If you want a decent view of Yangon, this is the right place. The Sapphire Lounge that sits on top of the hotel serves as their rooftop bar. Great place for unwinding. The main downside is the set-up, expect to see rusty tables and chairs. Not the typical rooftop bar setting. They also have free WiFi connection and its pretty good and stable."",""Images"":null,""When"":""""},{""Name"":""MT0024"",""ProfilePicture"":""https://lh3.googleusercontent.com/local-reviews/AJMZ0Qf66pF81jsVXBxevYxxL5FsdlDsKAngAUpJVE-hAwai1rl8J0QnYqktKV3UGdpbmNlc_A=s120-c-br100"",""Rating"":0,""Description"":""I did not stay here.  I did, however, visit the rooftop bar and highly recommend it.  You don't need to be a guest of the hotel to visit the rooftop.  Simply go to the lobby and tell the staff you'd like to go to the rooftop and they will show you the elevator.  When you get to the roof, you will inevitably see a quiet place with few patrons and several attentive servers.  You will have a great view of Shwedagon Pagoda and all of downtown Yangon.  The place isn't really glitzy but it has a definite charm, perhaps as a recognition of quieter times in Yangon.  It is a must visit in Yangon.  Prices for drinks are only marginally higher than in shops on the street and certainly much, much lower than more trendy rooftops in the city.  Visit for a taste of bygone Asia!"",""Images"":null,""When"":""""},{""Name"":""Ruti K"",""ProfilePicture"":""https://lh3.googleusercontent.com/local-reviews/AJMZ0QfnSFWXMd1oJu73a6IhdtgibYcjse2HKQTHeghNQd9Cyw8DYQQJZDCyh-TD68ehXuY-FA=s120-c-br100"",""Rating"":0,""Description"":""I'll start by saying we aren't very demanding customers. In nearly 3 weeks in myanmar we stayed in various places, all of which we found great, even very cheap backpackers hostels with no warm water or mirror in the room. However, we do think you should get what you pay for and this place just doesn't make sense. ||positive things first: the hotel is well located, near some nice restaurants and cafes and not far from the shwedagon pagoda. And the wifi works well. ||Other than that, it really sucked. Was by far and away the worst hotel we stayed in, in an almost 3 week trip to Myanmar - and the most expensive!! (Slightly surpassing even a beach front bungalow at Ngapali!)||The hotel and its furniture and equipment are very very old with some ridiculous features, like none of the room or bathroom lights working unless the main light is on (which makes it hard when one person is awake and the other isn't), and an almost cute built- in radio set from the 70s at the very latest! ||bad smell in the room (of smoking, to which a bellboy was sent to spray some anti-odor all over the room...) and in the hallways (of ginger cooking or something like that) - both topped with a lingering scent of mold. Bath was uninviting to say the least. ||My friend came in late and accidentally  walked into a different room to discover that the key worked!! After which she tried a few more and apparently the magic key opened all the rooms she tried. Didn't really matter because the hotel was empty except for us - and rightfully so.||The reason we picked this hotel was because of the so-called rooftop bar, which turned out to be a poor guy standing in front of a small reception table stocked with some alcohol bottles,  and an entirely unimpressive view. Yes, you can see the Shwedagon pagoda but aside from that not much more. ||We know there is a supply-demand problem in Yangon which makes for a situation in which hotels don't need to try very hard and still have a steady flow of clients. However, this place was hostel-level with hotel price so better to just stay at a very basic backpackers place."",""Images"":null,""When"":""""},{""Name"":""Brian Brigg"",""ProfilePicture"":""https://lh3.googleusercontent.com/a/ACg8ocLhdIWW96MVAYNwwgC6TctxJC4WBThP9-N1OaJHUEYzZ-lNLA=s120-c-rp-mo-ba5-br100"",""Rating"":3,""Description"":""The hotel has an air of faded elegance. The single lift stops between every second floor so there is a walk down or up to your floor.\n\nThe Sapphire Club is the bar on the rooftop. To get there you take the lift to the top then go up a half floor to get to 12. Then you have to walk down a corridor between guest rooms to get to the stairs to the top.\n\nThough the decor is basic the bar is friendly with very good White Russian and Mojito cocktails at very reasonable prices. The place is quiet and there is a good view of the Shwedagon Pagoda on one side and the downtown area on the other."",""Images"":null,""When"":""""},{""Name"":""Poh L"",""ProfilePicture"":""https://lh3.googleusercontent.com/local-reviews/AJMZ0Qd0Gzx7-o-W0qn7F-oHhorx-ann6UFYRniBmE7Ar1MhRFtO-x6vY7U2LNCPC1lcQidkpw=s120-c-br100"",""Rating"":0,""Description"":""This hotel is perfect for a stay as it's a central yangon,location is one of the best,room is spacious but old n nice Sapphire bar at level 12 rooftop. Breakfast can be improve as it's almost same everyday. nearby 3 min walking distance to Yaw Min Gyi (Boyar Nyunt Street),i went there everyday for meal,beer n wine,there's lot of pub,bar,restaurants and massage,my flavour jap food,local cuisine n mala xiangguo.I love body\u0026foot massage at Singapore foot reflexology,skillful style n strength power.just feel relax n a warm street . Recommended hotel if price ok. Easy walking distance to many tourists attraction like Bogyoke market, junction city, Chinatown..|Sure we will be back."",""Images"":null,""When"":""""},{""Name"":""Marley M"",""ProfilePicture"":""https://lh3.googleusercontent.com/local-reviews/AJMZ0Qf66pF81jsVXBxevYxxL5FsdlDsKAngAUpJVE-hAwai1rl8J0QnYqktKV3UGdpbmNlc_A=s120-c-br100"",""Rating"":0,""Description"":""I didn't actually stay at the hotel, but I visited the rooftop bar at sunset which I highly recommend! It's nothing too fancy but you can get a Myanmar beer and enjoy an excellent view of the city. Definitely worth a stop if you're in the area."",""Images"":null,""When"":""""},{""Name"":""Aruna G"",""ProfilePicture"":""https://lh3.googleusercontent.com/local-reviews/AJMZ0QfjHmZg8gr7jpDgKhrh5KsR_Mq7L6pkVedvpKQz-f3LMiOd3OjI90CK4uLtF3wE59zZgA=s120-c-br100"",""Rating"":0,""Description"":""We booked this hotel so that we could crawl back after the rooftop party. Nice quiet place. Surrounded by heaps of restaurants. Small \u0026 nice. Must visit the rooftop bar for nice views of Yangon. Travellers...this is a nice base for sightseeing"",""Images"":null,""When"":""""}]",
24a35954-e2c5-4e5d-990a-d3e19751c547,https://www.google.com/maps/place/Yangon+Urban+Hotel/data=!4m10!3m9!1s0x30c1edb06476ae6b:0x6711168f9ae05b1e!5m2!4m1!1i2!8m2!3d16.7723508!4d96.1625844!16s%2Fg%2F11fjqjq1f7!19sChIJa652ZLDtwTARHlvgmo8WEWc?authuser=0&hl=en&rclk=1,Yangon Urban Hotel,Hotel,"74-80, 38 Street (Middle Block), Near Merchant Street, Yangon",{},{},http://www.yangonurbanhotel.com/,01 378 663,Q5C7+W2 Yangon,14,3.100000,"{""1"":3,""2"":2,""3"":4,""4"":0,""5"":5}",16.772351,96.162584,7426742066545187614,,"Relaxed property offering a business centre & a lobby lounge, plus a breakfast buffet.",https://search.google.com/local/reviews?placeid=ChIJa652ZLDtwTARHlvgmo8WEWc&q=Yangon+Urban+Hotel&authuser=0&hl=en&gl=MM,https://lh3.googleusercontent.com/gps-proxy/ALd4DhG7P47U4DHAzV0InkE4Oh2GUnPQIOuvJ6pH6C06TcXuvL5S_PQbGfPziyKj_CfzoPPN0J0ST7j4LtGsbkQMAZjVL9ZbwJosApUlZlwS8PeyJp5o0f5773I57r-aFNEUt4JEFXVAS86Qdk0USFyT3AnwQF_4iC7_8VOQL0UGGr6amgburSpgyv4f=w408-h612-k-no,Asia/Rangoon,,0x30c1edb06476ae6b:0x6711168f9ae05b1e,"[{""title"":""All"",""image"":""https://lh5.googleusercontent.com/p/AF1QipM2Q9YEDM-wnIIfkl_t4Yfrp1gnZpcU4YyknsY1=w529-h298-k-no""},{""title"":""Exterior"",""image"":""https://lh5.googleusercontent.com/p/AF1QipM2Q9YEDM-wnIIfkl_t4Yfrp1gnZpcU4YyknsY1=w529-h298-k-no""},{""title"":""Food \u0026 drink"",""image"":""https://lh5.googleusercontent.com/p/AF1QipP4dqlcAt9c7AMoRpWQ0dwDpssrmhL6SO58Ie5Q=w397-h298-k-no""},{""title"":""From visitors"",""image"":""https://lh5.googleusercontent.com/p/AF1QipP82pIdga41pexDKJ0LyqLn3XkhXQy9Ui2nzbZ6=w529-h298-k-no""}]",null,null,"{""link"":"""",""source"":""""}","{""id"":"""",""name"":""Yangon Urban Hotel (Owner)"",""link"":""""}","{""borough"":"""",""street"":""74-80, 38 Street (Middle Block), Near Merchant Street"",""city"":""Yangon"",""postal_code"":"""",""state"":"""",""country"":""MM""}",null,"[{""Name"":""SiThao Nguyen"",""ProfilePicture"":""https://lh3.googleusercontent.com/a/ACg8ocJ33gCeW_qZciAIdVS62xbZWTAizbqoI281BcyePOFPtq2COQ=s120-c-rp-mo-br100"",""Rating"":5,""Description"":""I recently stayed at Yangon Urban Hotel during the first week of December 2024 and had a fantastic experience. Upon check-in, I was pleasantly surprised with a room upgrade, which was a lovely touch.\n\nThe staff were incredibly friendly and helpful throughout my stay. While there were occasional power outages in the area, the hotel's generator ensured that my room always had electricity, which I greatly appreciated.\n\nFurthermore, all of my requests were promptly addressed. The staff even went the extra mile by personally escorting me to a nearby food shop within a 10-minute walk. This level of hospitality was truly exceptional.\n\nThe location of the hotel is also a plus point. I could walk to Sule pagoda, shopping malls, convenience stores and countless eating places surrounding."",""Images"":null,""When"":""""},{""Name"":""Moe Moe San"",""ProfilePicture"":""https://lh3.googleusercontent.com/a/ACg8ocL8HbXixbE75RIVpMrNqor9idz91yT7Ko7N4DW8qy4NMe9V=s120-c-rp-mo-br100"",""Rating"":1,""Description"":""The breakfast was so bad and the staffs are not nice at all.And the door is difficult to close.In the morning,the staffs are sleeping in the lobby.I was so speechless."",""Images"":null,""When"":""""},{""Name"":""Phyo Thiha Aung"",""ProfilePicture"":""https://lh3.googleusercontent.com/a/ACg8ocIwCyzFVXJlAO-eMbEsSrMQzekgd1tpsdpaOGoEM360_2riegE=s120-c-rp-mo-ba3-br100"",""Rating"":3,""Description"":""Fair price but facility relating to shower is under rate"",""Images"":null,""When"":""""},{""Name"":""Rashpal Singh"",""ProfilePicture"":""https://lh3.googleusercontent.com/a-/ALV-UjUR-DefzMHcXOyIDZTUDxEcV79p8zXMpb-v1XkkoqYs8ktfz73u=s120-c-rp-mo-ba2-br100"",""Rating"":5,""Description"":""want to visit again"",""Images"":null,""When"":""""},{""Name"":""Khin Swe Win"",""ProfilePicture"":""https://lh3.googleusercontent.com/a/ACg8ocLd69VW6SA0G_d-XP0Z_6o-zeMHZzBAc8ME9USvXnl1W5BWJw=s120-c-rp-mo-ba3-br100"",""Rating"":2,""Description"":""အခန္းေစ်းႏႈတ္းက သင့္ေတာ္ၿပီး\nသန္႔ရွင္းေရး အားနည္းပါတယ္။\nRoom no.207 သည် Phးလိုင်းမမိပါ။"",""Images"":null,""When"":""""},{""Name"":""Hein Min"",""ProfilePicture"":""https://lh3.googleusercontent.com/a/ACg8ocKmb3gms-V35tBirpR08MlRp7JOGnq9NVVJNtS8O_C77xRdQg=s120-c-rp-mo-ba4-br100"",""Rating"":3,""Description"":""ပန်းဆိုးတန်းလန်းမ နှင့် နီးပြီး သွားလာရလွယ်ကူသော နေရာလေးတစ်ခုပါ။"",""Images"":null,""When"":""""},{""Name"":""pho lu adk"",""ProfilePicture"":""https://lh3.googleusercontent.com/a/ACg8ocICM9y0MzM3BgJyOQTCXCamOsl2-fYw_mtAlOMDQ2LwE0R_YA=s120-c-rp-mo-br100"",""Rating"":1,""Description"":""Very bad service\nဂ်ပိုးhotel\nBad  Manager စကားေျပာအဆင္မေျပ"",""Images"":null,""When"":""""},{""Name"":""KoLo SoLo"",""ProfilePicture"":""https://lh3.googleusercontent.com/a-/ALV-UjXcvCUjR2u_6MqJ3YecZ2o-HpVmJa8Ag_Xws9CyEibDQPXnQ-E=s120-c-rp-mo-br100"",""Rating"":5,""Description"":""Have wifi"",""Images"":null,""When"":""""}]",
24a35954-e2c5-4e5d-990a-d3e19751c547,https://www.google.com/maps/place/Panorama+Hotel/data=!4m10!3m9!1s0x30c1ec860ba6e065:0xc1332652ecfc84ba!5m2!4m1!1i2!8m2!3d16.778789!4d96.1620473!16s%2Fg%2F1tggdx42!19sChIJZeCmC4bswTARuoT87FImM8E?authuser=0&hl=en&rclk=1,Panorama Hotel,Hotel,"No.294-300, Pansodan Street,, Yangon",{},{},http://www.panoramayangon.com/,01 825 3077,Q5H6+GR Yangon,442,3.900000,"{""1"":14,""2"":22,""3"":118,""4"":128,""5"":160}",16.778789,96.162047,13921513010737480890,,Unassuming rooms & suites in a low-key hotel offering a restaurant & a breakfast buffet.,https://search.google.com/local/reviews?placeid=ChIJZeCmC4bswTARuoT87FImM8E&q=Panorama+Hotel&authuser=0&hl=en&gl=MM,https://lh3.googleusercontent.com/gps-proxy/ALd4DhGFV9wdhgE_KXjtw9j-DDzdISx7kjJIdZwFX-lgTwzrEm1UFwBTzcFZXYDjjqXIGsFjBmC_q_GCSi1Zr26wm9x1E-_U3fpZNt--eTw6uKiXKkxGH0_9P3JL8OI-xsEOH8TFgNFUrHYhdGR5eVJeVjvIUv3ho9dqaviy0GeYgKeIvjPjt7Mk5dHW=w408-h270-k-no,Asia/Rangoon,,0x30c1ec860ba6e065:0xc1332652ecfc84ba,"[{""title"":""All"",""image"":""https://lh5.googleusercontent.com/p/AF1QipM3G2GbzReVVWMfjOECvoHgyHlXe_u_0UpXC_Zb=w448-h298-k-no""},{""title"":""Rooms"",""image"":""https://lh5.googleusercontent.com/p/AF1QipOIXDe6RxL0gqh9BZBkrjkIh40G9xGyIlVqqVRi=w447-h298-k-no""},{""title"":""Videos"",""image"":""https://lh3.googleusercontent.com/p/AF1QipMq4vWFoKsrA_Ue5mewMWg_2ETT9luHchYGUkRH=w224-h398-k-no""},{""title"":""Exterior"",""image"":""https://lh3.googleusercontent.com/p/AF1QipNX_jbU1fdaPHmRvrtvfNhbq4thNZpxjy0M-glM=w529-h298-k-no""},{""title"":""Amenities"",""image"":""https://lh5.googleusercontent.com/p/AF1QipNRr11DfIvKeiZAr1pMDdROMOeaGWDA968skJRL=w447-h298-k-no""},{""title"":""Food \u0026 drink"",""image"":""https://lh5.googleusercontent.com/p/AF1QipMbIAJrLzvnew3Jb1vZRZ1GZTHWCuUwlUz2kSwi=w447-h298-k-no""},{""title"":""From visitors"",""image"":""https://lh5.googleusercontent.com/p/AF1QipPeoZmUlDkw_gR78p6TbTNXgQMHMvwUjh8vK-FE=w397-h298-k-no""},{""title"":""By owner"",""image"":""https://lh5.googleusercontent.com/p/AF1QipMR4rQUOynq1Zu-oY6DehROxhhndb8bqkB7xW-u=w447-h298-k-no""},{""title"":""Street View \u0026 360°"",""image"":""https://lh3.googleusercontent.com/p/AF1QipNPXDvgAokWWsiZEDnTzuzKhiReSCKNgmvcU-jp=w224-h298-k-no-pi0-ya60-ro0-fo100""}]",null,null,"{""link"":"""",""source"":""""}","{""id"":""108721409592244643512"",""name"":""Panorama Hotel (Owner)"",""link"":""https://www.google.com/maps/contrib/108721409592244643512""}","{""borough"":"""",""street"":""No.294-300, Pansodan Street,"",""city"":""Yangon"",""postal_code"":"""",""state"":"""",""country"":""MM""}",null,"[{""Name"":""Gand G"",""ProfilePicture"":""https://lh3.googleusercontent.com/a/ACg8ocIAPxQpPTqHSTKExk64fxbPsqI7dVh1hbWm7LOwwWOVuNnEXw=s120-c-rp-mo-ba4-br100"",""Rating"":4,""Description"":""The hotel is in a great downtown location, making it super convenient. Room cleanliness was about average for Myanmar, but I did spot a few tiny cockroaches, which was a bit of a downside. The staff, however, were incredibly kind and friendly. The highlight? The mohinga at breakfast was delicious!"",""Images"":null,""When"":""""},{""Name"":""olasol"",""ProfilePicture"":""https://lh3.googleusercontent.com/a-/ALV-UjVaekYT3vrOBfD4fotSlcBf7mlXqgFFs7Ru3JKT_Wkxo8SLOis=s120-c-rp-mo-br100"",""Rating"":5,""Description"":""Amazing desk staff. Ye Ying was as good as it gets in regards to assisting me during my brief stay.\n\nRooms are a bit tired, but very clean. The location worked well for me. I was only in Yangon twice, for 1 or 2 nights each time. I walke to Inle Lake a couple times...a normal walk for me but maybe a lot for some people. There is a night market ablock away and a few decent restaurants on that same street as the sidewalk market."",""Images"":null,""When"":""""},{""Name"":""Марина И"",""ProfilePicture"":""https://lh3.googleusercontent.com/local-reviews/AJMZ0Qd13w88JzywouBw5_KVfIPp-5iWqVHllbuF4z8yRrMPWoLF7cj8nWEEvVV3CEgWahMXqck=s120-c-br100"",""Rating"":0,""Description"":""The pillows were like bricks, there were ants and cockroaches in the rooms. We stayed there only one night, but I couldn't sleep because I am afraid of insects. The staff was helpful and spoke English ok."",""Images"":null,""When"":""""},{""Name"":""Suresh Kumar"",""ProfilePicture"":""https://lh3.googleusercontent.com/a-/ALV-UjV4uZkgFr4Bw7Y7hX5BeEGMGyORwtsKOKMpz4_r-tZmCBKmOvpU=s120-c-rp-mo-br100"",""Rating"":4,""Description"":""Nice hotel panorama, excellent breakfast 🥣 good,,, room cleaning area super"",""Images"":null,""When"":""""},{""Name"":""Sanjit S"",""ProfilePicture"":""https://lh3.googleusercontent.com/a-/ALV-UjWA-FYE8TbVV-PVay2opFMVu60crbrthVG9GeZ36Jm8XsIgyf7Lzg=s120-c-rp-mo-ba6-br100"",""Rating"":4,""Description"":""The hotel staff are friendly and accommodating. Hotel is clean and located in central part of town, near an overpass. Old hotel but has been renovated. For the price can't fault it. Noise from the traffic is an issue, my tip is to take an upper floor room, and if views aren't an issue then rooms at the back. The breakfast spread is fair but repetitive. A cab from the hotel to the Airport is 8000 kyats, was comfy and clean. Ask the doormen to sort it for you. Very happy with my stay here, for a budget hotel."",""Images"":null,""When"":""""},{""Name"":""Surly_Architect"",""ProfilePicture"":""https://lh3.googleusercontent.com/local-reviews/AJMZ0QeFH6dzZjd_ZFLhXHZKibEzXEy8hWzFB4Qa7PutLe3CnO2G7yVfjd4VSabiCQwQYo5W-g=s120-c-br100"",""Rating"":0,""Description"":""I stayed here for almost two weeks for a work trip and it was a very comfortable and convenient place. It's located near some excellent restaurants, spas and the circle train. The staff are exceptionally nice and helpful, and the rooms were clean, comfortable and well stocked. The breakfast wasn't too great for me, although excellent if you're looking for a traditional regional breakfast experience. I would definitely stay here again when coming back to Yangon"",""Images"":null,""When"":""""},{""Name"":""david menzies"",""ProfilePicture"":""https://lh3.googleusercontent.com/a-/ALV-UjUGJRpfteWUet2jE75aVcRx0O0FVLJrgIQddlrsY4Fc73FJz7lqLg=s120-c-rp-mo-ba6-br100"",""Rating"":4,""Description"":""great location, close to markets, trains and buses.\nStaff are all very friendly and extremely helpful, from reception, security and \""car park\"" attendant.\nRooms are clean and tidy, some have been freshened up and have much better lighting (the others are a bit dim).\nBe mindful to request non-smoking room as smoking is till permitted in room here."",""Images"":null,""When"":""""},{""Name"":""Tolhah Simjee"",""ProfilePicture"":""https://lh3.googleusercontent.com/a-/ALV-UjVT8qrYwHNFWXekOYYWjIeSic-4Uh_X0uab56gfd34KxT4Rc68c=s120-c-rp-mo-ba3-br100"",""Rating"":4,""Description"":""It's a nice place for those who come to Yangon on a Business trip. It's nicely located at the heart of the downtown area. It has a reasonable Parking spaces. And also services are nice and all the staff are friendly. Also serve nice breakfast too. Rooms are a little bit small but it fits for its price."",""Images"":null,""When"":""""}]",
