input_id,link,title,category,address,open_hours,popular_times,website,phone,plus_code,review_count,review_rating,reviews_per_rating,latitude,longitude,cid,status,descriptions,reviews_link,thumbnail,timezone,price_range,data_id,images,reservations,order_online,menu,owner,complete_address,about,user_reviews,emails
24a35954-e2c5-4e5d-990a-d3e19751c547,https://www.google.com/maps/place/Botahtaung+Hotel/data=!4m10!3m9!1s0x30c1ed419db852c7:0x74373029560a6695!5m2!4m1!1i2!8m2!3d16.7732071!4d96.1723325!16s%2Fg%2F11ghrkj7v0!19sChIJx1K4nUHtwTARlWYKVikwN3Q?authuser=0&hl=en&rclk=1,Botahtaung Hotel,Hotel,"No.153, Middle Block, Botahtaung Pagoda Rd, Yangon 11161",{},{},https://www.botahtaunghotel.com/,09 256 800 036,Q5FC+7W Yangon,181,4.000000,"{""1"":7,""2"":6,""3"":42,""4"":51,""5"":75}",16.773207,96.172332,8374214986214041237,,"Unpretentious hotel offering a rooftop cafe/bar with a terrace, plus free parking.",https://search.google.com/local/reviews?placeid=ChIJx1K4nUHtwTARlWYKVikwN3Q&q=Botahtaung+Hotel&authuser=0&hl=en&gl=MM,//lh6.googleusercontent.com/Mi8Vh8I2Y93UhDQnA-bDdBkERJ9D0fZytUbwt2b1_jLNHvDJqNW82_pg1ZX3xDDAYg=w408-h306-k-no,Asia/Rangoon,,0x30c1ed419db852c7:0x74373029560a6695,"[{""title"":""All"",""image"":""//lh6.googleusercontent.com/Mi8Vh8I2Y93UhDQnA-bDdBkERJ9D0fZytUbwt2b1_jLNHvDJqNW82_pg1ZX3xDDAYg=w397-h298-k-no""},{""title"":""Rooms"",""image"":""https://lh5.googleusercontent.com/p/AF1QipOAas4VYNPtZQ1VthwtO7OYLvEt-BI_oHQ7QWQI=w502-h298-k-no""},{""title"":""Videos"",""image"":""https://lh3.googleusercontent.com/p/AF1QipOxag_BIGjJOOGKmcnPPYCqjYJZyLjvab_Sqd89=w242-h298-k-no""},{""title"":""Exterior"",""image"":""https://lh5.googleusercontent.com/p/AF1QipOte5Mn3xFfNquF9vktswOIRywFP4KjAjtCE_mX=w224-h298-k-no""},{""title"":""Food \u0026 drink"",""image"":""https://lh5.googleusercontent.com/p/AF1QipONGuw7r0WSdg-18JxcEbrIKAkdwcJscb1XYNv5=w397-h298-k-no""},{""title"":""From visitors"",""image"":""https://lh5.googleusercontent.com/p/AF1QipOYq-TZF6YkTDEIJnL37fo1TwKk_P61ZVbpChTM=w397-h298-k-no""},{""title"":""By owner"",""image"":""https://lh5.googleusercontent.com/p/AF1QipNYnrxptVclJZ9pbG41VsKF-BQQtl86PFO7bYlW=w224-h298-k-no""}]",null,null,"{""link"":"""",""source"":""""}","{""id"":""112978052089609586735"",""name"":""Botahtaung Hotel (Owner)"",""link"":""https://www.google.com/maps/contrib/112978052089609586735""}","{""borough"":"""",""street"":""No.153, Middle Block, Botahtaung Pagoda Rd"",""city"":""Yangon"",""postal_code"":""11161"",""state"":"""",""country"":""MM""}",null,"[{""Name"":""Phyo Thet Htun"",""ProfilePicture"":""https://lh3.googleusercontent.com/a-/ALV-UjXmvkw5Rs0yyzm8sufE0ESPPNlbskTjHrtLYU6uu_pC5SpnXqVa=s120-c-rp-mo-br100"",""Rating"":1,""Description"":""Although the reception department has good communication, there are some difficulties for long-term guests. Even long-term guests of the hotel's restaurant do not make any negotiation. I am a prepaid guest for 30 days, and the F\u0026B department does not accept that I order food from the hotel and pay every 2 or 3 days. The lighting in the room is dimmer than usual. For those who work from home, the inconvenient thing is that the internet connection is not good. In addition, the F\u0026B department even asked for 1000Ks to rent 2 empty plates, 2 spoons, and 1 bowl."",""Images"":null,""When"":""""},{""Name"":""Trip.com Member"",""ProfilePicture"":""https://lh3.googleusercontent.com/local-reviews/AJMZ0QeCck1CfANpZm9bBk3PHtP97Kh9k25HZfvq9yAWlN3BaIyjSHUPEfWkhAJmuYiJsH-_6g=s120-c-br100"",""Rating"":0,""Description"":""Easy hotel, good location with less traffic. Convenient to go anywhere with street food beside hotel."",""Images"":null,""When"":""""},{""Name"":""Thet T"",""ProfilePicture"":""https://lh3.googleusercontent.com/local-reviews/AJMZ0QeCck1CfANpZm9bBk3PHtP97Kh9k25HZfvq9yAWlN3BaIyjSHUPEfWkhAJmuYiJsH-_6g=s120-c-br100"",""Rating"":0,""Description"":""The rooms are very satisfying.  Quiet and clean.  The staff are friendly and helpful.  Good at housekeeping department  Especially the reception staffs are very friendly. Waiter and waitress have very excellent services.  It's cool to drink at the bar. What I would like to suggest is that the quality of the food should be improved even more. I will come later.  This hotel is very good in the downtown area."",""Images"":null,""When"":""""},{""Name"":""Roger B"",""ProfilePicture"":""https://lh3.googleusercontent.com/local-reviews/AJMZ0QfnSFWXMd1oJu73a6IhdtgibYcjse2HKQTHeghNQd9Cyw8DYQQJZDCyh-TD68ehXuY-FA=s120-c-br100"",""Rating"":0,""Description"":""The great thing about a boutique hotel is that it gets you closer to the natives.  The down side is that you never know exactly how the hotel will measure up.  There seems to be a serious shortage of mid-range options in the old town, and from a distance, the Botahtaung seems like a good option in the mid-range market.  It can be well located, depending on your needs and the staff are friendly.  On top of that, the rooftop bar is great.  But if you are looking for any services or quality that you might find in a four or five hotel out of the city center, you're going to be disappointed.  The hotel is subject to power outages.  Hot water is iffy.  The breakfast is thin.  The bed is Asian hard.  Shower on the floor, no tub.  While I can't say the Botahtaung is a major disappointment, I'd surely recommend giving another property a try if it might otherwise meet your location or pricing needs."",""Images"":null,""When"":""""},{""Name"":""Osbern Huang"",""ProfilePicture"":""https://lh3.googleusercontent.com/a-/ALV-UjUz2j_rGfuksqlcXlI8mmHXg424l9TNdhnDbUslB0cn1b95rQzLgw=s120-c-rp-mo-ba4-br100"",""Rating"":5,""Description"":""Stop thinking, just come here, and make your reservation DIRECTLY from their homepage. You won't regret it!\n\nAt first, my impression is so-so. Very noisy traffic and a constant dog barking outside. The room is clean and spacious overall (I live in the cheapest room), but clearly needs some renovation.\n\nHowever, the staff and the “Bar on Top” (the place you have your breakfast in the morning) win my heart in the end. Everyone is kind and talks with a smile, willing to solve your problem with action. The music in the restaurant is quite old-fashioned, but the foods are delicious and the price is unbeaten.\n\nOne more thing, this hotel is in proximity to Yangon’s historical downtown which is enclosed by plenty of marvellous colonial-era buildings.\n\nYou can check the photos I took. Gotta say I am ready to prepare for another visit right after I leave here."",""Images"":[""www.google.com/local/imagery/report/?cb_client=maps_sv.tactile\u0026image_key=!1e10!2sAF1QipN11upOYBMpd44n5SS3NmS4kNpZOn9lTBNnjupW\u0026fid=0x0:0x74373029560a6695""],""When"":""2023-1-8""},{""Name"":""Akash G"",""ProfilePicture"":""https://lh3.googleusercontent.com/local-reviews/AJMZ0QfjHmZg8gr7jpDgKhrh5KsR_Mq7L6pkVedvpKQz-f3LMiOd3OjI90CK4uLtF3wE59zZgA=s120-c-br100"",""Rating"":0,""Description"":""I stayed in Botahtaung Hotel for 5 nights and my stay was quite comfortable. The hotel staff was helpful and professional. I remember the reception staff helped me book the covid rt-pcr test when I wasn't able to contact the hospital. The breakfast was quite OK, but I guess it could be improved a bit by adding different varieties on different days. Overall I would definitely recommend this hotel to anyone visiting Yangon."",""Images"":null,""When"":""""},{""Name"":""Ma R"",""ProfilePicture"":""https://lh3.googleusercontent.com/local-reviews/AJMZ0Qf66pF81jsVXBxevYxxL5FsdlDsKAngAUpJVE-hAwai1rl8J0QnYqktKV3UGdpbmNlc_A=s120-c-br100"",""Rating"":0,""Description"":""Staying at this hotel is very convenient. They provide everything we need. Food and room are all convenient. Thank you very much to Mr Nanda, Mr Graham, Mr Nyein Chan Aung for all their help. If we will come yangon next time, we will stay here again.This hotel is one of the hotels you should stay in yangon."",""Images"":null,""When"":""""},{""Name"":""Mina Yang"",""ProfilePicture"":""https://lh3.googleusercontent.com/a-/ALV-UjWHG0wJwvCNHvb0nZ6vst8suRrGlXXpouFMLBcwTG_rs_A5tDVX=s120-c-rp-mo-ba2-br100"",""Rating"":5,""Description"":""Friendly, kind, hard-working, warm-hearted, helpful and wonderful staffs. Plus, amazing food, especially the breakfast. Breakfast buffet menu is changing everyday. New hotel, good facility. Worth going again."",""Images"":null,""When"":""""}]",
24a35954-e2c5-4e5d-990a-d3e19751c547,https://www.google.com/maps/place/Clover+Hotel+City+Center+Plus/data=!4m10!3m9!1s0x30c1ec86ab828de3:0x6091dfad9563e11c!5m2!4m1!1i2!8m2!3d16.7786721!4d96.158138!16s%2Fg%2F11f3rtp0h2!19sChIJ442Cq4bswTARHOFjla3fkWA?authuser=0&hl=en&rclk=1,Clover Hotel City Center Plus,Hotel,"299 32nd St, Yangon",{},{},,01 378 686,Q5H5+F7 Yangon,459,3.800000,"{""1"":23,""2"":30,""3"":116,""4"":154,""5"":136}",16.778672,96.158138,6958588835892814108,,,https://search.google.com/local/reviews?placeid=ChIJ442Cq4bswTARHOFjla3fkWA&q=Clover+Hotel+City+Center+Plus&authuser=0&hl=en&gl=MM,https://lh5.googleusercontent.com/p/AF1QipN4Eqv8IfAU0ianpRWAfCR-uyVSiUeLE7z5rGm2=w408-h271-k-no,Asia/Rangoon,,0x30c1ec86ab828de3:0x6091dfad9563e11c,"[{""title"":""All"",""image"":""https://lh5.googleusercontent.com/p/AF1QipN4Eqv8IfAU0ianpRWAfCR-uyVSiUeLE7z5rGm2=w447-h298-k-no""},{""title"":""Rooms"",""image"":""https://lh5.googleusercontent.com/p/AF1QipOVv1T76oEePe4X863YgCnUYWgQdYWmMPXGeWtw=w447-h298-k-no""},{""title"":""Videos"",""image"":""https://lh3.googleusercontent.com/p/AF1QipMw9EiD2SEMn5eCRMAo985llFzjCdB1EEw_fWRe=w224-h389-k-no""},{""title"":""Exterior"",""image"":""https://lh5.googleusercontent.com/p/AF1QipPxmBFmCr6bdsTWwpw8JOLmFMc01Zi_oQpBVsHD=w511-h298-k-no""},{""title"":""Amenities"",""image"":""https://lh5.googleusercontent.com/p/AF1QipPv52BO0wJw0YAFMHKmK4xbiyPCugYdU-9iaO_x=w298-h298-k-no""},{""title"":""Food \u0026 drink"",""image"":""https://lh5.googleusercontent.com/p/AF1QipMbOMkK4DdRE5jIae0s7j7wHCcoVu6GYlNSJUY-=w397-h298-k-no""},{""title"":""From visitors"",""image"":""https://lh5.googleusercontent.com/p/AF1QipPU3HfACyvxrXEr3b_1N2VPvv5kTanwGGW626LK=w447-h298-k-no""},{""title"":""By owner"",""image"":""https://lh3.googleusercontent.com/p/AF1QipMubWm0fVV4haQXQ4HrjfHqooNBgecl2L9axe4f=w224-h389-k-no""},{""title"":""Street View \u0026 360°"",""image"":""https://lh3.googleusercontent.com/p/AF1QipNVslrBGKi1W7RXWsYw9evTPdSWs4jEuvGXC718=w224-h298-k-no-pi-20-ya110.00002-ro0-fo100""}]",null,null,"{""link"":"""",""source"":""""}","{""id"":""117702862399604922290"",""name"":""Clover Hotel City Center Plus (Owner)"",""link"":""https://www.google.com/maps/contrib/117702862399604922290""}","{""borough"":"""",""street"":""299 32nd St"",""city"":""Yangon"",""postal_code"":"""",""state"":"""",""country"":""MM""}",null,"[{""Name"":""Eden Law"",""ProfilePicture"":""https://lh3.googleusercontent.com/a-/ALV-UjWijDZ8WDCvzDIbNE0WuwO_jX4XTu-ASjtDkU-LjujkXv6GWYt8Jg=s120-c-rp-mo-ba3-br100"",""Rating"":3,""Description"":""The hotel staff are very accommodating and friendly, and are happy to provide tips about the area. The rooms, though worn, are quite large and comfortable. I'm sensitive to some odours, so the toilet/shower room smelled a bit, but keeping the door shut solved that problem. Water bottles are complimentary, with a safe available for valuables. Breakfast is also included. Water pressure is a bit weak compared to what I'm used to. However, no real problems with our stay which is quite comfortable."",""Images"":null,""When"":""""},{""Name"":""Lynkster"",""ProfilePicture"":""https://lh3.googleusercontent.com/local-reviews/AJMZ0QdVsxDWqDDLG62Q3M3dmLlHORJs5jz0NWRJO3cP21KtRNPfosO7RpofjnbUgpyNjOTDew=s120-c-br100"",""Rating"":0,""Description"":""Staff was very accommodating when it was discovered that our room had a problem with the air-conditioning, moving us to this hotel at no extra cost. Reception is friendly (we had a good laugh with one of the staff). Our twin room was quite big, and although the furniture had some wear and tear, it was spotless. Water pressure was a bit weak, and there was a bit of an odour from the bathroom (probably the drain) so we kept the bathroom door shut - no problem. ||||Breakfast was complimentary, and they provided water bottles as well. We don't have any real issues with the hotel, and it is very conveniently located in downtown Yangon."",""Images"":null,""When"":""""},{""Name"":""Talia Waters"",""ProfilePicture"":""https://lh3.googleusercontent.com/a-/ALV-UjWOTHtjSNg3lf6hrI1dqt9sbU2eQaM9p0y6Mzg62TZvasvClIfqIw=s120-c-rp-mo-ba5-br100"",""Rating"":2,""Description"":""I was very disappointed in the hotel. The pictures are very misleading. The sheets had stains on them and you could tell they were very used. The bathroom is the kind that does not have an enclosed shower. I don’t mind that type of shower but the water fills the entire floor as the drain is by the toilet. The only positive to this hotel is the staff. There was a cockroach in our bathroom and someone was sent to kill it it after we called. We had to leave the hotel early in our last day and they packed breakfast for us to take with us. I would not recommend the Clover Hotel City Center if you are looking for a luxurious hotel stay."",""Images"":null,""When"":""""},{""Name"":""Marta K"",""ProfilePicture"":""https://lh3.googleusercontent.com/local-reviews/AJMZ0Qf66pF81jsVXBxevYxxL5FsdlDsKAngAUpJVE-hAwai1rl8J0QnYqktKV3UGdpbmNlc_A=s120-c-br100"",""Rating"":0,""Description"":""We booked a double room last minute because we wanted to run away from our previous hotel and we couldn't be happier. ||The basic double room had a good size, nice bathroom (basic but clean and that's all we cared about), and VERY big bed. AC worked perfectly, WiFi isn't the best, but enough to check your e-mail or Google Maps. Besides, we were on holidays so we were happy not to be too bothered with Internet. Staff was very friendly and prepared packed breakfast for us because we had an early flight. Location is excellent. There is a bus stop nearby that will take you too the airport and to the main bus station in Yangon. Otherwise, taxi is very cheap too - I do recommend using Grab app!"",""Images"":null,""When"":""""},{""Name"":""Meander778632"",""ProfilePicture"":""https://lh3.googleusercontent.com/local-reviews/AJMZ0Qf66pF81jsVXBxevYxxL5FsdlDsKAngAUpJVE-hAwai1rl8J0QnYqktKV3UGdpbmNlc_A=s120-c-br100"",""Rating"":0,""Description"":""The hotel is right in the city centre, making it very easy to get around.  The Staff are exceptionally helpful in all areas.  The rooms very clean and well supplied.||Only downside was the Breakfast, which is not so suitable for western diets and though served 7-10am, is prepared at 5am, leading to possible tummy problems."",""Images"":null,""When"":""""},{""Name"":""Gus Ferguson"",""ProfilePicture"":""https://lh3.googleusercontent.com/a-/ALV-UjUMhuygeEZ5fFBwa6Fp_vbsj5a4TQR6UwX4LxAu_Sgdxy1rtqpxZA=s120-c-rp-mo-ba5-br100"",""Rating"":4,""Description"":""Clover City Centre Plus is a 3 star basic hotel that is great value. It is clean, pretty modern, well serviced by staff hotel. Breakfast is good - range of local and western food choices. Lift to get to the to floors was good. Has a room safe. Pretty full whilst we were there.\nGreat value for the price."",""Images"":null,""When"":""""},{""Name"":""KT S"",""ProfilePicture"":""https://lh3.googleusercontent.com/local-reviews/AJMZ0QdCjMUwIiBikRhCLHgN_0vyGAo1GvT8DEukiKQb1ujC_eFsFjYrQ0OvLoSxPtqmCdgvFA=s120-c-br100"",""Rating"":0,""Description"":""Honestly after reading the scary review by Murt10, I was hesitant to book this hotel but I am glad my experience was great. ||||first the positives:  great location near sule pagoda, airport shuttle bus stop within 5min walk, a good Japanese restaurant a few doors away, KFC was nearby, short walking distance to sule mall and junction mall, clean room, big size bed can sleep 3 persons, good oriental breakfast with fruits (western only toasted bread), electronic safe, two complementary big bottle of drinking water, water boiler||||The not so good things: toilet has no shower screen, 1 and only slow lift, mosquitos, bad internet connection (I stayed at the furthest room), not much of city views to speak of, limited TV channel selections.||||If you can look pass the negative points, it is very worthy hotel to stay for the price you pay."",""Images"":null,""When"":""""},{""Name"":""Rungsan R"",""ProfilePicture"":""https://lh3.googleusercontent.com/local-reviews/AJMZ0QfnSFWXMd1oJu73a6IhdtgibYcjse2HKQTHeghNQd9Cyw8DYQQJZDCyh-TD68ehXuY-FA=s120-c-br100"",""Rating"":0,""Description"":""We picked the Clover City Center Plus Hotel due to the location near where we were familiar. It was located on the small street but very safe to walk and go around. We can reach the Super Market and go to Shangrila within a walking distance. Staff was friendly and try to accommodate our staying. The hotel had no sound proved; we can hear when guests talking in the hall way.|We booked a triple room and found that it was spacious for 3 and the hotel gave us 3 big bottles of drinking water daily."",""Images"":null,""When"":""""}]",
24a35954-e2c5-4e5d-990a-d3e19751c547,https://www.google.com/maps/place/Esperado+Lake+View+Hotel/data=!4m10!3m9!1s0x30c1ec944fd4becb:0xb807c82813413de5!5m2!4m1!1i2!8m2!3d16.7933055!4d96.1708524!16s%2Fg%2F11b6dpbgsw!19sChIJy77UT5TswTAR5T1BEyjIB7g?authuser=0&hl=en&rclk=1,Esperado Lake View Hotel,Hotel,"Q5VC+885 Esperado Lake View Hotel, No.23 Kan Yeik Tha Rd, Yangon 11221",{},{},,01 861 9486,,882,4.100000,"{""1"":37,""2"":20,""3"":132,""4"":297,""5"":396}",16.793305,96.170852,13260787702263004645,,"Relaxed hotel with free breakfast, plus a spa & a rooftop bar with live music on the weekends.",https://search.google.com/local/reviews?placeid=ChIJy77UT5TswTAR5T1BEyjIB7g&q=Esperado+Lake+View+Hotel&authuser=0&hl=en&gl=MM,//lh6.googleusercontent.com/hwHxgD2iLbfd7IakJ02wNeZaJ50GLsilOpkbaQk_vc3t5jHFUKlI-Si1QI21XRrf=w408-h306-k-no,Asia/Rangoon,,0x30c1ec944fd4becb:0xb807c82813413de5,"[{""title"":""All"",""image"":""//lh6.googleusercontent.com/hwHxgD2iLbfd7IakJ02wNeZaJ50GLsilOpkbaQk_vc3t5jHFUKlI-Si1QI21XRrf=w397-h298-k-no""},{""title"":""Latest"",""image"":""https://lh5.googleusercontent.com/p/AF1QipMiB2pJEtlvQIdDELATzcaQKQCnplXThuIKgG3S=w397-h298-k-no""},{""title"":""Videos"",""image"":""https://lh3.googleusercontent.com/p/AF1QipPL2p22r9__W-LYSwFGHNglP32GXJG4abNXYXpJ=w529-h298-k-no""},{""title"":""Rooms"",""image"":""https://lh5.googleusercontent.com/p/AF1QipN2r59G4cY0odCgcwB7EMrSDi5s35zL23xEsv0i=w434-h298-k-no""},{""title"":""Exterior"",""image"":""https://lh3.googleusercontent.com/p/AF1QipOACNiyyn1KFo0VFlNvMGCsO34F72O6IHhnYhe5=w529-h298-k-no""},{""title"":""Amenities"",""image"":""https://lh5.googleusercontent.com/p/AF1QipOKLpv3qgHVPi_B83A5pwms2LOpCLwUO2gvvl9V=w397-h298-k-no""},{""title"":""Food \u0026 drink"",""image"":""https://lh5.googleusercontent.com/p/AF1QipOKspmbmTv5yLbaZaTQTPZEJ_aTR2E6g4pHTP-7=w528-h298-k-no""},{""title"":""From visitors"",""image"":""https://lh5.googleusercontent.com/p/AF1QipPzlt5pVo-ks4dOxspDERUh6xYB1WQWoRTGnAX4=w397-h298-k-no""},{""title"":""Street View \u0026 360°"",""image"":""https://lh3.googleusercontent.com/p/AF1QipPCUywSkMnZZPOERNt1vzf340j8sL4osoG9UV7B=w224-h298-k-no-pi-10-ya353-ro-0-fo100""}]",null,null,"{""link"":"""",""source"":""""}","{""id"":""106714657046911807361"",""name"":""Esperado Lake View Hotel (Owner)"",""link"":""https://www.google.com/maps/contrib/106714657046911807361""}","{""borough"":"""",""street"":""Q5VC+885, No.23 Kan Yeik Tha Rd"",""city"":""Yangon"",""postal_code"":""11221"",""state"":"""",""country"":""MM""}",null,"[{""Name"":""Naw Seng Awng (Naw Naw)"",""ProfilePicture"":""https://lh3.googleusercontent.com/a-/ALV-UjV4Leoj14WqpS408sR_UqqY3wR0bqziO_oFRVuajzmNS3yS4rLdGA=s120-c-rp-mo-ba3-br100"",""Rating"":4,""Description"":""Had a really good stay at Esperado Lake View Hotel! The food was great, and I loved how good the service and WiFi were—no complaints at all. The rooftop bar is the real highlight, though! The view is amazing, especially in the evening.\n\nThe location is a big plus too. It’s right near Kandawgyi Lake, so if you like jogging in the morning, it’s perfect. Oh, and there’s a teahouse inside the hotel that’s honestly so good! The tea and snacks are delicious and super affordable.\n\nDefinitely a solid choice if you’re looking for a nice place to stay in Yangon!"",""Images"":[""www.google.com/local/imagery/report/?cb_client=maps_sv.tactile\u0026image_key=!1e10!2sAF1QipO9sW4JcbxLwwOh1ONcxAxWOWdsnidmwbuoodxW\u0026fid=0x0:0xb807c82813413de5""],""When"":""2025-2-14""},{""Name"":""Thu Prit"",""ProfilePicture"":""https://lh3.googleusercontent.com/a-/ALV-UjWRhc-ifqrhbB4KCBPZTs6f2FkvLpbB_ETVtztP1lmXaDi8_P8=s120-c-rp-mo-ba2-br100"",""Rating"":4,""Description"":""The rooftop has a great view, but lack in decoration, in order to attract more visitors and tourists, there should be more lounge space, light decoration and bar decoration. Every corner should be worth to take pictures since in Myanmar social media is a big deal.\n\nRooms and hallways need decoration and renovation, air-fresheners should be placed along hallways. The elevator card should be able to access any floor levels. My brother and his miso enjoyed the spa. The gym was in renovation.\n\nDownstairs restaurant is so loud, well most of the time I don’t understand so I don’t really care. Some of the reception desk staff are so lovely and nice with great smile. Front door assistances are so helpful.. even helping me in across the busy street.\nThe wifi is always in need of fixing, I had exams during my holiday.\n\nThe staff services are worth staying there. Thank you all the staff for helping us in every need. From Aussie."",""Images"":[""www.google.com/local/imagery/report/?cb_client=maps_sv.tactile\u0026image_key=!1e10!2sAF1QipOSMAzQaVXk1bz_FULNhqyWmCsGSkl9NoT_eveI\u0026fid=0x0:0xb807c82813413de5""],""When"":""2024-9-24""},{""Name"":""Rizwana Alvi"",""ProfilePicture"":""https://lh3.googleusercontent.com/a/ACg8ocIULvubkYRyX1ayLOe0Ea1FooMDAD4DIFOnhxUHcSo54si6UA=s120-c-rp-mo-br100"",""Rating"":5,""Description"":""Received excellent treatment from Thant Zin, Moe pyae paye mg, paye sone oo, nandar Lin, taw tar lin and nasir. Would stay here again!"",""Images"":null,""When"":""""},{""Name"":""Wai Yan Lin Thant"",""ProfilePicture"":""https://lh3.googleusercontent.com/a/ACg8ocKpDPQj_RlocPmb6Wz0axjkSZ-i5-nuhvJC0i4vJRJXqaPa3A=s120-c-rp-mo-br100"",""Rating"":1,""Description"":""This hotel is very old. The walls are deteriorating and bad sheets are wore down. I strongly not recommend this hotel if you are hygienic. They are much better choices in this price range.For bonus, this hotel has the worst view I have ever seen ."",""Images"":null,""When"":""""},{""Name"":""Trip.com Member"",""ProfilePicture"":""https://lh3.googleusercontent.com/local-reviews/AJMZ0QeCck1CfANpZm9bBk3PHtP97Kh9k25HZfvq9yAWlN3BaIyjSHUPEfWkhAJmuYiJsH-_6g=s120-c-br100"",""Rating"":0,""Description"":""We booked 2 Premier Corner Double Rooms for 3 nights each. On the first night we were only given 1 corner room, the other was a normal room. On the second evening we were given the second corner room after we intervened and insisted. When we arrived, both rooms had an extremely large number of mosquitoes that bit us all night and prevented us from sleeping well. One corner room had completely rusty tap water and there were no bath towels. We had to let the water run for a long time until it finally came out of the tap clear. The advertised lake view was not there, but we did have a view of the busy road and the trees. The breakfast was OK. Thank you for the packed lunch that we received on the last morning when we checked out early at around 5 a.m. Price-performance ratio is OK. But more like a 3 star hotel."",""Images"":null,""When"":""""},{""Name"":""Trip.com Member"",""ProfilePicture"":""https://lh3.googleusercontent.com/local-reviews/AJMZ0QeCck1CfANpZm9bBk3PHtP97Kh9k25HZfvq9yAWlN3BaIyjSHUPEfWkhAJmuYiJsH-_6g=s120-c-br100"",""Rating"":0,""Description"":""We stayed at Esparado lakeview hotel Yangon for one week. We changed room one time because we unexpectedly had to stay longer. We had a family room, one double bed and they put in an extra bed. It was a big room but old. The carpet was very old and dirty. No slippers to use. We liked the balcony to drink our coffee.Nearby is a shopping mall with Amazon coffe and bakery, and supermarket for fruit and snacks. The location of the hotel is convenient on the southside of the lake. We toke Grabb taxi most of the time but a walk by the lake was also nice."",""Images"":null,""When"":""""},{""Name"":""Khaing Soe Wai"",""ProfilePicture"":""https://lh3.googleusercontent.com/a/ACg8ocI13YUoC8lYEGHrW8qSvIqhJp-pNJkAYrhZDe1IbLc41GAXnA=s120-c-rp-mo-br100"",""Rating"":1,""Description"":""Receptionists are so rude to customer and can't even communicate with customer. If you don't have any patience, don't work as a receptionist. There's always customer right."",""Images"":null,""When"":""""},{""Name"":""Trip.com Member"",""ProfilePicture"":""https://lh3.googleusercontent.com/local-reviews/AJMZ0QeCck1CfANpZm9bBk3PHtP97Kh9k25HZfvq9yAWlN3BaIyjSHUPEfWkhAJmuYiJsH-_6g=s120-c-br100"",""Rating"":0,""Description"":""1. There is no safe. I have to request for it.2. Breakfast choice is limited. Only Myanmar breakfast and bread with butter \u0026 jam.3. The hotel looks old.4. The opposite room is under renovation and hence very noisy in the day."",""Images"":null,""When"":""""}]",
