input_id,link,title,category,address,open_hours,popular_times,website,phone,plus_code,review_count,review_rating,reviews_per_rating,latitude,longitude,cid,status,descriptions,reviews_link,thumbnail,timezone,price_range,data_id,images,reservations,order_online,menu,owner,complete_address,about,user_reviews,emails
24a35954-e2c5-4e5d-990a-d3e19751c547,https://www.google.com/maps/place/East/data=!4m10!3m9!1s0x30c1ec87464878bd:0x784165e31ef69d1d!5m2!4m1!1i2!8m2!3d16.7783374!4d96.1592117!16s%2Fg%2F12hsfh8cv!19sChIJvXhIRofswTARHZ32HuNlQXg?authuser=0&hl=en&rclk=1,East,Hotel,"Q5G4+MCW East, No. 234-240 Sule Pagoda Rd, Yangon",{},{},,09 731 35311,,299,3.500000,"{""1"":26,""2"":30,""3"":75,""4"":97,""5"":71}",16.778337,96.159212,8665319184189005085,,Straightforward rooms in an unassuming hotel offering free breakfast & a 24-hour cafe.,https://search.google.com/local/reviews?placeid=ChIJvXhIRofswTARHZ32HuNlQXg&q=East&authuser=0&hl=en&gl=MM,https://lh3.googleusercontent.com/gps-proxy/ALd4DhE0IrA60OPq1xx9g0ve6vE2rr9voj4YMQ8tkHL6RfEs1eeFlxxvq0e0bN_SIh3dl45Weg3DTO-wGJxZlXbEYAJGNbGcEEo8j5Fpz0prxGT2TmFT2JNxH8cn9rsHFyqS6PL0bqAcXbMf5Qpc2fndDM7C--rMuH0jJFL6Sh_y9730ILp5J0QRYorTkQ=w408-h306-k-no,Asia/Rangoon,,0x30c1ec87464878bd:0x784165e31ef69d1d,"[{""title"":""All"",""image"":""//lh3.googleusercontent.com/2RqXADrI17zkD3W0pKX0_HvVrW161CahpFkywcCDbiqTzLaMHnSsJKNHsdQ46X4=w529-h298-k-no""},{""title"":""Rooms"",""image"":""https://lh5.googleusercontent.com/p/AF1QipMa6c8BsGYug8Of8_Y3JOLPZf_dY9rge4mV9Mfl=w397-h298-k-no""},{""title"":""Videos"",""image"":""https://lh3.googleusercontent.com/p/AF1QipOZWw1ra0RlmXNOmuJBySKJgiTd2hAFcO94Dg5v=w224-h398-k-no""},{""title"":""Exterior"",""image"":""https://lh5.googleusercontent.com/p/AF1QipMQngNk4nivTxwVWB3qP9B60zDRJtbos47b93sH=w446-h298-k-no""},{""title"":""Food \u0026 drink"",""image"":""https://lh5.googleusercontent.com/p/AF1QipNL3k_vc_u1O5zx40uv5-REJoPA7ujgzO0isJS5=w397-h298-k-no""},{""title"":""From visitors"",""image"":""https://lh3.googleusercontent.com/p/AF1QipPr9inXGa6-478ib5qics6eZNAVYkiaxI6R-UIH=w529-h298-k-no""},{""title"":""Street View \u0026 360°"",""image"":""https://lh3.googleusercontent.com/p/AF1QipP4PP8FqQLNhf7SWvJDqqp31QaiLJyNb_ex_TCL=w224-h298-k-no-pi0-ya181.00002-ro-0-fo100""}]",null,null,"{""link"":"""",""source"":""""}","{""id"":"""",""name"":""East (Owner)"",""link"":""""}","{""borough"":"""",""street"":""Q5G4+MCW, No. 234-240 Sule Pagoda Rd"",""city"":""Yangon"",""postal_code"":"""",""state"":"""",""country"":""MM""}",null,"[{""Name"":""Hari K"",""ProfilePicture"":""https://lh3.googleusercontent.com/local-reviews/AJMZ0QdcKHisBXAOJmIugCgnKbcAscQkQI1t40WdQAMXk1g3ttzWj18FtKnHxNeSUm5OfHPMtQ=s120-c-br100"",""Rating"":0,""Description"":""I stayed here for a few days before shifting to another place. Rooms are a bit on the darker side without enough lighting. The air conditioners are old and take a long time to cool to some degree of comfort. Internet is okay and there is a table to work at with the computer.|The toilet is sort of an open toilet which may be fine for single occupancy, but even for couples, it may not be very nice. The bath also has a clear glass window from the work table and it will be a bit embarassing if say two work colleagues have to share a room. Found it odd.|The breakfast which was included in the fare was good, but the hotel does not have a restaurant after 2:00 pm. However, the location is very good and one can get some dinner from restaurants around. We requested for a slightly late checkout or a place to freshen up before  leaving for the airport, but the staff members could not allow. Most of the staff members do not speak English."",""Images"":null,""When"":""""},{""Name"":""convey766"",""ProfilePicture"":""https://lh3.googleusercontent.com/local-reviews/AJMZ0QejddW0yoGeT8LnCjh-OGQgsf6YKqhof3HZA5-um4yCkQej85oCdMUmKPJmnowcu5Ag5w=s120-c-br100"",""Rating"":0,""Description"":""We had enjoyable stay here for 5 Nights. We were slightly concerned by the negative remarks before we arrived but couldn't fault the hotel. Yes, it's old but it's beautifully clean and well kept. ||The toilet is located in a \""closet area\"" and shower in the room but both were fine.  The staff were amazingly helpful (we found this with all the Myanmar people we met); especially the doorman who regularly assisted us with obtaining taxis to get to the various sights at good prices.  ||There is a nice restaurant in the hotel. However, we recommend the Suzuki Restaurant (leave the hotel turn left and walk 2 mins to the base of the pedestrian bridge) which has English menus and used by locals  (always a good sign). There are also food courts within 5 mins walk at Junction City mall and at Sule Square mall (opp hotel).||Also, took the $10 heritage walk round the corner at the park outside the City Hall with Yangon Walks - book via email https://www.tripadvisor.com/Attraction_Review-g294191-d6643916-Reviews-Free_Yangon_Walks-Yangon_Rangoon_Yangon_Region.html ||"",""Images"":null,""When"":""""},{""Name"":""U. S."",""ProfilePicture"":""https://lh3.googleusercontent.com/a-/ALV-UjWPGPHHODNT9rwnvfRJI7WP-toP_P_DdSHWR37NoAx0EVleRvQH3w=s120-c-rp-mo-ba6-br100"",""Rating"":5,""Description"":""Very friendly, helpful and flexible hotel staff.\nThe hotel is very central located, the rooms are quiet, clean, old and simple furnished and could be more bright. For the good price it's reasonable.\nThe included breakfast was tasty. We felt warm welcome and enjoyed the great hospitality of the hotel crew."",""Images"":[""www.google.com/local/imagery/report/?cb_client=maps_sv.tactile\u0026image_key=!1e10!2sAF1QipMETKVeQcafOxn6NdGBU7K5qlb1-7OJuRGmrvCT\u0026fid=0x0:0x784165e31ef69d1d""],""When"":""2020-2-20""},{""Name"":""Yannaing Htun"",""ProfilePicture"":""https://lh3.googleusercontent.com/a-/ALV-UjWafy9LAx2LlrQ8SpvkfYH2CJZPpeDIQHwgbQoa8WX04krXuTA8yw=s120-c-rp-mo-ba4-br100"",""Rating"":4,""Description"":""Good to stay at the center of the city. Every place seems only walking distance away. The hotel itself provide good service. Room rate is reasonable for the location. The only problem for me is the toilet room. The use of the portable curtain instead of a real door is not good if you do not stay alone."",""Images"":null,""When"":""""},{""Name"":""Gayatri Bongarala"",""ProfilePicture"":""https://lh3.googleusercontent.com/a-/ALV-UjVZT3JvcEm-SlVL0-BhXubX-rVbYQVoT79RK5wLknuXul7eNpXt=s120-c-rp-mo-ba6-br100"",""Rating"":5,""Description"":""hotel is very clean and staff are very polite and  nice people. they are always ready to help you with any kind of changes you need to make your stay as comfortable as possible.they serve food which is OK, breakfast is great and it's complimentary. the only thing I dislike is the TV which has only 10 channels and in which 1 or 2 English channels.junior suite has bathtub but it's kind of small for 1 person to completely fit in."",""Images"":null,""When"":""""},{""Name"":""Rosa F"",""ProfilePicture"":""https://lh3.googleusercontent.com/local-reviews/AJMZ0QfnSFWXMd1oJu73a6IhdtgibYcjse2HKQTHeghNQd9Cyw8DYQQJZDCyh-TD68ehXuY-FA=s120-c-br100"",""Rating"":0,""Description"":""Hotel is in a great location for exploring downtown Yangon. ||Room was clean and spacious. Aircon worked great!||The shower and toliet set up is strange but not an issue if you are traveling with a friend! ||Breakfast was basic but nice. Very friendly doorman always smiling."",""Images"":null,""When"":""""},{""Name"":""Stephen E"",""ProfilePicture"":""https://lh3.googleusercontent.com/local-reviews/AJMZ0QeFH6dzZjd_ZFLhXHZKibEzXEy8hWzFB4Qa7PutLe3CnO2G7yVfjd4VSabiCQwQYo5W-g=s120-c-br100"",""Rating"":0,""Description"":""Room was dusty, the floor was sticky, no preasure on the shower. We book 4 rooms, and all the rooms have issues. Toilet is inside the room with no ventilation, STAY AWAY!! Their agoda pictures is from 2010 very deceiving. We moved to a different hotel only after 1 night of the 10 nights we booked. All the other guest also complain, again stay away travellers!!"",""Images"":null,""When"":""""},{""Name"":""Claudine Pierz Dunn"",""ProfilePicture"":""https://lh3.googleusercontent.com/a-/ALV-UjVJUJJMCeJUyOR_goW-ty-4ln8UCccckEbuJyhit1-BXR1Yy3v-=s120-c-rp-mo-ba3-br100"",""Rating"":4,""Description"":""Simple accommodations but comfortable. Free breakfast provided next door at Mr. Chef (spelled different) and they do provide room service. Free bottled water provided on every floor in a mini fridge. There are TV channels in English (not many) but one TV channel that is all crime shows. Clean rooms and clean, great smelling linens, air conditioner, tile floors, hair drier, beautiful shower with hot water but low pressure (just expect longer showers). Be sure to bring outlet converter, they have the 2 prong, tubular outlets. The staff is super friendly and attentive. If you want simple, no frills, comfortable, reasonably priced hotel stay this is definitely the way to go."",""Images"":null,""When"":""""}]",
24a35954-e2c5-4e5d-990a-d3e19751c547,https://www.google.com/maps/place/Nagani+Hotel/data=!4m10!3m9!1s0x30c1eb78107f725f:0x5e4fbd4c34b1b1c5!5m2!4m1!1i2!8m2!3d16.7745481!4d96.1426716!16s%2Fg%2F11c1r67s6y!19sChIJX3J_EHjrwTARxbGxNEy9T14?authuser=0&hl=en&rclk=1,Nagani Hotel,Hotel,"Q4FV+R37 Nagani Hotel, Yangon",{},{},,01 222 644,,63,3.800000,"{""1"":4,""2"":7,""3"":16,""4"":6,""5"":30}",16.774548,96.142672,6795858497724592581,,,https://search.google.com/local/reviews?placeid=ChIJX3J_EHjrwTARxbGxNEy9T14&q=Nagani+Hotel&authuser=0&hl=en&gl=MM,https://lh3.googleusercontent.com/gps-proxy/ALd4DhE51RTahs3MHy9z4Y0k8Ex82Lq4n2x8TYt9W6Sqa8X62flrXqVcgbzj_hdLH0v1Xnz36dLQLrVx7OZd4wKyQq2n1hD1RbuyKNhJ10s2k_40104MYVk96AT4qy0HgbpiXGXMgmEsn4CKr5FB7Kn6n5yPfEZonvqUOTy62goCGR68Izi9ettk3PLuXw=w408-h313-k-no,Asia/Rangoon,,0x30c1eb78107f725f:0x5e4fbd4c34b1b1c5,"[{""title"":""All"",""image"":""//lh4.googleusercontent.com/R9ws_QIQWI2SI6NaSD6oguCM6BrHNEzyPPWTnoJ4mloYzW-VGwWb1fMnWm-OuCAOuw=w397-h298-k-no""},{""title"":""Exterior"",""image"":""https://lh5.googleusercontent.com/p/AF1QipO46tD0G9vLNRfwFPH2aaLzcvE-WCGjPonVTlvI=w397-h298-k-no""},{""title"":""From visitors"",""image"":""https://lh5.googleusercontent.com/p/AF1QipOfRABN1zAFLIGGFbjj-7s01svjNnf8eZXv-wQ6=w224-h298-k-no""}]",null,null,"{""link"":"""",""source"":""""}","{""id"":"""",""name"":""Nagani Hotel (Owner)"",""link"":""""}","{""borough"":"""",""street"":""Q4FV+R37"",""city"":""Yangon"",""postal_code"":"""",""state"":"""",""country"":""MM""}",null,"[{""Name"":""thaw moe satt"",""ProfilePicture"":""https://lh3.googleusercontent.com/a-/ALV-UjW4C2pBsEnWm1bCN90yK4oAU1QO6Wcn8yFn8P9y8MOSAe7iUlg=s120-c-rp-mo-br100"",""Rating"":4,""Description"":""The staff is very friendly. The place is good and the price is reasonable. The bathroom is not very clean. Except for the bathroom, the rest is good"",""Images"":null,""When"":""""},{""Name"":""Ram B"",""ProfilePicture"":""https://lh3.googleusercontent.com/local-reviews/AJMZ0QfnSFWXMd1oJu73a6IhdtgibYcjse2HKQTHeghNQd9Cyw8DYQQJZDCyh-TD68ehXuY-FA=s120-c-br100"",""Rating"":0,""Description"":""I stay in nagani last month in yangon  room.is very nice Front office staff is very nice and helpful. Service nice. When I go to Yangon in future am liked stay in nagani 🏨 highly recommend this hotel..."",""Images"":null,""When"":""""},{""Name"":""rich fun"",""ProfilePicture"":""https://lh3.googleusercontent.com/a-/ALV-UjV2gnSBVzEEQS5obMQScxAB-pECGPhzZgiKQEZNhp_SkZFz_WTm=s120-c-rp-mo-br100"",""Rating"":2,""Description"":""Service not bad, room is big but dirty, sink didn't work well, bed sheets were dirty"",""Images"":null,""When"":""""},{""Name"":""min pyae"",""ProfilePicture"":""https://lh3.googleusercontent.com/a-/ALV-UjX4seGxT_GeitszeITKab93q1OebUBy0ChIpWovG8GVuhHp40Y=s120-c-rp-mo-ba3-br100"",""Rating"":5,""Description"":""It has nice River View \u0026 good service."",""Images"":[""www.google.com/local/imagery/report/?cb_client=maps_sv.tactile\u0026image_key=!1e10!2sAF1QipPndLAC3YzALvi5iW-Mgi4HJnD6bMR_5uiOhduw\u0026fid=0x0:0x5e4fbd4c34b1b1c5""],""When"":""2019-11-17""},{""Name"":""myatzin aung"",""ProfilePicture"":""https://lh3.googleusercontent.com/a-/ALV-UjWeIpUmu_He6C_lHs0EBYwXx1wEc39udaaVBLCc8qQdq9x_Mq4=s120-c-rp-mo-br100"",""Rating"":3,""Description"":""All Good"",""Images"":null,""When"":""""},{""Name"":""Naing Tun Lin"",""ProfilePicture"":""https://lh3.googleusercontent.com/a-/ALV-UjWzjqXrr05NxGKC3D-bTXrEDH8WLGjOSZE_iYPz32Vvvsq7P9zh=s120-c-rp-mo-ba2-br100"",""Rating"":5,""Description"":""Good river view"",""Images"":null,""When"":""""},{""Name"":""dragonknight deathprophet"",""ProfilePicture"":""https://lh3.googleusercontent.com/a-/ALV-UjVirf3hms20DCVX_od4wAofSq8u3G7exepLdeUtPbDb9LL8-gk=s120-c-rp-mo-br100"",""Rating"":3,""Description"":""I like a little bit"",""Images"":null,""When"":""""},{""Name"":""Tin Tun Aung"",""ProfilePicture"":""https://lh3.googleusercontent.com/a-/ALV-UjVEKXXhp1w4gX5VfiqwZDfbwUleDUXIa_23oeDCTAOt4OhUucyi=s120-c-rp-mo-ba2-br100"",""Rating"":5,""Description"":""very useful ❤️"",""Images"":null,""When"":""""}]",
24a35954-e2c5-4e5d-990a-d3e19751c547,https://www.google.com/maps/place/Serviced+Residence+by+85+SOHO+@+Upper+Pansodan/data=!4m10!3m9!1s0x30c1ec9a8b9857d9:0x3bc9c85287c93e77!5m2!4m1!1i2!8m2!3d16.790878!4d96.1633378!16s%2Fg%2F11h11kzzq3!19sChIJ2VeYi5rswTARdz7Jh1LIyTs?authuser=0&hl=en&rclk=1,Serviced Residence by 85 SOHO @ Upper Pansodan,Serviced accommodation,"137 Upper Pansodan Rd, Yangon 11222",{},{},http://85soho.com/,09 254 039 089,Q5R7+98 Yangon,48,4.100000,"{""1"":6,""2"":1,""3"":3,""4"":11,""5"":27}",16.790878,96.163338,4308194775347576439,,,https://search.google.com/local/reviews?placeid=ChIJ2VeYi5rswTARdz7Jh1LIyTs&q=Serviced+Residence+by+85+SOHO+@+Upper+Pansodan&authuser=0&hl=en&gl=MM,https://lh5.googleusercontent.com/p/AF1QipNxCNfR9k97L0CjDUCaJ417-FHol2ScbGGsqDct=w408-h306-k-no,Asia/Rangoon,,0x30c1ec9a8b9857d9:0x3bc9c85287c93e77,"[{""title"":""All"",""image"":""https://lh5.googleusercontent.com/p/AF1QipNxCNfR9k97L0CjDUCaJ417-FHol2ScbGGsqDct=w397-h298-k-no""},{""title"":""Latest"",""image"":""https://lh5.googleusercontent.com/p/AF1QipPKtE1Mbf_dK6pTGFbDA9_0TvpUIpKe88i_NJsZ=w224-h298-k-no""},{""title"":""Videos"",""image"":""https://lh3.googleusercontent.com/p/AF1QipPdQlMkdyVmIfRZl1Mzfs2NbXhDl3tc6Cp1fvKH=w224-h398-k-no""},{""title"":""Exterior"",""image"":""https://lh5.googleusercontent.com/p/AF1QipMQGdcG5b5mjcYdvZHjEpYb758J5e8RuY8YExrs=w298-h298-k-no""},{""title"":""Food \u0026 drink"",""image"":""https://lh5.googleusercontent.com/p/AF1QipMtuB2JUXgkfJsWmyh8TW7norsKGTBxEcwh7dfk=w613-h298-k-no""},{""title"":""From visitors"",""image"":""https://lh5.googleusercontent.com/p/AF1QipPUK5uMpsQJH1HffvTxuSIn9jgW_qsT7bvitJzL=w224-h298-k-no""}]",null,null,"{""link"":"""",""source"":""""}","{""id"":""116640945278852902491"",""name"":""Serviced Residence by 85 SOHO @ Upper Pansodan (Owner)"",""link"":""https://www.google.com/maps/contrib/116640945278852902491""}","{""borough"":"""",""street"":""137 Upper Pansodan Rd"",""city"":""Yangon"",""postal_code"":""11222"",""state"":"""",""country"":""MM""}",null,"[{""Name"":""Neel Kolhatker"",""ProfilePicture"":""https://lh3.googleusercontent.com/a-/ALV-UjWC34GJxIxDd3frYMYXHJtK-cZDZwVBPEfP5BDWnBb7rZgJg8of1Q=s120-c-rp-mo-ba4-br100"",""Rating"":2,""Description"":""This was my second time staying in this place. Compared to ten months ago, the apartments have gotten a lot of wear and tear. Little things aren't working like the AC remote, the door lock was missing batteries, the water heater switch was gone. You can tell the unit isn't cleaned completely. This apt building is still pretty new but it's already gone downhill. I can imagine in a year or two it will be in really bad condition.\n\nAnother thing is that when I tried to check in they claimed I paid too low a rate on Agoda so they would not honor my reservation. They said they had told Agoda but I never received any cancellation. It's completely wrong to force guests to come to your hotel and then tell them they cannot check in. They cld have cancelled my booking or at least sent a message thru Agoda. After an hour of waiting Agoda finally agreed to cover the price difference but I wldn't trust booking this place as they don't seem to know what they are doing with online bookings. If they want 40usd or more a night for this place I don't think it's good value as you can get a 4 star hotel for that much in Yangon.\n\nOther than these issues, it's in a good location, there are two small shops downstairs to buy water and a couple restaurants I didn't try. It's in a development of many new apt buildings but most are unoccupied. You can walk to a nearby mall, huge park, or South to the central area or it's a $1 Grab ride."",""Images"":null,""When"":""""},{""Name"":""Yuki San"",""ProfilePicture"":""https://lh3.googleusercontent.com/a/ACg8ocLzwG8uqoG2shcIbp8euWoWF7RD2Z9ltaS53e0xPOIFTlobcZM=s120-c-rp-mo-ba4-br100"",""Rating"":1,""Description"":""do not book this property on agoda. they do not honour their prices on agoda and will ask you for a higher rate. avoid at all costs."",""Images"":null,""When"":""""},{""Name"":""mohana krishna Ponna"",""ProfilePicture"":""https://lh3.googleusercontent.com/a-/ALV-UjWsfs7PTn-kNb0eo76riEUm6DjD5JQQc9kh8SEJjYT6E5smRJ8Idw=s120-c-rp-mo-ba4-br100"",""Rating"":5,""Description"":""Best service apartment\nBetter than normal hotel rooms,"",""Images"":null,""When"":""""},{""Name"":""이지현"",""ProfilePicture"":""https://lh3.googleusercontent.com/a/ACg8ocIyf9IMnC9BRaeuGNO0hems5a3N-h7Yxvv7cfNasW2A68eZPg=s120-c-rp-mo-br100"",""Rating"":5,""Description"":""This hotel is excellent for its price.I fully recommend it as a residence.\nThe room has a living room, a toilet, a bathroom, a shower, everything"",""Images"":null,""When"":""""},{""Name"":""YAH YA"",""ProfilePicture"":""https://lh3.googleusercontent.com/a-/ALV-UjU0QuIudPBUsHB-Cs5QI-VYKbTiyW3W1affQ__RfkrAFX52xW8J=s120-c-rp-mo-ba5-br100"",""Rating"":5,""Description"":""One of the Best Serviced Residence in Yangon City,\nReasonable price\n24 hours Electricity\nEnough Parking Space\nHigh Speed wifi\nClean n latest Toilet\nBig TV\nBig Refrigerator\n2 Air condition\nMicrowave n etc"",""Images"":[""www.google.com/local/imagery/report/?cb_client=maps_sv.tactile\u0026image_key=!1e10!2sAF1QipMfaqdHaTxKx2I1kH39gWe6an5SLxlqTUqIFBdZ\u0026fid=0x0:0x3bc9c85287c93e77""],""When"":""2024-2-4""},{""Name"":""Vladimir Pleshchenko"",""ProfilePicture"":""https://lh3.googleusercontent.com/a-/ALV-UjVbSdf5l15y_Mrg9u5Wj98IHkPaBinXlF7Ni4ZCse3KYV5upEgG=s120-c-rp-mo-ba4-br100"",""Rating"":5,""Description"":""Very good"",""Images"":null,""When"":""""},{""Name"":""Satur Mercury"",""ProfilePicture"":""https://lh3.googleusercontent.com/a-/ALV-UjVHFJGCCGhOfczUax4hZ8aw4eEwmGOa65CaF4mpsVvOj-Kld1k53A=s120-c-rp-mo-ba5-br100"",""Rating"":5,""Description"":""Very good"",""Images"":[""www.google.com/local/imagery/report/?cb_client=maps_sv.tactile\u0026image_key=!1e10!2sAF1QipPr-cfjpqgqUIs4ashE7I0TX9maqxBsuw__hKfZ\u0026fid=0x0:0x3bc9c85287c93e77""],""When"":""2024-12-26""},{""Name"":""Bimalangkar"",""ProfilePicture"":""https://lh3.googleusercontent.com/a-/ALV-UjV4wP91LfkXP--28B1r7_8zLNoTHIgiFawe8lgXq47xq089_U9z=s120-c-rp-mo-ba7-br100"",""Rating"":4,""Description"":""It's quiet and has a nice atmosphere around."",""Images"":[""www.google.com/local/imagery/report/?cb_client=maps_sv.tactile\u0026image_key=!1e10!2sAF1QipMzmdLDFTzsRoGzr9RVjZtsdFmpVow-NLxAAuZl\u0026fid=0x0:0x3bc9c85287c93e77""],""When"":""2023-9-7""}]",
24a35954-e2c5-4e5d-990a-d3e19751c547,https://www.google.com/maps/place/Hotel+588+AWBA/data=!4m10!3m9!1s0x30c1ed66d433a4b9:0x84b9681d0d69325b!5m2!4m1!1i2!8m2!3d16.8009216!4d96.1777439!16s%2Fg%2F11fkf5cqtl!19sChIJuaQz1GbtwTARWzJpDR1ouYQ?authuser=0&hl=en&rclk=1,Hotel 588 AWBA,Hotel,"Aw Bar St, Yangon",{},{},,09 44558 8588,R52H+93 Yangon,77,4.100000,"{""1"":6,""2"":4,""3"":9,""4"":16,""5"":42}",16.800922,96.177744,9563789757686297179,,,https://search.google.com/local/reviews?placeid=ChIJuaQz1GbtwTARWzJpDR1ouYQ&q=Hotel+588+AWBA&authuser=0&hl=en&gl=MM,https://lh5.googleusercontent.com/p/AF1QipM07vrc0XTIPs00U1a8NZyzi-kuIQc54M-cwCat=w408-h277-k-no,Asia/Rangoon,,0x30c1ed66d433a4b9:0x84b9681d0d69325b,"[{""title"":""All"",""image"":""https://lh3.googleusercontent.com/gps-cs-s/AB5caB9J3Wabz2Fd0zLfjFKOp0x8H7X2cNtNwtcLervMcBASyNdMflwUPAyDOqmUkoQWEcTv2hq11wZr_jqkSOsUfbuh0ScNJI_6vkGD2_Z5E-aV4VvikOed-SsxmhuEYoexuGo5iKE=w438-h298-k-no""},{""title"":""Rooms"",""image"":""https://lh3.googleusercontent.com/gps-cs-s/AB5caB-EIH3-gxZ4rqxvXwzLzrMEMUOfzVqUghER57LFr-MlSpFw7oqN4gBQZZLUt15iTIrdrgE0tYtG2uw1UZ9dNruYz7R6Y1vcFcnhgCAbeJMz1mSe_rCQNth9ho83y2VAaibu32iN=w446-h298-k-no""},{""title"":""Exterior"",""image"":""https://lh3.googleusercontent.com/gps-cs-s/AB5caB-0EHGLEZ-wVrGb5xdt0SXzJGA2EVDutQ_JaDItMzGPqX5-w-3zku-nouBqj3Ao_QV3lVdSs31bzLpB1BFA-vUTQsEoJTsxSQz9FQATifHW87qxCisg5BAAlT8xujD7ciw8xBXD=w367-h298-k-no""},{""title"":""Food \u0026 drink"",""image"":""https://lh3.googleusercontent.com/gps-cs-s/AB5caB9eHgoGlsRs1Wmu4BMlqa27kuT3yP7nuFZWE_zkSIHN8cGYaLb0v2B_9Y5a8BbCvBnIuvc-oY6Eot4hhA6ZUBOQfvqylf12dufZk8jrKIeS9uazCoQ4EpGhVuf7TAezbOja0Ifl=w224-h299-k-no""},{""title"":""From visitors"",""image"":""https://lh3.googleusercontent.com/gps-cs-s/AB5caB-icAodrOo5klXobHv0yrsdhbEwN3wQwQjbCHWGvPdrlNXUd9uu-wIqjEqQkSaJkfJpPZyJEhXf03IvLgeG4gl5d5KpFZVhJR_g0sTkrIkDAzgfYm2LCfP2li0zKycXhSLBk9YA=w376-h298-k-no""}]",null,null,"{""link"":"""",""source"":""""}","{""id"":""115368945928059204838"",""name"":""Hotel 588 AWBA (Owner)"",""link"":""https://www.google.com/maps/contrib/115368945928059204838""}","{""borough"":"""",""street"":""Aw Bar St"",""city"":""Yangon"",""postal_code"":"""",""state"":"""",""country"":""MM""}",null,"[{""Name"":""Chaw Sein"",""ProfilePicture"":""https://lh3.googleusercontent.com/a/ACg8ocJEOnPfLRMBYjqm9BXvw3TJmGLFaeLXVjVBdUa1VkeUTp1lgw=s120-c-rp-mo-br100"",""Rating"":1,""Description"":""I would like to give some advice kindly.\nplease check daily room services(house keeping)because room services is so bad.\nAnd need to repair some materials like changing the handle of toilet door and handle for clothes.\nAnother one is room is dirty. so need to paint coloring."",""Images"":null,""When"":""""},{""Name"":""hnin yy (hnin)"",""ProfilePicture"":""https://lh3.googleusercontent.com/a-/ALV-UjWk5D5VqaYJVkcswJuosFE1lJ6FQku-SPXZNjG5tG0KfyKQgSGC=s120-c-rp-mo-br100"",""Rating"":5,""Description"":""Worth your money, got more value than the price I paid for. Room was clean and elegant view was very enjoyable. Hotel staff very respectful. Food was the best. Definitely will visit again."",""Images"":null,""When"":""""},{""Name"":""Jack Lee"",""ProfilePicture"":""https://lh3.googleusercontent.com/a-/ALV-UjU5uExkVUxYMXI5ltwVzlLjLkP4JjTuqgSApYJ_AVZdP01lxYV62A=s120-c-rp-mo-br100"",""Rating"":5,""Description"":""The 588 Hotel staffs are very hospitable. The room were comfortable, clean and elegant. The overall common area is also very much enjoyable. Great neighborhood indeed. Checking in and checking out process is a breeze with flexibility to accommodate any changes to the booking dates. Security need is fully well equipped for the entire hotel and the rooms themselves. Price is reasonable and with more future amenities to be developed, the newly opened 558 Hotel is definitely a place to visit again and again."",""Images"":null,""When"":""""},{""Name"":""kyaw ye linn"",""ProfilePicture"":""https://lh3.googleusercontent.com/a-/ALV-UjXx5f00h6lBblrDKFWhCXgkBYtEMNqlgq3H3Q7HPbouDFLt5cBy=s120-c-rp-mo-ba5-br100"",""Rating"":4,""Description"":""Nice and clean rooms and good services, cheaper price than currently most of famous hotel, delicious breakfast. Like it."",""Images"":[""www.google.com/local/imagery/report/?cb_client=maps_sv.tactile\u0026image_key=!1e10!2sAF1QipMtQmn_AGOos1MS9a4AxyUD06vzujq6aXl4rhQc\u0026fid=0x0:0x84b9681d0d69325b""],""When"":""2023-9-12""},{""Name"":""sumyat mon"",""ProfilePicture"":""https://lh3.googleusercontent.com/a/ACg8ocLF_ni736vLvFfcKyakAYKKVTatUpFoIwyCOTNWuziR9GFRTQ=s120-c-rp-mo-br100"",""Rating"":5,""Description"":""I like it. Very very clean, and cozy place to stay in the center of Yangon. Staffs are very friendly and helpful. Clean room, fresh air, good material so, the service you get is more than what you paid. Highly recommend."",""Images"":null,""When"":""""},{""Name"":""Sam"",""ProfilePicture"":""https://lh3.googleusercontent.com/a-/ALV-UjWL9tK5OMoll6AwdJRpU2kORPn2PRUZLTJHm2KNJ77wlOXj16U=s120-c-rp-mo-ba4-br100"",""Rating"":4,""Description"":""There will be no elevator after the power outage· Nice waiter"",""Images"":null,""When"":""""},{""Name"":""Zin Minn Lwin"",""ProfilePicture"":""https://lh3.googleusercontent.com/a-/ALV-UjUCrOU8Y1SKI_waHKfI0syHDw2ofP-7inp-J3f7PZt9jrXSyuUT=s120-c-rp-mo-ba4-br100"",""Rating"":4,""Description"":""Long stay accept, individual rooms are available, rooms are neat and tidy with the deco of minimlism."",""Images"":null,""When"":""""},{""Name"":""faishal qureshi"",""ProfilePicture"":""https://lh3.googleusercontent.com/a-/ALV-UjUk4JVV1zeWmYb-NxVC4DKIkQaubYoRrhZWOPg2drrowXWlFeo=s120-c-rp-mo-br100"",""Rating"":5,""Description"":""Very nice room fully clean and hospitality by every body is also perfect i have booke room in this hotel 2 times seen also better before first"",""Images"":null,""When"":""""}]",
