input_id,link,title,category,address,open_hours,popular_times,website,phone,plus_code,review_count,review_rating,reviews_per_rating,latitude,longitude,cid,status,descriptions,reviews_link,thumbnail,timezone,price_range,data_id,images,reservations,order_online,menu,owner,complete_address,about,user_reviews,emails
24a35954-e2c5-4e5d-990a-d3e19751c547,https://www.google.com/maps/place/Hotel+Grand+Galaxy/data=!4m10!3m9!1s0x30c1edc9fc5bf7d9:0xb231b07d2ed29cdf!5m2!4m1!1i2!8m2!3d16.7722181!4d96.1700802!16s%2Fg%2F11sbpnkrgb!19sChIJ2fdb_MntwTAR35zSLn2wMbI?authuser=0&hl=en&rclk=1,Hotel Grand Galaxy,Hotel,"Bo Myat Htun St ရန်ကုုန်မြို့, Yangon",{},{},https://www.facebook.com/hotelgrandgalaxy.ygn,01 839 7985,Q5CC+V2 Yangon,65,3.900000,"{""1"":7,""2"":3,""3"":9,""4"":16,""5"":30}",16.772218,96.170080,12840238064312949983,,,https://search.google.com/local/reviews?placeid=ChIJ2fdb_MntwTAR35zSLn2wMbI&q=Hotel+Grand+Galaxy&authuser=0&hl=en&gl=MM,https://lh3.googleusercontent.com/gps-proxy/ALd4DhGsqah7v50k_DJvVqbnbuKZpctj9WJRDTqiJaoVRYBQUf56YLpqALOF_vYiChkVcI8RVjaokoH32wQ_4_max3W9wBBZc8e_77n-NER5UH_2advh7gt12LHJBTvMa9uIIDM78Dzn_etrlMYQQ8oZ1jSflQFPO_uFcwwqRAtFO9zcMrjlC6wqkbc=w426-h240-k-no,Asia/Rangoon,,0x30c1edc9fc5bf7d9:0xb231b07d2ed29cdf,"[{""title"":""All"",""image"":""https://lh5.googleusercontent.com/p/AF1QipP_NUlKGlrn_Vtb9c9WjsiGnRy6YpP5eLyGRSTP=w645-h298-k-no""},{""title"":""Latest"",""image"":""https://lh5.googleusercontent.com/p/AF1QipOQMGiy0MSPudgEWS5C7VtWG_Pc2XO9dXiL-VGh=w645-h298-k-no""},{""title"":""Rooms"",""image"":""https://lh5.googleusercontent.com/p/AF1QipO75z-Prfegs221OFiYfE-hx-LA-GRqvAv_6enL=w397-h298-k-no""},{""title"":""Exterior"",""image"":""https://lh5.googleusercontent.com/p/AF1QipP7C0kPeRefqEv3hSk6BvlFdFzEDJktvY6k0XqY=w224-h298-k-no""},{""title"":""Food \u0026 drink"",""image"":""https://lh5.googleusercontent.com/p/AF1QipOq9JQ1kBDaFap_cYhxPMOQ-8Aq94MEkYi2jvXr=w224-h298-k-no""},{""title"":""From visitors"",""image"":""https://lh5.googleusercontent.com/p/AF1QipPqQQTPBsVrLaANZgVN3H3lESFYYuY06o6coNih=w397-h298-k-no""},{""title"":""By owner"",""image"":""https://lh5.googleusercontent.com/p/AF1QipO9FV_VfA_e1UQElzNF303dd_SVqCuIARNanIwk=w397-h298-k-no""}]",null,null,"{""link"":"""",""source"":""""}","{""id"":""110853788378525385944"",""name"":""Hotel Grand Galaxy (Owner)"",""link"":""https://www.google.com/maps/contrib/110853788378525385944""}","{""borough"":"""",""street"":""Bo Myat Htun St ရန်ကုုန်မြို့"",""city"":""Yangon"",""postal_code"":"""",""state"":"""",""country"":""MM""}",null,"[{""Name"":""Roman Kasparyan"",""ProfilePicture"":""https://lh3.googleusercontent.com/a-/ALV-UjUj-6zUKPybMTBvYTXkmjIMo5C13mFp1A2u5SK2sDfFU2Hs8ctdug=s120-c-rp-mo-ba5-br100"",""Rating"":5,""Description"":""Stayed here twice. Decent budget-friendly, clean rooms and good breakfasts. They kindly allowed early check-in after a long bus ride. Convenient location. Special thanks to Mr. Yan at reception—very helpful young man who speaks excellent English."",""Images"":[""www.google.com/local/imagery/report/?cb_client=maps_sv.tactile\u0026image_key=!1e10!2sAF1QipNuIFBUk3AzLsG7zwf9JbomtHdY7zPF2bnhL9ws\u0026fid=0x0:0xb231b07d2ed29cdf""],""When"":""2024-12-27""},{""Name"":""MANJUNATH P"",""ProfilePicture"":""https://lh3.googleusercontent.com/a-/ALV-UjUAXm5J6UwXg8Ttiw9W3qSiFyFC-4N5sdoKETRRkVdkLLb-rdM=s120-c-rp-mo-ba2-br100"",""Rating"":5,""Description"":""Budget friendly Hotel, Decent location. Indian foods are at approachable distance. Very hardworking and Humble staffs."",""Images"":null,""When"":""""},{""Name"":""Jonathan Thaung"",""ProfilePicture"":""https://lh3.googleusercontent.com/a-/ALV-UjUSCwqISaQmoNy1rK1GFJqcadQYd96WFuSdt0fnMDrL3XM0u2RV=s120-c-rp-mo-br100"",""Rating"":1,""Description"":""The employees of F\u0026B thought they have right to rude on hotel customer. The one that I experienced is really bad."",""Images"":null,""When"":""""},{""Name"":""Trip.com Member"",""ProfilePicture"":""https://lh3.googleusercontent.com/local-reviews/AJMZ0QeCck1CfANpZm9bBk3PHtP97Kh9k25HZfvq9yAWlN3BaIyjSHUPEfWkhAJmuYiJsH-_6g=s120-c-br100"",""Rating"":0,""Description"":""Excellent customers service, great breakfast. Beautiful room especially the bathroom facilities, it’s world class!👍👍👍👍👍"",""Images"":null,""When"":""""},{""Name"":""T Yogurt"",""ProfilePicture"":""https://lh3.googleusercontent.com/a-/ALV-UjUblahpAzZvX42U2uW__d7IYFTwqgx1LH0A-kfh2f9dJtpbfNxU=s120-c-rp-mo-br100"",""Rating"":5,""Description"":""My stay at the Grand Galaxy Hotel was nothing short of extraordinary. From the moment I stepped into the lobby, I was captivated by the modern and elegant design. The architecture is stunning, and it sets the tone for a luxurious experience.\n\nThe rooms are incredibly spacious and well-appointed. The attention to detail is evident, from the comfortable bedding. I felt like every possible need was anticipated and met, making my stay exceptionally comfortable.\n\nWhat truly sets the Grand Galaxy Hotel apart is the outstanding service. The staff members are not only professional but also warm and welcoming. They go out of their way to ensure that guests feel attended to and valued. Whether it was a request for room service or assistance with local recommendations, the staff was always ready to help with a smile.\n\nDining at the hotel was a highlight of my stay. The variety of culinary options catered to every taste, and the quality of the food was outstanding. The chefs clearly prioritize using fresh and high-quality ingredients, creating a memorable dining experience.\n\nThe hotel's amenities are top-notch with a well-equipped fitness center.\n\nThe Grand Galaxy Hotel's location is also worth mentioning. It's conveniently situated, allowing easy access to key attractions and making it a great base for both business and leisure travelers.\nOverall, my experience at the Grand Galaxy Hotel was exceptional. I would highly recommend it to anyone looking for a blend of luxury, comfort, and outstanding service. It truly made my trip memorable, and I look forward to returning in the future😆"",""Images"":null,""When"":""""},{""Name"":""Road710189"",""ProfilePicture"":""https://lh3.googleusercontent.com/local-reviews/AJMZ0QfnSFWXMd1oJu73a6IhdtgibYcjse2HKQTHeghNQd9Cyw8DYQQJZDCyh-TD68ehXuY-FA=s120-c-br100"",""Rating"":0,""Description"":""The room with a street view looks grand. Everything smells good as it’s new. Hearty Breakfast at the rooftop is satisfying except for the juices are warm for the faulty dispenser. Noises from outside, unfortunately, can’t be shut out by the glass windows. Overall, Grand United Group never lets you down."",""Images"":null,""When"":""""},{""Name"":""Nadeem Karim"",""ProfilePicture"":""https://lh3.googleusercontent.com/a-/ALV-UjVrzZtW4fQfhNR4qtc1L9qRkfTzxz8X93o0sS1sxCPcU1RdDg_8=s120-c-rp-mo-ba2-br100"",""Rating"":4,""Description"":""Reasonable price but I can't say good Service because when I stayed with my Family and relative not even Towels were provied on time. It took almost 1 hour to receive Towels to our rooms. We wanted the rooms on the same floor. Inspite that there were Vacant rooms Receptionist didn't have us the rooms on the same floor.\nLittle bit unhappy with the service"",""Images"":null,""When"":""""},{""Name"":""Thura Kyaw"",""ProfilePicture"":""https://lh3.googleusercontent.com/a/ACg8ocLRy5U6sv-Ij_O3dF-SF-q9Ln_fwG3MmTRS39Dq2YajCu2LcQ=s120-c-rp-mo-br100"",""Rating"":3,""Description"":""Not the cleanest rooms but the vibe is good"",""Images"":null,""When"":""""}]",
24a35954-e2c5-4e5d-990a-d3e19751c547,https://www.google.com/maps/place/Yangon+Excelsior/data=!4m10!3m9!1s0x30c1ec80b865e153:0x50e202afd9ca1d21!5m2!4m1!1i2!8m2!3d16.772566!4d96.1570755!16s%2Fg%2F11df0qfqtj!19sChIJU-FluIDswTARIR3K2a8C4lA?authuser=0&hl=en&rclk=1,Yangon Excelsior,Hotel,"19/43 Bo Soon Pat Street, Yangon 11143",{},{},,01 925 3861,Q5F4+2R Yangon,219,4.600000,"{""1"":5,""2"":1,""3"":14,""4"":28,""5"":171}",16.772566,96.157075,5828223822067277089,,"Stylish luxury hotel in a 19th-century building with vintage-chic quarters, a spa & a cafe/bar.",https://search.google.com/local/reviews?placeid=ChIJU-FluIDswTARIR3K2a8C4lA&q=Yangon+Excelsior&authuser=0&hl=en&gl=MM,https://lh5.googleusercontent.com/p/AF1QipNeT1_4O_Febt_Sncs7v6x5wDBVNE4_FhTd_Fpp=w408-h507-k-no,Asia/Rangoon,,0x30c1ec80b865e153:0x50e202afd9ca1d21,"[{""title"":""All"",""image"":""https://lh5.googleusercontent.com/p/AF1QipNeT1_4O_Febt_Sncs7v6x5wDBVNE4_FhTd_Fpp=w239-h298-k-no""},{""title"":""Latest"",""image"":""https://lh5.googleusercontent.com/p/AF1QipNv0SDJPDHJx60oCoI8doetxBcyLkDb48wm65ex=w224-h398-k-no""},{""title"":""Videos"",""image"":""https://lh3.googleusercontent.com/p/AF1QipN6HTZE_yi6jp4sw6lXYiPnrsD1XVyumjGgvFnx=w529-h298-k-no""},{""title"":""Rooms"",""image"":""https://lh5.googleusercontent.com/p/AF1QipP0wW_ef2IOWsd_fod9dS60cXBQ3ZnN5pkPTBvc=w447-h298-k-no""},{""title"":""Exterior"",""image"":""https://lh5.googleusercontent.com/p/AF1QipOHCKSWGM0KhL5hpJiD7oEGoIIoquHeyJakyV-y=w448-h298-k-no""},{""title"":""Amenities"",""image"":""https://lh5.googleusercontent.com/p/AF1QipM8ZyJWXNAHH0F832I0OUHl-X9lyK77oFifbaKN=w496-h298-k-no""},{""title"":""Food \u0026 drink"",""image"":""https://lh5.googleusercontent.com/p/AF1QipPOmxOCP3BGpUTh5r2Xf_iXhH31ws824LBws8N1=w447-h298-k-no""},{""title"":""From visitors"",""image"":""https://lh5.googleusercontent.com/p/AF1QipOhL8hwqVrp0mZCYNSGuENwHVD5UtUSKfBUwN55=w529-h298-k-no""},{""title"":""By owner"",""image"":""https://lh3.googleusercontent.com/p/AF1QipNTeUQUEz5WJUe8aEz0-L-JQN4Yjo6G0771N7ad=w529-h298-k-no""}]",null,null,"{""link"":"""",""source"":""""}","{""id"":""117978129203356308926"",""name"":""Yangon Excelsior (Owner)"",""link"":""https://www.google.com/maps/contrib/117978129203356308926""}","{""borough"":"""",""street"":""19/43 Bo Soon Pat Street"",""city"":""Yangon"",""postal_code"":""11143"",""state"":"""",""country"":""MM""}",null,"[{""Name"":""Chuck Winston"",""ProfilePicture"":""https://lh3.googleusercontent.com/a-/ALV-UjUSL3AyAdNk-Ht9IAooakqNt8f4Mhm_ek-Et0vbI4yH-dOyzaxa=s120-c-rp-mo-ba3-br100"",""Rating"":5,""Description"":""Beautifully designed hotel with incredible staff that deliver some of the best customer service I’ve experienced travelling the world.\n\nI’ve stayed twice at this boutique hotel and each time and has been amazing. Breakfast is delicious. The rooms are smartly designed and very modern. Bath products are high quality and smell great. The bed is a huge and super comfortable.\n\nBut it’s really the warm, friendly service of the staff that go above and beyond for their customers. Definitely stay at this hotel! 5 stars across the board."",""Images"":[""www.google.com/local/imagery/report/?cb_client=maps_sv.tactile\u0026image_key=!1e10!2sAF1QipNv0SDJPDHJx60oCoI8doetxBcyLkDb48wm65ex\u0026fid=0x0:0x50e202afd9ca1d21""],""When"":""2025-2-9""},{""Name"":""虫でんでん"",""ProfilePicture"":""https://lh3.googleusercontent.com/a-/ALV-UjWQPBZVFChh17W1uwK-kHg40vXm55PH8HVLZdtsmlJr0MQYjd1N=s120-c-rp-mo-ba5-br100"",""Rating"":5,""Description"":""2024.12\n\nEasily the best hotel in Myanmar. I had a very pleasant stay.  Cleanliness standard surpasses that of luxury resorts in Japan. Service was top notch. Everything was personalized. The entire room had a 5 meter high ceiling. It was amazing. Come and enjoy this wonderful hotel with confidence. Don’t bother with the Lotte hotel, it’s just a rip off compared to what you get here."",""Images"":[""www.google.com/local/imagery/report/?cb_client=maps_sv.tactile\u0026image_key=!1e10!2sAF1QipOKHAT9RoCHqEujWwHDT9WVFNFQXOwH1frejj6m\u0026fid=0x0:0x50e202afd9ca1d21""],""When"":""2024-12-18""},{""Name"":""Steven Dignef"",""ProfilePicture"":""https://lh3.googleusercontent.com/a-/ALV-UjVX4AzW7OYqQxT68_aQLz2yt2btpnZdkKivtKR4otAVlov_YlV4=s120-c-rp-mo-br100"",""Rating"":5,""Description"":""The hotel was just wonderful. The staff was super friendly and the rooms were amazing. Big and spacious. Comfy beds. Nice hot shower. Curtains make the room nice and dark.\nThe staff goes out of their way to help you with any problem you might have. Restaurant has a big menu, nice wines and is very affordable. If we ever return to Yangon, we know which hotel to pick. We miss it already."",""Images"":[""www.google.com/local/imagery/report/?cb_client=maps_sv.tactile\u0026image_key=!1e10!2sAF1QipP09JbAZkaa684azr2XoLyyzO3akQtHW47vTv4-\u0026fid=0x0:0x50e202afd9ca1d21""],""When"":""2024-12-2""},{""Name"":""Nora J"",""ProfilePicture"":""https://lh3.googleusercontent.com/a-/ALV-UjXmqHQ7v5UBiY5fodTF8fF5yrGtHQcmWrdcB6Ld2qntGTBTX7C9=s120-c-rp-mo-ba5-br100"",""Rating"":5,""Description"":""The Hotel Excelsior in Yangon is a true gem, offering a seamless blend of elegance, comfort, and exceptional hospitality. It all began with their incredible whiskey sour—undeniably the best in town, served in a stunning setting where every detail is meticulously designed. The charm of the place drew us back, and we decided to stay. It turned out to be the best decision.\n\nEvery aspect of the hotel reflects impeccable craftsmanship, from the thoughtfully curated decor to the luxurious, supremely comfortable beds. The attention to detail is evident in every corner, creating an atmosphere of understated sophistication.\n\nThe location is unbeatable, right in the heart of Yangon, making it the perfect base to explore the city’s vibrant energy. Whether you’re stopping by for a drink or staying for a few nights, the Hotel Excelsior is an experience you won’t forget."",""Images"":[""www.google.com/local/imagery/report/?cb_client=maps_sv.tactile\u0026image_key=!1e10!2sAF1QipNUCseS7eoizx99VHTT3oXchzuJaHyHgmgTPsK2\u0026fid=0x0:0x50e202afd9ca1d21""],""When"":""2024-11-27""},{""Name"":""Ngoc “Allie” Le"",""ProfilePicture"":""https://lh3.googleusercontent.com/a/ACg8ocK21bwjP00Waa4Vo9Co3Tdwzo7tEvwXRgHEl6FOBnF-WW3m42uo=s120-c-rp-mo-br100"",""Rating"":5,""Description"":""I’ve got the chance to stay at this wonderful hotel where I got to meet and talk to many very welcoming, kind, attentive and friendly staff who made my stay 1000% better. They went above and beyond to make sure my stay was comfortable and all my needs were met,….even took care of me and made sure I felt better when I got suddenly ill.\n\nOn the other hand, the interior of the hotel is classy with a vintage touch. The breakfast and drinks here are also very very good. The location is right in the city centre, few steps away from Sule Pagoda and Chinatown.\n\nI cannot say enough how glad I am to have stayed there and thankful that got the chance to meet such beautiful human beings (staff)."",""Images"":null,""When"":""""},{""Name"":""Trip.com Member"",""ProfilePicture"":""https://lh3.googleusercontent.com/local-reviews/AJMZ0QeCck1CfANpZm9bBk3PHtP97Kh9k25HZfvq9yAWlN3BaIyjSHUPEfWkhAJmuYiJsH-_6g=s120-c-br100"",""Rating"":0,""Description"":""Nice ambience and surprise given the location. Spacious and Cozy room. Comfortable bed and had all the basic amenities. Accommodating and helpful reception staff. Restaurant and staff were great/ Value for money. Would stay again if in the neighborhood."",""Images"":null,""When"":""""},{""Name"":""Scenic20175077530"",""ProfilePicture"":""https://lh3.googleusercontent.com/local-reviews/AJMZ0QeFH6dzZjd_ZFLhXHZKibEzXEy8hWzFB4Qa7PutLe3CnO2G7yVfjd4VSabiCQwQYo5W-g=s120-c-br100"",""Rating"":0,""Description"":""A refined setting with attentive service, as soon as you enter Yangon Excelsior, you can’t help but be amazed by the beauty of the entrance hall. The entire decor is crafted down to the smallest detail, with smiling staff always ready to assist you with any matter. I had the chance to have lunch at the Newsroom restaurant, which serves delicious cuisine and French wines that seem endless. The rooms are spacious and stunning, with a bed so comfortable that you won’t want to leave, and a splendid bathroom. If you're going to Yangon, there’s no doubt that Yangon Excelsior Hotel is the place to choose, with more than affordable prices and five-star service. If you just want to spend time with friends over afternoon tea, this hotel will become your favorite spot."",""Images"":null,""When"":""""},{""Name"":""Trip.com Member"",""ProfilePicture"":""https://lh3.googleusercontent.com/local-reviews/AJMZ0QeCck1CfANpZm9bBk3PHtP97Kh9k25HZfvq9yAWlN3BaIyjSHUPEfWkhAJmuYiJsH-_6g=s120-c-br100"",""Rating"":0,""Description"":""This hotel is too good to be true. The room is so big and spacious, very comfortable bed. All of the staff are extremely helpful and friendly. The housekeeping is very hardworking and paying attention to all details.  We love our stay in the great hotel."",""Images"":null,""When"":""""}]",
