input_id,link,title,category,address,open_hours,popular_times,website,phone,plus_code,review_count,review_rating,reviews_per_rating,latitude,longitude,cid,status,descriptions,reviews_link,thumbnail,timezone,price_range,data_id,images,reservations,order_online,menu,owner,complete_address,about,user_reviews,emails
acef974c-af2e-48d4-9916-dd775357ac5c,https://www.google.com/maps/place/ZEALAX+HOTEL+%26+RESIDENCE/data=!4m10!3m9!1s0x30c1ebb004ec972b:0x59ca7abe78a745ed!5m2!4m1!1i2!8m2!3d16.7851809!4d96.1254847!16s%2Fg%2F11j08brhhh!19sChIJK5fsBLDrwTAR7UWneL56ylk?authuser=0&hl=en&rclk=1,ZEALAX HOTEL & RESIDENCE,Hotel,"16 ကမ်းနားလမ်း, Yangon 11121",{},{},http://www.zealaxhotels.com/,01 230 2660,Q4PG+35 Yangon,218,4.500000,"{""1"":10,""2"":0,""3"":14,""4"":46,""5"":148}",16.785181,96.125485,6470118773157742061,,"Sophisticated property featuring river views & 24-hour dining, plus a spa, a gym & an indoor pool.",https://search.google.com/local/reviews?placeid=ChIJK5fsBLDrwTAR7UWneL56ylk&q=ZEALAX+HOTEL+%26+RESIDENCE&authuser=0&hl=en&gl=MM,https://lh3.googleusercontent.com/gps-proxy/ALd4DhFpxnMrtxLrvdgrILHEQF-9DPRW-yEQEnj8wQl7cSXavMYdYUkaR1zh-rCGgiheuIWcmADMOT9-RMggMw6tChoWTsFXc5XXtV4vrtWiuMyWVmeoA5d40ZQ3IHL-qcQHKIZSpj1sKrm6Od-ZsbiZCzk2S69lssGBb0TqrM-OAB2ZADjGYs0qXPM=w408-h271-k-no,Asia/Rangoon,,0x30c1ebb004ec972b:0x59ca7abe78a745ed,"[{""title"":""All"",""image"":""https://lh5.googleusercontent.com/p/AF1QipPIbyOwMMHiG2AeDH0IW9beBF19ZmpimuY65AHE=w447-h298-k-no""},{""title"":""Latest"",""image"":""https://lh5.googleusercontent.com/p/AF1QipOGN9WCAbs77RNNIlqN-LwALlkWsrjGE_sP-lWv=w397-h298-k-no""},{""title"":""Videos"",""image"":""https://lh3.googleusercontent.com/p/AF1QipOqc-39vR9rFzDWWfUoV7GkpIKwR-2yub84EGWj=w529-h298-k-no""},{""title"":""Rooms"",""image"":""https://lh5.googleusercontent.com/p/AF1QipPiyY6eV1uQgvsgRYvm4nmx-Hi89ipHM8Vdy2rm=w447-h298-k-no""},{""title"":""Exterior"",""image"":""https://lh3.googleusercontent.com/p/AF1QipNBYWbnezKrkEw4-kYpg08Zsx9lunC9Jfl4dB7r=w529-h298-k-no""},{""title"":""Amenities"",""image"":""https://lh5.googleusercontent.com/p/AF1QipNEdhxfEUSK9pE_itcOSRuMnvjEyRtiKw2DqR6f=w397-h298-k-no""},{""title"":""Food \u0026 drink"",""image"":""https://lh5.googleusercontent.com/p/AF1QipPS226OrOqiBBBwAAXxHi-YsI4ELWqw9El8kXRJ=w397-h298-k-no""},{""title"":""From visitors"",""image"":""https://lh5.googleusercontent.com/p/AF1QipONfDbc43kucWnebkwXVsqIwHyx82eLa-FdYBH2=w529-h298-k-no""},{""title"":""By owner"",""image"":""https://lh5.googleusercontent.com/p/AF1QipPIbyOwMMHiG2AeDH0IW9beBF19ZmpimuY65AHE=w447-h298-k-no""}]",null,null,"{""link"":"""",""source"":""""}","{""id"":""105942872993165809623"",""name"":""ZEALAX HOTEL \u0026 RESIDENCE (Owner)"",""link"":""https://www.google.com/maps/contrib/105942872993165809623""}","{""borough"":"""",""street"":""16 ကမ်းနားလမ်း"",""city"":""Yangon"",""postal_code"":""11121"",""state"":"""",""country"":""MM""}",null,"[{""Name"":""Josephine Ong"",""ProfilePicture"":""https://lh3.googleusercontent.com/a/ACg8ocJIBiXJch7kxYWvVG39oD9Jt8NSchXS9HGXCmX0PiYIojmZnA=s120-c-rp-mo-ba5-br100"",""Rating"":5,""Description"":""It's rare to see a 5-star hotel in this location and facing the river and near to the port.\nWe made enquiries about long-term stay. The rooms either face the Shwedagon or river.\n\nThe hotel has a conference room, ballroom and seminar rooms, spas and saunas for male and female inside the restrooms at the pool.\n\nEverything is impressive! Worth spending a night here or just walk in to at the restaurant."",""Images"":[""www.google.com/local/imagery/report/?cb_client=maps_sv.tactile\u0026image_key=!1e10!2sAF1QipNCktANUXuDeGjKZpSOgfQ9xOpDJXa4CfS8VW4Q\u0026fid=0x0:0x59ca7abe78a745ed""],""When"":""2025-2-19""},{""Name"":""emily t"",""ProfilePicture"":""https://lh3.googleusercontent.com/local-reviews/AJMZ0QdDVsOCeofRZJ7E-5_OmGTopxhKLKgrRyRiBqSVIkkG6ZY8A0xH5cj33o1mJn3HSwPBIA=s120-c-br100"",""Rating"":0,""Description"":""We spent two nights here on staycation and I must say that everything was excellent. The location of the hotel is very amazing river view in the city.I also enjoyed the delicious breakfast each morning and swimming pool area have also jacuzzi. Their roof top bar is panoramic view and  a relaxed atmosphere. As for the room , it is excellent and surprisingly comfortable. We would love to stay here again."",""Images"":null,""When"":""""},{""Name"":""Nann Htet W"",""ProfilePicture"":""https://lh3.googleusercontent.com/local-reviews/AJMZ0QeNj0UTN0yIrCGyJ0JhWwDODOg5QjAH0gdfB9Ji-oFl0zWFI-YVmhNAr-FGLycdpIjFmw=s120-c-br100"",""Rating"":0,""Description"":""Nice Hotel with amazing view…. The swimming pool also has water heated system and the atmosphere is really cool… The breakfast was delicious and the staffs are really helpful… Once again Thanks for their kindness and I can’t wait to come again.."",""Images"":null,""When"":""""},{""Name"":""Trip.com Member"",""ProfilePicture"":""https://lh3.googleusercontent.com/local-reviews/AJMZ0QeCck1CfANpZm9bBk3PHtP97Kh9k25HZfvq9yAWlN3BaIyjSHUPEfWkhAJmuYiJsH-_6g=s120-c-br100"",""Rating"":0,""Description"":""I recently stayed at the Zealax Hotel for 2 nights in November  2024, and it was one of the best hotel experiences I’ve ever had. This trip was for leisure, and I booked a deluxe room with a pagoda views, hoping for a relaxing getaway. The hotel exceeded all my expectations in every way."",""Images"":null,""When"":""""},{""Name"":""JJ Ling"",""ProfilePicture"":""https://lh3.googleusercontent.com/a-/ALV-UjUKIB16DcmTT82aeFJp6Jikevrb4TQ6pIJW9AjVCaXt-P5-Qlc=s120-c-rp-mo-br100"",""Rating"":1,""Description"":""We were asked to provide NRC although we had provided our passports and asked to leave the hotel as one of us couldn’t provide the NRC. What ironic was they asked us to pay half even it was them wanted us to leave.\n\nIt was at night 9 pm when curfew was 10 pm at that time.We reused the reception to leave and a lady named she is the manager came out and insisted us to leave and asked us to pay half. But we didn’t agree to pay or leave as we all have passports and it is government approved ID.\n\nAfter talking an hour with the manager who looked like a cook, we had no choice and had to leave and went to Novotel as she kicked us out.\n\nIt was my Fri bachelor party night. Our decoration in the room has as to leave as it was. They ruined our bachelor party. (Around 15 ~ 17  Dec 2023)."",""Images"":null,""When"":""""},{""Name"":""Mg H"",""ProfilePicture"":""https://lh3.googleusercontent.com/local-reviews/AJMZ0Qf66pF81jsVXBxevYxxL5FsdlDsKAngAUpJVE-hAwai1rl8J0QnYqktKV3UGdpbmNlc_A=s120-c-br100"",""Rating"":0,""Description"":""My favourite hotel in Yangon because the restaurant is really great and clean. Breakfast buffet is very delicious and nice. Hotel swimming pool is really good and safe to swim for customers. And then staffs are very lovely. By the way Mr. Myo Dan Li is really helpful and kind on me. Thanks for your kindness."",""Images"":null,""When"":""""},{""Name"":""KaungSett23"",""ProfilePicture"":""https://lh3.googleusercontent.com/local-reviews/AJMZ0QdCjMUwIiBikRhCLHgN_0vyGAo1GvT8DEukiKQb1ujC_eFsFjYrQ0OvLoSxPtqmCdgvFA=s120-c-br100"",""Rating"":0,""Description"":""Zealax hotel breakfast is really delicious and nice. Swimming pool is really clean and safe to swim for children. Staffs are very kind especially Ko Myo Dan Li. He is really helpful and  lovely on customers. I am always come here with my friends because servers are really perfect."",""Images"":null,""When"":""""},{""Name"":""amuletangel amuletangel"",""ProfilePicture"":""https://lh3.googleusercontent.com/a/ACg8ocLQS6uHdVlcSVDw29WgLN8sAKkRlFnxw0EeESAKbTmTEqcwNw=s120-c-rp-mo-br100"",""Rating"":5,""Description"":""I stayed at Zealax hotel in August to take online exam. The best thing about this hotel is the staff are well mannered, friendly and helpful in every aspect. The room is a little bit small. The lift is very quick, I am very satisfied about that, no more time wasting while waiting lift to come. ( my so called luxury condo’s elevator is very bad compared to this hotel) Especially, I would like to thank the housekeeper staff nyi ma lay. She is very professional and helpful to me. At that time, I am very anxious and stressed due to exam. She just cleaned the room, without bothering me and making a noise. And of course, the receptionist. Overall, I have a great stay."",""Images"":null,""When"":""""}]",
acef974c-af2e-48d4-9916-dd775357ac5c,https://www.google.com/maps/place/Hotel+Grand+United+%28Chinatown%29/data=!4m10!3m9!1s0x30c1eb7fe93f73db:0x9b14cc90ff078b63!5m2!4m1!1i2!8m2!3d16.7743393!4d96.1518629!16s%2Fg%2F1hg50tds0!19sChIJ23M_6X_rwTARY4sH_5DMFJs?authuser=0&hl=en&rclk=1,Hotel Grand United (Chinatown),Hotel,"No. 621, Maharbandoola Road, Near Thein Gyi Market Corner of, Bo Ywe Road, Yangon",{},{},,01 372 256,Q5F2+PP Yangon,232,3.700000,"{""1"":17,""2"":16,""3"":66,""4"":60,""5"":73}",16.774339,96.151863,11174781498539084643,,"Straightforward hotel featuring a streamlined restaurant with city views, plus free breakfast.",https://search.google.com/local/reviews?placeid=ChIJ23M_6X_rwTARY4sH_5DMFJs&q=Hotel+Grand+United+(Chinatown)&authuser=0&hl=en&gl=MM,https://lh3.googleusercontent.com/gps-proxy/ALd4DhGrfpndjxnwcSfj0tcmXT2fwqypHNnlHoljyr1NNJ0WlkB-kO4l5af0c2jSndbPkaZJjMw0vuo0ofXwEVYVeM-n78ZEOvmN4ypawd3rM4rgOo0NfSFwniIn61hsPxWMwJI1vC1o8M39-3NWWMtOGIqKlxR8AW5Z29HLG51mxtGdFEmLtUXvz6bv=w408-h272-k-no,Asia/Rangoon,,0x30c1eb7fe93f73db:0x9b14cc90ff078b63,"[{""title"":""All"",""image"":""https://lh5.googleusercontent.com/p/AF1QipM07PeLbV1zr_sinlWg-CfvtkmOjSAwXL-i6w75=w447-h298-k-no""},{""title"":""Rooms"",""image"":""https://lh5.googleusercontent.com/p/AF1QipNUSFfknDLEPj9NGbEBSflTfqQX-YHXvEOppt1v=w529-h298-k-no""},{""title"":""Videos"",""image"":""https://lh3.googleusercontent.com/p/AF1QipPEFvHHHnMwpUs9YLpOYM9i7ohA0rbV9prgCT5U=w224-h398-k-no""},{""title"":""Exterior"",""image"":""https://lh5.googleusercontent.com/p/AF1QipMV7XhCJZhVfxaTFQQVfX78NpwVb6g3DmRUxu37=w447-h298-k-no""},{""title"":""Food \u0026 drink"",""image"":""https://lh5.googleusercontent.com/p/AF1QipNCkYrWd3OshEzaO7c6Sf6gyrLuWs_OYRaBaL58=w447-h298-k-no""},{""title"":""From visitors"",""image"":""https://lh5.googleusercontent.com/p/AF1QipPWm4qbNVaSlb2-_PV7aqqeu9rXSpmXnS8Cow1-=w224-h397-k-no""},{""title"":""By owner"",""image"":""https://lh5.googleusercontent.com/p/AF1QipOP-XwCHEDurgu_cnFTnn-3HidWD4reAmlkOYxR=w447-h298-k-no""}]",null,null,"{""link"":"""",""source"":""""}","{""id"":""114474984587068524525"",""name"":""Hotel Grand United (Chinatown) (Owner)"",""link"":""https://www.google.com/maps/contrib/114474984587068524525""}","{""borough"":"""",""street"":""No. 621, Maharbandoola Road, Near Thein Gyi Market Corner of, Bo Ywe Road"",""city"":""Yangon"",""postal_code"":"""",""state"":"""",""country"":""MM""}",null,"[{""Name"":""Rajiv Malik"",""ProfilePicture"":""https://lh3.googleusercontent.com/a-/ALV-UjU59LOg77VkG-WGh5Lj6cBLNYd7urL3d8PExSMHsYNGSryVIB1J6Q=s120-c-rp-mo-ba6-br100"",""Rating"":3,""Description"":""overall it was a comfortable stay. the room was quite small and congested. location was good . the best thing was the street market that was alive at night and one could have a leisurely walk , have some street food at one of the roadside restaurants. till late night there was a lot of activity in the market place. good fruit was available on the footpaths. in fact there was a proper food and vegetable market that worked till past midnight. the view of the market place, roads and pagodas was excellent from the roof top of this hotel. the service was average though the breakfast was reasonably good."",""Images"":null,""When"":""""},{""Name"":""Dome One"",""ProfilePicture"":""https://lh3.googleusercontent.com/a-/ALV-UjUtxkK1F9_C4PAyQaJxSXUS3qqS6P3suzDcEouGxfiZ1ceOHB7Gog=s120-c-rp-mo-ba8-br100"",""Rating"":4,""Description"":""The rooms are reasonably priced and worth the money you pay. Breakfast is delicious but there are quite a few options. The location is very good. But the superior room is quite narrow. The bathroom is very narrow."",""Images"":[""www.google.com/local/imagery/report/?cb_client=maps_sv.tactile\u0026image_key=!1e10!2sAF1QipMG37P_PGumBW7J1PwlRhFW8ME8eZcH6PRycZl4\u0026fid=0x0:0x9b14cc90ff078b63""],""When"":""2024-2-10""},{""Name"":""humoenlosojos"",""ProfilePicture"":""https://lh3.googleusercontent.com/local-reviews/AJMZ0QfsTQkcy2KndgDISqLavaj05iVMNn3XOI6udcho2AN-fABBAw5poEMIHSoJIZdEEshKkA=s120-c-br100"",""Rating"":0,""Description"":""REVIEW IS FOR LOCATION ON 21ST STREET: Unexpected extra stay in Yangon left me looking for a place to idle out a few days. Chose this hotel primarily for the location to wander in and around the characterful backstreets that fill out the spaces between Chinatown and the Colonial waterfront. The location didn't disappoint, neither did the hotel experience, although I should say that given the choice I'm someone who prefers functional to over-embellished rooms; the rooftop restaurant for breakfasts at sunrise and a drink near sundown were well worth the compact rooms. Staff were helpful and responsive, so definitely not a bad place to stay.  If you're looking to spend more time in your room rather than venturing out and exploring then it might not be the place for you.  Otherwise, it's a good spot for a few days: you'll get your money's worth one way or another.|"",""Images"":null,""When"":""""},{""Name"":""Biswanath D"",""ProfilePicture"":""https://lh3.googleusercontent.com/local-reviews/AJMZ0QfHhPp0vyvo1Wo3WY4NH1G5QOPAHGBMv_XiebXLZtHzVwVa3wkRhb3dykyKrUCZPlawDA=s120-c-br100"",""Rating"":0,""Description"":""I stayed in this hotel twice in two different rooms in a span of one week. In the first time I arrived very early at 11:00 am and, although check-in time is 2:00 pm, staff allowed me at 11:00 am, as a room was available. Natural light has access to the guest rooms and that was my first priority. I liked their welcome fruit platter. In the past I did not get such a treat from other, more expensive hotels in the area. Complimentary breakfast is good. My guest room had all amenities that I needed, including a kettle and plenty of complimentary drinking water bottles and tea/coffee sachets. I liked the wall clock, which gave me a feel that I am in my home. The internet connectivity is good. I only wish that they had a built in wall light in the desk area. Upon my request, the hotel provided me with a desk lamp. That was very useful for my work and I profusely thank the hotel for this gesture. The hotel tariff is relatively less than other hotels in the area and it is value for money. Staff is friendly and helpful."",""Images"":null,""When"":""""},{""Name"":""Traveler O"",""ProfilePicture"":""https://lh3.googleusercontent.com/local-reviews/AJMZ0QeCck1CfANpZm9bBk3PHtP97Kh9k25HZfvq9yAWlN3BaIyjSHUPEfWkhAJmuYiJsH-_6g=s120-c-br100"",""Rating"":0,""Description"":""No luxury to be had here. Nice staff and great location, but not a place to stay long term or bring kids. Best for adult couples and short-term business travelers. Rooms dated, and not especially clean.The A/C is stationed above the bed which attempts to freeze you to death in your sleep. Smoke detector right outside the door was chirping all day and night due to a low battery, nobody seemed motivated to fix it. Internet was very shoddy, better to rely on a local sim for better net access. Location however was great. Just seriously temper your expectations here. Breakfast was simple but fine with a few food options and CNN playing in the background. You're close to all the action here, but the hotel is nothing special. Be sure to bring a print out of your reservation, had to show proof of payment so as not to be double charged. Very friendly staff though."",""Images"":null,""When"":""""},{""Name"":""D L"",""ProfilePicture"":""https://lh3.googleusercontent.com/local-reviews/AJMZ0Qczn4VDfUM6-AtEt-6oaNazFa-i9Fy6kqPVfGIlPil6vJulEYyK8t930jZwOW4hD80mzw=s120-c-br100"",""Rating"":0,""Description"":""Staff excellent, room good, location wonderful. You will like it, near all view place by walk. Many restaurant around, room very clean. Breakfast perfect at top floor, you can see the city when you enjoy your coffee, foods are very good. Good view and wonderful service. All staff will help you anything you need, I like it getting. You won't miss up this hotel."",""Images"":null,""When"":""""},{""Name"":""Laura Fisher"",""ProfilePicture"":""https://lh3.googleusercontent.com/a/ACg8ocItlZ4DpzHhfWYUr6O63lVeeEk0GL8S2gn9l2x7Kd9QQUjGwA=s120-c-rp-mo-ba4-br100"",""Rating"":5,""Description"":""We stayed here for 4 nights with low expectations as we didnt pay a lot of money but everything was great. Our room was a good size with a super comfy bed. It was all immaculately clean and we were provided with as much free bottled water as we wanted. (Room 603)\nBreakfast was good with a few Burmese dishes plus eggs etc.\nThe location was great and all in all we enjoyed our stay"",""Images"":null,""When"":""""},{""Name"":""Alex M"",""ProfilePicture"":""https://lh3.googleusercontent.com/local-reviews/AJMZ0QfjHmZg8gr7jpDgKhrh5KsR_Mq7L6pkVedvpKQz-f3LMiOd3OjI90CK4uLtF3wE59zZgA=s120-c-br100"",""Rating"":0,""Description"":""Being situated in Chinatown made it more convenient to shop around for necessities and meals.  ||Room is clean and wifi is fast enough for video streaming.  As for breakfast,  love the porridge especially,  with all the condiments added. ||The staff is helpful and provide assistance, Eg moving of luggage. ||Opposite of the hotel is Oriental Chinese restaurant.  I went there for dinner daily.  The dishes are cheap and nice. ||There is also a cafe,  Home Sweet Home,  a few streets away,  serve very delicious ice cream.  ||The nearest shopping mall is Junction city,  around 10 mins walk.  Good to escape from the afternoon scorching heat. ||Will stay here if come again"",""Images"":null,""When"":""""}]",
acef974c-af2e-48d4-9916-dd775357ac5c,https://www.google.com/maps/place/Hotel+Parami/data=!4m10!3m9!1s0x30c1949d96fcfbf5:0x8b1fa8c5a01c9a27!5m2!4m1!1i2!8m2!3d16.8514495!4d96.1514227!16s%2Fg%2F11b6dtdnp1!19sChIJ9fv8lp2UwTARJ5ocoMWoH4s?authuser=0&hl=en&rclk=1,Hotel Parami,Hotel,"No. 2 Parami Rd, Yangon 11221",{},{},http://www.hotelparamiyangon.com/,09 977 955555,V522+HH Yangon,497,4.000000,"{""1"":22,""2"":15,""3"":86,""4"":177,""5"":197}",16.851449,96.151423,10024916862298266151,,"Unfussy quarters, some with living rooms, in a casual hotel featuring a rooftop piano bar.",https://search.google.com/local/reviews?placeid=ChIJ9fv8lp2UwTARJ5ocoMWoH4s&q=Hotel+Parami&authuser=0&hl=en&gl=MM,https://lh3.googleusercontent.com/gps-proxy/ALd4DhHVpwDMIxm2UiPd5EmaGdYuH0oUz5kADUr8rQ5dUItLnh_rnFVk3RZon8pSIhH3RbqqBYj-98pGzOqLlyF5TNyObAkUFMHkLpiDynoHZV8c8uFtt9LdbMvOppUSfDTO1pQbrq4M5vyFbCsXUI6e5uK0Jk4hRzqAI4GP9yLq-z6r-1ceYsBu0u34ow=w408-h365-k-no,Asia/Rangoon,,0x30c1949d96fcfbf5:0x8b1fa8c5a01c9a27,"[{""title"":""All"",""image"":""//lh5.googleusercontent.com/22OJgLfrHxSP8pKnXgtUUofe30hdebEyTO1gs7_4AP72JXFk_q5_hn9KpV1wXw9uKQ=w397-h298-k-no""},{""title"":""Rooms"",""image"":""https://lh5.googleusercontent.com/p/AF1QipP-JYcppp717g3NdNcShO1FUclR4bGz8KY9y1dC=w587-h298-k-no""},{""title"":""Videos"",""image"":""https://lh3.googleusercontent.com/p/AF1QipMO8O1FdO-8cLo01DUQwMOQM7jsXIQIqRbZl-6W=w224-h398-k-no""},{""title"":""Exterior"",""image"":""https://lh5.googleusercontent.com/p/AF1QipOJok3GOgBHnqWF6Q3LrF8fVQF1f8J_4FwmeFNL=w397-h298-k-no""},{""title"":""Amenities"",""image"":""https://lh5.googleusercontent.com/p/AF1QipODUb4FZ8yA5PFRumW_9ZZLlhfFiGj9CgMS-rXl=w554-h298-k-no""},{""title"":""Food \u0026 drink"",""image"":""https://lh5.googleusercontent.com/p/AF1QipP3gDA8ocacw-BGH8_KPz1SkjVMM0pvqbWLO9cr=w224-h298-k-no""},{""title"":""From visitors"",""image"":""https://lh5.googleusercontent.com/p/AF1QipOQ-9-02RnWrDuClltTIqg1h0zuJFEp5pjpRGhF=w446-h298-k-no""},{""title"":""Street View \u0026 360°"",""image"":""https://lh3.googleusercontent.com/p/AF1QipMHvY_65ocA9Rln6iWvzUv2wOV2xp18d5jFGgDQ=w224-h298-k-no-pi-0-ya72.00001-ro-0-fo100""}]",null,null,"{""link"":"""",""source"":""""}","{""id"":""111969283096343545771"",""name"":""Hotel Parami (Owner)"",""link"":""https://www.google.com/maps/contrib/111969283096343545771""}","{""borough"":"""",""street"":""No. 2 Parami Rd"",""city"":""Yangon"",""postal_code"":""11221"",""state"":"""",""country"":""MM""}",null,"[{""Name"":""Amelia Moe"",""ProfilePicture"":""https://lh3.googleusercontent.com/a-/ALV-UjW8OF0rDIasEnSIHOsbyzdIXMo161MYMEcULeaZHm9vOiHg7BM=s120-c-rp-mo-br100"",""Rating"":1,""Description"":""Don’t like the attitude of receptionist when I walked in just because I was in my Pajama. It’s already 11 p.m and were they expecting me to wear fancy dress if it’s not in pajamas? And it’s not okay to wait for so long just to check in the room."",""Images"":null,""When"":""""},{""Name"":""Siddhu Nadgunde"",""ProfilePicture"":""https://lh3.googleusercontent.com/a-/ALV-UjU4PrFFBkmeolU8n9W20NPkaTCsrkZMfEmhqbBs1pdi7EwkckrW=s120-c-rp-mo-br100"",""Rating"":5,""Description"":""Late review: I've been there before lockdown in 2018-19. One of the best hotel in the Yangon for me. I really like the experience here, Specially the kitchen staff, they were really good for serving the dishes you want. I stayed the for like almost a year. The cleaning is also very neat and good. If I ever visit yangon again I definitely go for this hotel only."",""Images"":[""www.google.com/local/imagery/report/?cb_client=maps_sv.tactile\u0026image_key=!1e10!2sAF1QipMPIkJK-tlkyugxnZOQe6xoaYU81UndvfH33fKw\u0026fid=0x0:0x8b1fa8c5a01c9a27""],""When"":""2024-3-30""},{""Name"":""Jason Teo"",""ProfilePicture"":""https://lh3.googleusercontent.com/a/ACg8ocJsDPCx1-4HPIxwx9au_xm8MicdvRJkMxrMM1dqGD97BOb5Iw=s120-c-rp-mo-br100"",""Rating"":1,""Description"":""The service attitude was so bad. I kept waiting while waiting to check in. I couldn't even say a word about whether I had a room or not. It made me feel that the experience was terrible! I have stayed in countless hotels in Yangon, and this one definitely has bad reviews!"",""Images"":null,""When"":""""},{""Name"":""Will D"",""ProfilePicture"":""https://lh3.googleusercontent.com/local-reviews/AJMZ0QcKrc8e2JnTu8c7_hmoZKea10RMTDbKaR4QZbjFBwR43DXTBpqzkG_SGZrLD47rFdkvjQ=s120-c-br100"",""Rating"":0,""Description"":""The management and staff are all friendly and helpful! They provided prompt airport pick-up and were very efficient with the check-in.|The room was spotless With comfortable beds and pillows that were not too big as other hotels have supplied. There was a great rooftop bar/ restaurant that served great food as well. I have stayed here many times and will continue to stay here.|Top notched for sure!"",""Images"":null,""When"":""""},{""Name"":""Zaw O"",""ProfilePicture"":""https://lh3.googleusercontent.com/local-reviews/AJMZ0Qcacbd8SUzOZ5BFqcuH0dUXFfPFzIfRWlhBQfTV3kcVPU69oUP_k10j49o8svvEcoldiA=s120-c-br100"",""Rating"":0,""Description"":""I stayed in Parami hotel on and off for past 2 years as I am working here in Yangon. Most of time I stay in Premier Suite, which is spacious, clean and very comfortable king size bed with big flat screen TV. The rooftop bar with swimming pool is very nice view especially at night. Me and my colleagues gathered there quite often for dinner. I feel like home staying in Hotel Parami because of friendly and helpful staffs and amenities. I do highly recommend either solo or family. ||Z. Win"",""Images"":null,""When"":""""},{""Name"":""Amarnath D"",""ProfilePicture"":""https://lh3.googleusercontent.com/local-reviews/AJMZ0QfjHmZg8gr7jpDgKhrh5KsR_Mq7L6pkVedvpKQz-f3LMiOd3OjI90CK4uLtF3wE59zZgA=s120-c-br100"",""Rating"":0,""Description"":""Wow it was amazing to watch World Cup Final in big screen on roof top. The staff are amiable and stay was great. They arranged travel and guided me to go to safe and famous places for tourism. This hotel is highly recommended."",""Images"":null,""When"":""""},{""Name"":""saharul f"",""ProfilePicture"":""https://lh3.googleusercontent.com/local-reviews/AJMZ0QeSe9ibNVY65MpgeQh70I370foM0-7tEPyVc9CIfSq5Ekli093sZJVPBoLD5d5qPK_2rw=s120-c-br100"",""Rating"":0,""Description"":""Best hotel to stayed. Staff is very attentive and response very fast to your request. I had issue with wifi at my room and they immediately install the wifi extender in the room to increase the signal. Nice accommodation and food is good especially breakfast time."",""Images"":null,""When"":""""},{""Name"":""Rosaline N"",""ProfilePicture"":""https://lh3.googleusercontent.com/local-reviews/AJMZ0QfnSFWXMd1oJu73a6IhdtgibYcjse2HKQTHeghNQd9Cyw8DYQQJZDCyh-TD68ehXuY-FA=s120-c-br100"",""Rating"":0,""Description"":""We booked 3 rooms from 20/2/2020 - 24/2/2020.  Rooms were spacious and clean.  The reception desk personnel were friendly and polite and they speak good English.  They were helpful when we asked them for travel and food info and they helped book our taxis.  The buffet breakfast had a big spread ranging from local to western dishes.  Some of the food were changed daily.  The food was delicious and the waiters took our orders for eggs and serviettes graciously.||||Altogether, it was a pleasant and comfortable stay!"",""Images"":null,""When"":""""}]",
