input_id,link,title,category,address,open_hours,popular_times,website,phone,plus_code,review_count,review_rating,reviews_per_rating,latitude,longitude,cid,status,descriptions,reviews_link,thumbnail,timezone,price_range,data_id,images,reservations,order_online,menu,owner,complete_address,about,user_reviews,emails
acef974c-af2e-48d4-9916-dd775357ac5c,https://www.google.com/maps/place/Aung+Tha+Pyay+Hotel+3/data=!4m10!3m9!1s0x30c194f096f5060b:0xab15893949752bb1!5m2!4m1!1i2!8m2!3d16.8603165!4d96.1213145!16s%2Fg%2F11f39p_wy0!19sChIJCwb1lvCUwTARsSt1STmJFas?authuser=0&hl=en&rclk=1,Aung Tha Pyay Hotel 3,Hotel,"No. 2/6 Thamine Train Station Rd, Yangon",{},{},,01 522 924,V46C+4G Yangon,105,3.500000,"{""1"":12,""2"":16,""3"":26,""4"":10,""5"":41}",16.860316,96.121314,12327910434135157681,,,https://search.google.com/local/reviews?placeid=ChIJCwb1lvCUwTARsSt1STmJFas&q=Aung+Tha+Pyay+Hotel+3&authuser=0&hl=en&gl=MM,https://lh3.googleusercontent.com/gps-proxy/ALd4DhFto0FITOj6adFODBW06PTP1skq5XzwchLhyO3jm5OIFpmFyyHusAMYgUdfN43t89cxA2h9f8vy0I0QznndeI3TWBdIzJHpah2EKZBcU-FgMUORjV57R02wsDi5BImgc98q6TSzPjLao5UYj3qzIB9fnzCidZCH26EUv84YIsgWi9_I-VRVjNQn=w408-h254-k-no,Asia/Rangoon,,0x30c194f096f5060b:0xab15893949752bb1,"[{""title"":""All"",""image"":""//lh6.googleusercontent.com/JLqg2tipBR5vhWOjcKXxClyhZMTAMpP4hhmjPHyiKRojUWTtT5CIh8uZKpDdb7PX-w=w397-h298-k-no""},{""title"":""Latest"",""image"":""https://lh3.googleusercontent.com/p/AF1QipPHQl-Owp-7xXJlulmWtbqIyn3JI53CyCyCbLCX=w529-h298-k-no""},{""title"":""Rooms"",""image"":""https://lh5.googleusercontent.com/p/AF1QipOorlTs2otO61vkMdpgr9yOVaFdcPg0IyABV_Ly=w224-h398-k-no""},{""title"":""Exterior"",""image"":""//lh5.googleusercontent.com/emWLj3HTXVCdygh1FQk7W6fqmTKkODHjVOJ-edwo6Ay4qexLS5Fiz8PeFsogxtk=w397-h298-k-no""},{""title"":""Food \u0026 drink"",""image"":""https://lh5.googleusercontent.com/p/AF1QipNDNgJU2TkJEE2Umw1TXEW9HsSB1LO4tneskdTQ=w224-h298-k-no""},{""title"":""From visitors"",""image"":""https://lh5.googleusercontent.com/p/AF1QipPWGBCAYkdv2hiqDcq9J6SidIwZHSYoYuTaIV-G=w224-h298-k-no""}]",null,null,"{""link"":"""",""source"":""""}","{""id"":"""",""name"":""Aung Tha Pyay Hotel 3 (Owner)"",""link"":""""}","{""borough"":"""",""street"":""No. 2/6 Thamine Train Station Rd"",""city"":""Yangon"",""postal_code"":"""",""state"":"""",""country"":""MM""}",null,"[{""Name"":""Japan Good visit Place"",""ProfilePicture"":""https://lh3.googleusercontent.com/a-/ALV-UjX7_K6VTZAJr22_mRTUx5h8eT-mJnpC9FA2bJDK9Prxzi6VK1Fn=s120-c-rp-mo-ba4-br100"",""Rating"":5,""Description"":""This place is suitable for short time rest\nLittle dirty but near place have many foods shop and Bar are located.Price is normal range\n\nI love food"",""Images"":[""www.google.com/local/imagery/report/?cb_client=maps_sv.tactile\u0026image_key=!1e10!2sAF1QipO680KByzx0BiYnIMifZ4Rb_I022AqeWfI1bUW0\u0026fid=0x0:0xab15893949752bb1""],""When"":""2022-11-17""},{""Name"":""Lwin Moe Thwin (Liam)"",""ProfilePicture"":""https://lh3.googleusercontent.com/a-/ALV-UjVeiEPCN1eeYy5WZVbxupUBdxUvzp9a3dbsSLL0rHf6QKXPHcvj=s120-c-rp-mo-br100"",""Rating"":3,""Description"":""The location is quite well as it has a city mart in front. Services are great as well. The problem is there are bugs, cuckroach in the room and bathroom."",""Images"":null,""When"":""""},{""Name"":""Aung Law Ha Shing"",""ProfilePicture"":""https://lh3.googleusercontent.com/a-/ALV-UjXwBldoaemF9-yQ2gZ9JL839nJIO2QcgzjY4PVft9q7OkKoXBsEmA=s120-c-rp-mo-ba6-br100"",""Rating"":4,""Description"":""Carpet chain stores around Yangon. Right price, friendly staffs, a lot of choice for customer as from low quality to high grade expensive one, and located in every good location like this one located at Thamine junction. Very convenience for all. Car parking available at in front of the store but may be quite challenging for some inexperience driver because of a lot of vehicle passing around."",""Images"":null,""When"":""""},{""Name"":""Kaung Dave"",""ProfilePicture"":""https://lh3.googleusercontent.com/a-/ALV-UjUsgbzUeWoMtyHGQmVq1B86YkvPGFdyMSA2PUBWxnrGf_Q9J44=s120-c-rp-mo-ba2-br100"",""Rating"":2,""Description"":""Rooms are quite dirty but their customer service was OK. Noisy and Can't get well rest. Never will be good for staycation."",""Images"":null,""When"":""""},{""Name"":""Kyaw Ye Aung"",""ProfilePicture"":""https://lh3.googleusercontent.com/a-/ALV-UjUOvgBvdhhOEOC8FrmyCHYKKuXDOn2-vX44n9D0NaaAjrgif4EiSg=s120-c-rp-mo-br100"",""Rating"":3,""Description"":""No cups and free water bottle ! Room service is nice. jus minor necessary gonna make 3 stars ! 😊😊😊"",""Images"":null,""When"":""""},{""Name"":""Waiyan Htet"",""ProfilePicture"":""https://lh3.googleusercontent.com/a-/ALV-UjWHR4z6F-v9WovgEkZ6niZo00t5zVmWpL4msWqLjTqhzhZPoeJTmQ=s120-c-rp-mo-ba8-br100"",""Rating"":4,""Description"":""Nice place to buy different kinds of carpets\nRight prices"",""Images"":null,""When"":""""},{""Name"":""HRM NPT"",""ProfilePicture"":""https://lh3.googleusercontent.com/a-/ALV-UjVe7nNhPcjiaKCKi4G6G3tONcyG7-hWK7zuobfX_0MGVzGYSRFe=s120-c-rp-mo-br100"",""Rating"":4,""Description"":""A cozy place for a FIT traveler stop over and rest with room amenities"",""Images"":null,""When"":""""},{""Name"":""Tun Zaw Win"",""ProfilePicture"":""https://lh3.googleusercontent.com/a/ACg8ocJ5byWi81LjkfXDflGIYs-XKBzo1JklJd617UPjY7weD9iQLsk=s120-c-rp-mo-ba5-br100"",""Rating"":3,""Description"":""not bad"",""Images"":null,""When"":""""}]",
acef974c-af2e-48d4-9916-dd775357ac5c,https://www.google.com/maps/place/RGN+City+Lodge+Hotel/data=!4m10!3m9!1s0x30c193cab9b09e23:0x84013f3f79865a78!5m2!4m1!1i2!8m2!3d16.782697!4d96.1404559!16s%2Fg%2F11bztsn8zg!19sChIJI56wucqTwTAReFqGeT8_AYQ?authuser=0&hl=en&rclk=1,RGN City Lodge Hotel,Hotel,"142 Min Ye Kyaw Zwa Road, Yangon 11131",{},{},,01 230 0150,Q4MR+35 Yangon,159,3.700000,"{""1"":11,""2"":10,""3"":38,""4"":53,""5"":47}",16.782697,96.140456,9511953429837535864,,Bright rooms & suites with flat-screens in a relaxed hotel offering complimentary Wi-Fi.,https://search.google.com/local/reviews?placeid=ChIJI56wucqTwTAReFqGeT8_AYQ&q=RGN+City+Lodge+Hotel&authuser=0&hl=en&gl=MM,https://lh3.googleusercontent.com/gps-proxy/ALd4DhH603Bl0VspGcIjZxpq5-Hk6a9GwVjqUxtf-1jWgLIiFJu3kJMWsCUZCZXBwmVbv6OOirKohxWDhEFX6XSeJ6Z9pNCd-mt8NkiET5-m88dZNm6xDBL-15FzgMmA6owhU55PfK9QMezaDs_FbX8xo_QHGQwnoCFhQeDx8j6fPRCJj8fH0PeFX4huww=w408-h300-k-no,Asia/Rangoon,,0x30c193cab9b09e23:0x84013f3f79865a78,"[{""title"":""All"",""image"":""//lh3.googleusercontent.com/-fBhErLipKeQVJxlz_r_pAIhyJYx8NYiYoQS399j8uypHUW4zJDZrPJwRxg8XmsY=w397-h298-k-no""},{""title"":""Rooms"",""image"":""https://lh5.googleusercontent.com/p/AF1QipNhtT9vum0jhkPz6vYV9f09DI5VqzSKbwoOjYje=w397-h298-k-no""},{""title"":""Exterior"",""image"":""https://lh5.googleusercontent.com/p/AF1QipPQjh-E-zh2wo7h_QoZZJdfPjh9eFarUh2zHo9P=w397-h298-k-no""},{""title"":""Food \u0026 drink"",""image"":""https://lh5.googleusercontent.com/p/AF1QipN5D9-hbVBRr959B5P2khEq7F9ffilNrM_Ghbtt=w397-h298-k-no""},{""title"":""From visitors"",""image"":""https://lh5.googleusercontent.com/p/AF1QipP-nvJxFn6ciQIHFl6fQavWn8T27_tItfipaHXt=w529-h298-k-no""}]",null,null,"{""link"":"""",""source"":""""}","{""id"":""115262507144451217833"",""name"":""RGN City Lodge Hotel (Owner)"",""link"":""https://www.google.com/maps/contrib/115262507144451217833""}","{""borough"":"""",""street"":""142 Min Ye Kyaw Zwa Road"",""city"":""Yangon"",""postal_code"":""11131"",""state"":"""",""country"":""MM""}",null,"[{""Name"":""Zin Minn Lwin"",""ProfilePicture"":""https://lh3.googleusercontent.com/a-/ALV-UjUCrOU8Y1SKI_waHKfI0syHDw2ofP-7inp-J3f7PZt9jrXSyuUT=s120-c-rp-mo-ba4-br100"",""Rating"":5,""Description"":""Location\nLocated in the central location of MinYeKyawSwar Road ; it is close to Saint John City Mall, Taw Win Center (Pyay Road), and nearest to UMFCCI and iDol Bar.\n\nStaffs\nThe every single staffs are polite and smooth about their duty to fulfill customer needs and wants. Serve respectfully to all cus like their greatful person.\n\nRooms\nRooms are moderately wide and clean.\n\nMost favourite hotel for stay/day-cation and recommanded although not a luxury grade.\nFair and appropriate with the price and service that all you can get."",""Images"":[""www.google.com/local/imagery/report/?cb_client=maps_sv.tactile\u0026image_key=!1e10!2sAF1QipPUUsxVZqT4zl_BxwpZn4LQN1T8f9-MGC_YY836\u0026fid=0x0:0x84013f3f79865a78""],""When"":""2023-10-31""},{""Name"":""Saint Y"",""ProfilePicture"":""https://lh3.googleusercontent.com/local-reviews/AJMZ0QeFH6dzZjd_ZFLhXHZKibEzXEy8hWzFB4Qa7PutLe3CnO2G7yVfjd4VSabiCQwQYo5W-g=s120-c-br100"",""Rating"":0,""Description"":""The hotel location is good. Not too far away from downtown. The rooms are modern clean and nice. Doesn't have a good view tho. The price is mid range. Breakfast included. Staffs need more training but still okay. The only thing to complain is that the fridge in the room was not so cold. Comfy bed. Afterall had a nice stay so I gave it 4stars."",""Images"":null,""When"":""""},{""Name"":""2C-My Ngo N. Uyen"",""ProfilePicture"":""https://lh3.googleusercontent.com/a/ACg8ocIUTG4ICSGBz0mDBemyM4FBEwTKUtyc4-fXjsKWhSb-WW4sfA=s120-c-rp-mo-ba4-br100"",""Rating"":4,""Description"":""The hotel is located at the quiet street in downtown. Room is nice, clean and big enough. Service is good. Breakfast is included with Italian coffee. The only hotel have Italian coffee in the whole area. I cant stand of local coffee and this really help. The only minus is the breakfast for couple of days of staying. It's such a boring menu. Price is ok within the area.  The area is quite convenient with many restaurants and convenient stores and malls and money exchange booth"",""Images"":null,""When"":""""},{""Name"":""Pranjal S"",""ProfilePicture"":""https://lh3.googleusercontent.com/local-reviews/AJMZ0Qd0Gzx7-o-W0qn7F-oHhorx-ann6UFYRniBmE7Ar1MhRFtO-x6vY7U2LNCPC1lcQidkpw=s120-c-br100"",""Rating"":0,""Description"":""My first introduction to Yangon and Myanmar since this is the first place I went to after I landed. First, I saw 2 small cockroaches and promptly killed them and figured that was ok, since it was very humid and well after 12 am. I was exhausted and was trying to figure out everything in the room. Then I saw two more in the bathroom, these every much smaller and I wasnt happy about it but was still going to roll with it. ||||Then I get in the bed, and I see another medium sized one under the covers, this time a silver one. That for me was the last straw, I went downstairs and got a new room and told them to use pesticide in from of my on every corner of the room. I stayed in this new room for the next night and didnt have any roaches, but I definitely wont stay here again. ||||The room was just a bed and a chair, the bathroom looked okay and the decor was kinda homey. ||||I didnt like the lobby or how they stared at me while I was there. The area seemed to be a busy intersection, not too clean and walking friendly but the tea shop across looked interesting, i had tea there the next day and it was pretty decent. No one spoke english so I wasnt able to order any food. ||||I walked to one the amazing burmese restaurants, so that was really convenient. The breakfast was quite terrible, they did make nice lattes."",""Images"":null,""When"":""""},{""Name"":""Diah T"",""ProfilePicture"":""https://lh3.googleusercontent.com/local-reviews/AJMZ0Qczn4VDfUM6-AtEt-6oaNazFa-i9Fy6kqPVfGIlPil6vJulEYyK8t930jZwOW4hD80mzw=s120-c-br100"",""Rating"":0,""Description"":""The room was spacious and clean, the hotel have cafe on the first floor where you can order in room dining and breakfast. The food was great and lots of variety on breakfast. The staff were lovely and engaged with guests. The location also close to city center and easy to get taxi."",""Images"":null,""When"":""""},{""Name"":""Milena T"",""ProfilePicture"":""https://lh3.googleusercontent.com/local-reviews/AJMZ0Qf66pF81jsVXBxevYxxL5FsdlDsKAngAUpJVE-hAwai1rl8J0QnYqktKV3UGdpbmNlc_A=s120-c-br100"",""Rating"":0,""Description"":""Walked in for a massage and was very positively surprised! Definitely recommend it. Very kind and professional. Great price great service. You get a cute little Pyjama to wear and a drink! Recommend this especially for people that like more than a rub down massage!"",""Images"":null,""When"":""""},{""Name"":""Vincent F"",""ProfilePicture"":""https://lh3.googleusercontent.com/local-reviews/AJMZ0QewvQXK08PhtQgCu1fT7TcdWcgcaXdOmFk48xW5xlmLo-Eqy0UOp2YqveGvl0etYz5BzA=s120-c-br100"",""Rating"":0,""Description"":""The only annoyng thing about the location is the fact that on the other side of the street they are selling CD's. They play very loud music all day long. It is not a big issue, as you tend to explore the city and it's attractions during the day, but if you want to sleep in a bit, forget it.||The hotel is clean, breakfast is good, rooms are spacious and quite modern and (apart from the music guy) it's away from the busy roads. The modern shopping mall is close by, so you can do some shopping there (cool bottled water!)."",""Images"":null,""When"":""""},{""Name"":""marctailly"",""ProfilePicture"":""https://lh3.googleusercontent.com/local-reviews/AJMZ0QftlnsLB8VReEIa8q3x-FUIWL9jAVnw9OiPzFml0xLx7k1DporKgZdMXGALflbNzntF3w=s120-c-br100"",""Rating"":0,""Description"":""Friendly and helping staff; their english not always well understandble. Excellent capucino in the bar, fine breakfast. Nice and spacy rooms with excellent beds. New and efficient bathroom with fine shower.||Excellent restaurants nearby."",""Images"":null,""When"":""""}]",
acef974c-af2e-48d4-9916-dd775357ac5c,https://www.google.com/maps/place/Aung+Tha+Pyay+Hotel+2/data=!4m10!3m9!1s0x30c194fda09dc621:0xd40b306f8df6fcd0!5m2!4m1!1i2!8m2!3d16.8597585!4d96.1118424!16s%2Fg%2F11b6df74x1!19sChIJIcadoP2UwTAR0Pz2jW8wC9Q?authuser=0&hl=en&rclk=1,Aung Tha Pyay Hotel 2,Hotel,"No. 110, Thamaing station Road, Near, Bayint Naung Bridge, Yangon 11221",{},{},,01 522 933,V456+WP Yangon,85,3.400000,"{""1"":13,""2"":10,""3"":19,""4"":13,""5"":30}",16.859758,96.111842,15279359416465816784,,Down-to-earth rooms in an unfussy hotel offering complimentary breakfast & parking.,https://search.google.com/local/reviews?placeid=ChIJIcadoP2UwTAR0Pz2jW8wC9Q&q=Aung+Tha+Pyay+Hotel+2&authuser=0&hl=en&gl=MM,https://lh3.googleusercontent.com/gps-proxy/ALd4DhFeioIp7iDGw5U31_1W6kVG1icOH3eMURARIP-jrLtGTjB0ur7JcjEH6DnZOsyhNz3X5npWCMCRwqiA2n_LByKz2We9eQOgZG7LtstvTyEXvqM-tBI_uD_tvXDwJLZZDxQQ5zNtJIHP1OEHH5ug2uTAhsvIuWaHreYno504oYDh6cEk9zBtQqEm=w408-h308-k-no,Asia/Rangoon,,0x30c194fda09dc621:0xd40b306f8df6fcd0,"[{""title"":""All"",""image"":""https://lh5.googleusercontent.com/p/AF1QipPzVwhlk2163GNqVbbeED9FvXGTBsAsP75K40Gt=w529-h298-k-no""},{""title"":""Rooms"",""image"":""https://lh5.googleusercontent.com/p/AF1QipNpA15tC5XQMmRc1zWMrnm5L2UV9dmCebgHE8tA=w397-h298-k-no""},{""title"":""Exterior"",""image"":""https://lh5.googleusercontent.com/p/AF1QipOG8XlK_A6cdlMttq-jifRUD5tXhLHVTkd8-ElM=w530-h298-k-no""},{""title"":""Food \u0026 drink"",""image"":""https://lh5.googleusercontent.com/p/AF1QipNKp0IhII-wXktcEjzAXtebXo6oQs0ys-IBLoO7=w224-h298-k-no""},{""title"":""From visitors"",""image"":""https://lh5.googleusercontent.com/p/AF1QipO1X2LXauCFzPaVaQqDuMfjhHR8D2HwbSLYuro5=w224-h298-k-no""}]",null,null,"{""link"":"""",""source"":""""}","{""id"":"""",""name"":""Aung Tha Pyay Hotel 2 (Owner)"",""link"":""""}","{""borough"":"""",""street"":""No. 110, Thamaing station Road, Near, Bayint Naung Bridge"",""city"":""Yangon"",""postal_code"":""11221"",""state"":"""",""country"":""MM""}",null,"[{""Name"":""Kyle H"",""ProfilePicture"":""https://lh3.googleusercontent.com/local-reviews/AJMZ0QdCjMUwIiBikRhCLHgN_0vyGAo1GvT8DEukiKQb1ujC_eFsFjYrQ0OvLoSxPtqmCdgvFA=s120-c-br100"",""Rating"":0,""Description"":""great! we honestly don't understand what the bad reviews are about. the only negative thing we found was that there were mosquitos in the room.|the staff were super friendly, the breakfast was nice, the room was large, quiet and comfortable. the internet was the fastest we have had in our 3 1/2 weeks in Myanmar.|yes the water drained slowly in the bathroom, bus that's common in Myanmar.|for the price, it was amazing. last time we were in Yangon we paid more for a capsule style room that was so small we literally couldn't stand in it. it was a closet with a bed in it, and a shared bathroom.|the room we had here was huge and clean and quiet, and the staff were very friendly. it was the perfect stop since it was close to the airport and we were flying out the next day.|"",""Images"":null,""When"":""""},{""Name"":""naiad17"",""ProfilePicture"":""https://lh3.googleusercontent.com/local-reviews/AJMZ0QeiIm6t64oXJwlfKKV-SU2ENLb40SwZCvBWRts5o7WimonLggB5R8bs4qOdTbCTDXjyRQ=s120-c-br100"",""Rating"":0,""Description"":""Just needed an overnight stay as flying out next day so this was a good choice. Arrived around 7:30am on an overnight bus from Inle and allowed to check in at this time. Staff were very accommodating and even giving us a light breakfast of coffee and toast.||||The room is tiled, fridge, large size with private toilet/shower. Everything was clean. For Myanmar, not bad value for money as all hotels are over-priced.||||Surrounding area is not great but then again this is Yangon. Wifi slow but again, after a month in Myanmar, this is the norm."",""Images"":null,""When"":""""},{""Name"":""Reid B"",""ProfilePicture"":""https://lh3.googleusercontent.com/local-reviews/AJMZ0QfnSFWXMd1oJu73a6IhdtgibYcjse2HKQTHeghNQd9Cyw8DYQQJZDCyh-TD68ehXuY-FA=s120-c-br100"",""Rating"":0,""Description"":""The Trip Advisor crowd gave this decent ratings but it's bug infested, has very weak WiFi and over all is a miserable place to stay. My room has the TV on the same same wall as the head of the bed so you can't watch TV in bed. There is no shower, just a hose mounted on the wall next to the toilet. If you want to make sure someone never comes back and that people who read their reviews avoid your hotel then the owners did everything right. The airport Holiday Inn next to the Omaha Airport is a huge step up from this place. Never, ever again. So if you want a super crappy hotel in Yangon this is it. I'm here right now but checking out tomorrow."",""Images"":null,""When"":""""},{""Name"":""Edward Fort"",""ProfilePicture"":""https://lh3.googleusercontent.com/a/ACg8ocJJxvHhUvPv6AlOWixwjUOWDpjSVYGi-YOvff1wx1FMWAuY0A=s120-c-rp-mo-br100"",""Rating"":5,""Description"":""CLEAN bed, bathroom floor always wet shower not so good but hot wter, food ok, workers were great. MANAGER yried to get me to directly pay them $25 USD a night instead of online for $14.23 USD a night...duh"",""Images"":null,""When"":""""},{""Name"":""Kyle Howard"",""ProfilePicture"":""https://lh3.googleusercontent.com/a-/ALV-UjXGArIu2wpyg2OOHU6vOlbyCNzNG32mBf1jlwWcKatSKAXWv_eWnw=s120-c-rp-mo-ba5-br100"",""Rating"":5,""Description"":""great! we honestly don't understand what the bad reviews are about. the only negative thing we found was that there were mosquitos in the room.\nthe staff were super friendly, the breakfast was nice, the room was large, quiet and comfortable. the internet was the fastest we have had in our 3 1/2 weeks in Myanmar.\nyes the water drained slowly in the bathroom, bus that's common in Myanmar.\nfor the price, it was amazing. last time we were in Yangon we paid more for a capsule style room that was so small we literally couldn't stand in it. it was a closet with a bed in it, and a shared bathroom.\nthe room we had here was huge and clean and quiet, and the staff were very friendly. it was the perfect stop since it was close to the airport and we were flying out the next day."",""Images"":null,""When"":""""},{""Name"":""San Lwin"",""ProfilePicture"":""https://lh3.googleusercontent.com/a-/ALV-UjWrHwfKP5I8DerYTjpykPgG40ui6Ws5NCbXaXVl-jl1xYa_J0yi=s120-c-rp-mo-ba8-br100"",""Rating"":3,""Description"":""Beside Bayinnaung Flyer. Large and good Car Parking. Reasonable price. It is second home for company staff."",""Images"":null,""When"":""""},{""Name"":""DILIP JADHAV"",""ProfilePicture"":""https://lh3.googleusercontent.com/a-/ALV-UjXnRxU_FSdVvoleKfVXT-ZhwsfzR8HGO9yUiyPW3NU8S3xEpsCX=s120-c-rp-mo-br100"",""Rating"":2,""Description"":""Not good rooms \u0026 also service not good"",""Images"":null,""When"":""""},{""Name"":""PURSHOTTAM KUMAR DHIWAR"",""ProfilePicture"":""https://lh3.googleusercontent.com/a-/ALV-UjVvQDPv45WR6d6iLs38kJmVeXWbECt28dXVPQ52n8z0Epa3l6XH=s120-c-rp-mo-ba3-br100"",""Rating"":5,""Description"":""Yes good place and good service for gusts"",""Images"":null,""When"":""""}]",
