input_id,link,title,category,address,open_hours,popular_times,website,phone,plus_code,review_count,review_rating,reviews_per_rating,latitude,longitude,cid,status,descriptions,reviews_link,thumbnail,timezone,price_range,data_id,images,reservations,order_online,menu,owner,complete_address,about,user_reviews,emails
acef974c-af2e-48d4-9916-dd775357ac5c,https://www.google.com/maps/place/Hotel+Shwe+Eain+Taw/data=!4m10!3m9!1s0x30c1ecb513265eb7:0x1b5bc3fb87e20b49!5m2!4m1!1i2!8m2!3d16.8235301!4d96.1723403!16s%2Fg%2F11b6d76s21!19sChIJt14mE7XswTARSQvih_vDWxs?authuser=0&hl=en&rclk=1,Hotel Shwe Eain Taw,Hotel,"E Horse Race Course Rd, Yangon 11181",{},{},,09 512 1224,R5FC+CW Yangon,65,3.800000,"{""1"":6,""2"":5,""3"":13,""4"":14,""5"":27}",16.823530,96.172340,1971384746988669769,,,https://search.google.com/local/reviews?placeid=ChIJt14mE7XswTARSQvih_vDWxs&q=Hotel+Shwe+Eain+Taw&authuser=0&hl=en&gl=MM,https://lh3.googleusercontent.com/gps-proxy/ALd4DhEIwnPAx9EGR_0IX1w8La6JmbekaLYe2FLlFo0bQbNc5oTMjeZZesB66tseb5pUNC1FKlLw9mDn97aiSPjv6N43JBj99NF4GZgalY36O_5fZfbRBZ1diW9sQt1_a6krHfbzLw6aDpGFUgHYyJgB7q4KAiv8dldUIY6rLEWErx_s3DqHk5R_7So=w432-h240-k-no,Asia/Rangoon,,0x30c1ecb513265eb7:0x1b5bc3fb87e20b49,"[{""title"":""All"",""image"":""//lh6.googleusercontent.com/ZcuP2UVjyQvraUTT4WGkRB9f3n303csSxaEQknGTMw2mNkOvrifCQv_ArAImqqs=w397-h298-k-no""},{""title"":""Rooms"",""image"":""https://lh5.googleusercontent.com/p/AF1QipPMYsyVPk4fwUVlOJPg2MwCG0sXFsF44edydimw=w224-h298-k-no""},{""title"":""Videos"",""image"":""https://lh3.googleusercontent.com/p/AF1QipPakurrMQKebtwu37sVsOvjqTgiiy35c2Hrgc8P=w224-h302-k-no""},{""title"":""Exterior"",""image"":""https://lh3.googleusercontent.com/p/AF1QipNKpWw11tDCf8fCeDV-iqww9nJvaAY4DWX1ttkn=w224-h302-k-no""},{""title"":""Food \u0026 drink"",""image"":""https://lh5.googleusercontent.com/p/AF1QipPDh1YveB--ohYmmACDXSzMVX0uBdTkVdSOw31r=w613-h298-k-no""},{""title"":""From visitors"",""image"":""https://lh5.googleusercontent.com/p/AF1QipPNA4OGVeI3iBM5tA2Fa6g6UkkthyHZteee24WQ=w447-h298-k-no""}]",null,null,"{""link"":"""",""source"":""""}","{""id"":"""",""name"":""Hotel Shwe Eain Taw (Owner)"",""link"":""""}","{""borough"":"""",""street"":""E Horse Race Course Rd"",""city"":""Yangon"",""postal_code"":""11181"",""state"":"""",""country"":""MM""}",null,"[{""Name"":""Theo"",""ProfilePicture"":""https://lh3.googleusercontent.com/a-/ALV-UjX1q9-gRFTa-cXzjc58mcRbRj__l9RydXLgOSW0ZmxRcQ0xXuRm=s120-c-rp-mo-ba5-br100"",""Rating"":4,""Description"":""This is my new favorite hotel. The prices here at the time I got here was a bargain!\n\nYou get to have free breakfast and a very large room for under $15.\n\nNot too bad...\n\nThe only downside is the location. It is terribly far from anywhere I deem fun and exciting. It is 50 minutes away walking distance to the park. 45 minutes away from a decent gym. The market is also 20 minutes of walking.\n\nIf you are a solo traveller who loves to walk and loves affordable stays that punches above it's weight. Stay here!"",""Images"":[""www.google.com/local/imagery/report/?cb_client=maps_sv.tactile\u0026image_key=!1e10!2sAF1QipP0YIweIXQ2WTpaUERafUUsjhqZ0YKEz5uIycz0\u0026fid=0x0:0x1b5bc3fb87e20b49""],""When"":""2024-1-14""},{""Name"":""Steve R"",""ProfilePicture"":""https://lh3.googleusercontent.com/local-reviews/AJMZ0QeFH6dzZjd_ZFLhXHZKibEzXEy8hWzFB4Qa7PutLe3CnO2G7yVfjd4VSabiCQwQYo5W-g=s120-c-br100"",""Rating"":0,""Description"":""I booked the hotel for 3 of us in a family room for 3 nights. We were running the Yangon marathon (superb) and it is 2k from the start we walked home its that close.  ||||The hotel dosnt look great with ageing decor and a tired looking exterior. Thats where the negatives stop. ||||Firstly lets put this in perspctive,our room cost 63 usd (20 bucks each) including a very nice breakfast. ||||On arrival we were greeted with an orange juice and taken to our room by 3 porters lugging our bags up 4 stories to our room. We had a fantastic view (see picture), flat screen tv with sports and movies in english, newly installed air con, en suite with electric shower (reliably warm) and comfortable beds with clean sheets and towels. What else do you want. ||||The staff are so helpful bringing up water, beers, food and anything else we needed no matter what time of the day. The breakfast is great and they even remember if you like ketchip or chilli sauce and your choice of fruit the next day. The eggs are perfect!||||On the last night I sat and watched football with the local guys on a 40\"" TV and we had a great laugh whilst I ate my excellent 3 dollar special fried rice packed with chicken, pork, prawns...that I had no chance of finishing due to the volume.||||All in all a fantastic place which is 15 mins from airport and anything else in the city.  With taxis costing about 3 dollars to just about anywhere.  ||||This is not the ritz but is clean, authentic with great people. I would stay here again and again."",""Images"":null,""When"":""""},{""Name"":""Canndy H"",""ProfilePicture"":""https://lh3.googleusercontent.com/local-reviews/AJMZ0QeYuXGoFc9HnT35lAJ46cKDIsHY7nNIKUKz_f8yINNlqyrU48jCx-4ctPzihRKgde030w=s120-c-br100"",""Rating"":0,""Description"":""The location is away from the city but transportation is not the problem as Yangon city is a TAXI city. The taxi fare from hotel to city just about 2000-3500 kyat. The room is very clean \u0026 secure. All staff are super helpful \u0026 very friendly. The restaurant at ground floor provide breakfast with banana, the lunch \u0026 dinner in similar chinese cooking style is very delicious and fair rate. Definately, 2star of pay but we get reward of 5star staying and 6star service!"",""Images"":null,""When"":""""},{""Name"":""Yit Y"",""ProfilePicture"":""https://lh3.googleusercontent.com/local-reviews/AJMZ0Qc_hSEOVyYt90T8jEI1lbdGPaVqSrwdtGLOma43xF2tT-AGCQEDWJCQ3qq81gsm_HjiWg=s120-c-br100"",""Rating"":0,""Description"":""Were there for Yoma Yangon Marathon, which situated 2km to Thuwana Stadium. ||||Booked family room of 3 pax: 1Q 1S.||Room is clean and neat. So is the bathroom. Well deserved peaceful night. Well room service with daily complimentary coffees, hot drinking thermos, drinking cups and bananas.||||Restaurant is ok, with access to filling our bottles with drinking water. Breakfast included, which is great basic and yummy menu. Was to catch an early morning flight depart, they prepared our breakfast as takeaway when we asked.||||Services is really nice! The staff are helpful. Recommended - 1.5 stars rating hotel with 5 stars services!"",""Images"":null,""When"":""""},{""Name"":""Myo Than"",""ProfilePicture"":""https://lh3.googleusercontent.com/a-/ALV-UjUvlCvYi0mKd-DufLemi-8kiaDhbBYaxXFfhbOeWoBQWafZHnrV=s120-c-rp-mo-ba4-br100"",""Rating"":2,""Description"":""Do not know about Hotel but restaurant is our usual hand out with old friends.   Chinese foods at reasonable price.  Recommended Mutton Stew with white breads. Parking space available.  Suitable for family."",""Images"":null,""When"":""""},{""Name"":""Floris v"",""ProfilePicture"":""https://lh3.googleusercontent.com/local-reviews/AJMZ0QcoKrjftg2H5FSPDgamEji1HcAj6KJIMYEaB28IfM5URISpFokTGJ4TKCMmdB7Et-p_0g=s120-c-br100"",""Rating"":0,""Description"":""+Great staff very attentive ||+ clean rooms||+ family run business (welcoming atmosphere)||+relative low price||- only instant coffee at breakfast||Overall definitely recommended for a bussiness stay. The hotel is closely located to Myanmar plaza however a little bit far from downtown."",""Images"":null,""When"":""""},{""Name"":""Dexter Pante"",""ProfilePicture"":""https://lh3.googleusercontent.com/a-/ALV-UjUMKvA4qhgYd-JhC9m3YzRl3FZGXMZWDVCqZBwtzIEX5x74SthR=s120-c-rp-mo-ba3-br100"",""Rating"":5,""Description"":""Budget rate hotel but decent and clean. It is located near major Yangoon road but still affords quiet time any period of the day.  It is very accessible, 30 minutes from Yangoon international airport and just 10 minutes by taxi to Yangoon plaza. For budget concious tourist, this is your place. It has also a restaurant with reasonably priced local Myanmar dishes."",""Images"":[""www.google.com/local/imagery/report/?cb_client=maps_sv.tactile\u0026image_key=!1e10!2sAF1QipNZebnfd3_24whrhVMCtjenkNl4fn6kpfgDPH_a\u0026fid=0x0:0x1b5bc3fb87e20b49""],""When"":""2019-7-19""},{""Name"":""Malgorzata B"",""ProfilePicture"":""https://lh3.googleusercontent.com/local-reviews/AJMZ0Qf66pF81jsVXBxevYxxL5FsdlDsKAngAUpJVE-hAwai1rl8J0QnYqktKV3UGdpbmNlc_A=s120-c-br100"",""Rating"":0,""Description"":""It is not in the city center but close to diverse attraction. Very helpful staff (especially manager:), great breakfast (Myanmar), clean big room, very close to the shopping center. Wifi quite well working."",""Images"":null,""When"":""""}]",
acef974c-af2e-48d4-9916-dd775357ac5c,https://www.google.com/maps/place/Winner+Residence/data=!4m10!3m9!1s0x30c19149fb0abbd9:0x42321595f3a70671!5m2!4m1!1i2!8m2!3d16.9373346!4d96.1585123!16s%2Fg%2F11dfgsxtvt!19sChIJ2bsK-0mRwTARcQan85UVMkI?authuser=0&hl=en&rclk=1,Winner Residence,Hotel,"No.134, Khayae Quarter, Mingalardon Garden City (Near Zaykabar Golf Course), Yangon 11101",{},{},,09 784 363696,W5P5+WC Yangon,69,3.900000,"{""1"":3,""2"":4,""3"":17,""4"":18,""5"":27}",16.937335,96.158512,4769898689120896625,,,https://search.google.com/local/reviews?placeid=ChIJ2bsK-0mRwTARcQan85UVMkI&q=Winner+Residence&authuser=0&hl=en&gl=MM,//lh4.googleusercontent.com/jQrmAwDnSX_j9wkzrNE1VNCFxWHd_fHpCI57Kr4db3QVkOEMrIaf6q0sXc2-P1w=w408-h329-k-no,Asia/Rangoon,,0x30c19149fb0abbd9:0x42321595f3a70671,"[{""title"":""All"",""image"":""//lh4.googleusercontent.com/jQrmAwDnSX_j9wkzrNE1VNCFxWHd_fHpCI57Kr4db3QVkOEMrIaf6q0sXc2-P1w=w368-h298-k-no""},{""title"":""Rooms"",""image"":""https://lh5.googleusercontent.com/p/AF1QipNHpdq-xEL25A0HHXO-75cYFEJ7eio-G3J3M_0e=w529-h298-k-no""},{""title"":""Exterior"",""image"":""//lh5.googleusercontent.com/pXUAauOpWyESF0ajpxmCNvGXkHq72hx0GnE5tVYK3zGSZESvhuXvXmK5-puTtZIg=w893-h298-k-no""},{""title"":""Food \u0026 drink"",""image"":""https://lh5.googleusercontent.com/p/AF1QipN626VetJJxquu__v5erwLGKOTi03KXU36h1o0P=w397-h298-k-no""},{""title"":""From visitors"",""image"":""https://lh5.googleusercontent.com/p/AF1QipPWacKXx_1NYBvGOtsUmVqIZqCg_ojMqkWjbdU2=w613-h298-k-no""}]",null,null,"{""link"":"""",""source"":""""}","{""id"":"""",""name"":""Winner Residence (Owner)"",""link"":""""}","{""borough"":"""",""street"":""No.134, Khayae Quarter, Mingalardon Garden City (Near Zaykabar Golf Course)"",""city"":""Yangon"",""postal_code"":""11101"",""state"":"""",""country"":""MM""}",null,"[{""Name"":""Mark W"",""ProfilePicture"":""https://lh3.googleusercontent.com/local-reviews/AJMZ0Qf66pF81jsVXBxevYxxL5FsdlDsKAngAUpJVE-hAwai1rl8J0QnYqktKV3UGdpbmNlc_A=s120-c-br100"",""Rating"":0,""Description"":""My wife and I stayed here for about 10 days. The hotel room was spacious with basic furniture. The rooms are set up as apartments with the option of long stays. The location is across from a golf course and was very far from any stores or markets with little traffic. We had to have staff help us call a taxi to get into town. ||There was a hotel restaurant, with limited options. ||AC and Cable TV worked great, but the internet was spotty. ||We had a number of geckos on the walls at night and some mosquitos. ||The cost was $30 per night, which was cheaper than most options in the area. ||The hotel staff was very friendly and helpful.||For the Western visitor, there are Western toilets, but not enough toilet paper. You should bring your own."",""Images"":null,""When"":""""},{""Name"":""Jessica-Stephanie Arvela"",""ProfilePicture"":""https://lh3.googleusercontent.com/a-/ALV-UjX7zD-NVeTWib_tHRC_gTTxAE_cl7LtXj9ydjst9glTPt-ybyI1=s120-c-rp-mo-br100"",""Rating"":5,""Description"":""We arrived without a booking after a night bus, there were no rooms available but they called other places for us to find one appropriate and available. The lady was so lovely and helpful, we sat in the aircon and used the bathroom and she called different places and helped us order a taxi. Thought it's worth noting here"",""Images"":null,""When"":""""},{""Name"":""Lwin Moe"",""ProfilePicture"":""https://lh3.googleusercontent.com/a-/ALV-UjUyNLLo8u6HnhAiObKXaRWkpzZySpnlSv9MHMrQO4VsmhZ0opM=s120-c-rp-mo-ba4-br100"",""Rating"":4,""Description"":""Great Choice! For my view, this one is very nice.\nTheir services are really good \u0026 the staffs are actually kind to us.Hotel location is so quite \u0026 clean like inside hotel rooms \u0026 bangalores. Thank U 'Winner'. See U next time.By the way, they had drawn the suitable prices for 'Long Stay' 🏪🇲🇲⚓"",""Images"":null,""When"":""""},{""Name"":""Josh C"",""ProfilePicture"":""https://lh3.googleusercontent.com/local-reviews/AJMZ0Qdx0CtChWdL4amzhVtedU6JgNzs3A9KzPS8K998c7-u-mDeTb-7WQwuTD-PPX6BcVA5wg=s120-c-br100"",""Rating"":0,""Description"":""Everything I could ask for - hospitable and clean. ||Food is good and very well priced.||Is close to the bus station and they will organise a taxi for you if you ask. ||Would recommend if you need a place to stay before getting the bus the next morning!|||"",""Images"":null,""When"":""""},{""Name"":""Michael O'Callaghan"",""ProfilePicture"":""https://lh3.googleusercontent.com/a-/ALV-UjU0jmUxl9HLg2o6el5UayEsDWU9yl2KQH1pexPsq7dyL7qdZhg=s120-c-rp-mo-ba4-br100"",""Rating"":5,""Description"":""Excellent choice. Reasonable price. Clean room. Comfortable bed. Attentive, kind staff. Quiet location. WiFi was good. A/c, microwave, fridge and in-room safe. Good value overall."",""Images"":null,""When"":""""},{""Name"":""Michael J B"",""ProfilePicture"":""https://lh3.googleusercontent.com/local-reviews/AJMZ0Qf66pF81jsVXBxevYxxL5FsdlDsKAngAUpJVE-hAwai1rl8J0QnYqktKV3UGdpbmNlc_A=s120-c-br100"",""Rating"":0,""Description"":""This is my current residence in Yangon.  It's a small hotel offering daily and long term rentals.  The ownerlives on the premises, and there is 24 hour staff. There is a restaurant serving asian food and cold beer."",""Images"":null,""When"":""""},{""Name"":""Ashley Hurrell"",""ProfilePicture"":""https://lh3.googleusercontent.com/a/ACg8ocJmghFcUTFWMNEO-G_pgo1TpTB8LNpj5_zvkTgAHstP8itb_w=s120-c-rp-mo-ba3-br100"",""Rating"":4,""Description"":""Nice rooms, loads of TV channels. Very good location for the airport. Room unfortunately had lots of mosquitos in that attacked me through the night"",""Images"":null,""When"":""""},{""Name"":""Sarah Blackburn"",""ProfilePicture"":""https://lh3.googleusercontent.com/a/ACg8ocIji0aApPCpWztQViMj3e_hq0utEK7r93HDAp3AIN1UCFjpuw=s120-c-rp-mo-ba3-br100"",""Rating"":3,""Description"":""Reasonably priced and the people are very nice but there are so many mosquitoes in the room it makes it impossible to have a good night's sleep."",""Images"":null,""When"":""""}]",
acef974c-af2e-48d4-9916-dd775357ac5c,https://www.google.com/maps/place/Hotel+Bond/data=!4m10!3m9!1s0x30c1eb784096b3c3:0x1f5edf542c88a65b!5m2!4m1!1i2!8m2!3d16.7755745!4d96.1433633!16s%2Fg%2F11cs6khr4f!19sChIJw7OWQHjrwTARW6aILFTfXh8?authuser=0&hl=en&rclk=1,Hotel Bond,Hotel,"49 Hledan Street, Yangon",{},{},https://www.facebook.com/hotelbond/,01 230 3212,Q4GV+68 Yangon,153,4.000000,"{""1"":8,""2"":9,""3"":28,""4"":43,""5"":65}",16.775574,96.143363,2260489615603967579,,"Unfussy quarters, some with balconies, in an unassuming hotel offering a cafe & free Wi-Fi.",https://search.google.com/local/reviews?placeid=ChIJw7OWQHjrwTARW6aILFTfXh8&q=Hotel+Bond&authuser=0&hl=en&gl=MM,https://lh3.googleusercontent.com/gps-proxy/ALd4DhHM1GIkt6bZ7rqbxV3kYz9gH8bFyRxP1ozngUl2zxBF-Dq3P8ctTBETYKxSdTNLN3PfimAW3kaSJp4Cmpvf4Gjj8OmRUuiLoz6oITS4_C8YRPdHreRsap5lUuufQIBQBFCpgus6TlQKesJPqgscctNRVkzW8eEABNBUiROMgKVd3pzEsB4YxWWGLA=w408-h612-k-no,Asia/Rangoon,,0x30c1eb784096b3c3:0x1f5edf542c88a65b,"[{""title"":""All"",""image"":""//lh6.googleusercontent.com/dw8EtGjoeaTOCuvN-XS-wB9-OGFcmjC8zEXFQqLC837fTa8pJIpDhvLhii44gYeF=w397-h298-k-no""},{""title"":""Rooms"",""image"":""https://lh5.googleusercontent.com/p/AF1QipNXWn35fSox_ObU42HEriz32fQCr1CzHaCnmRiC=w446-h298-k-no""},{""title"":""Videos"",""image"":""https://lh3.googleusercontent.com/p/AF1QipPXPzQIgYySUTs6Q5gGEyfagwZFG34RnVjSdkPk=w224-h398-k-no""},{""title"":""Exterior"",""image"":""https://lh5.googleusercontent.com/p/AF1QipMkLHZoTb7v_J9GCufstIfVTSt7J6B0DsTIn6Sy=w224-h298-k-no""},{""title"":""Food \u0026 drink"",""image"":""https://lh5.googleusercontent.com/p/AF1QipPXcRG5oDvnKId8uyzJeeMvrj4Jeac56aan9LKm=w446-h298-k-no""},{""title"":""From visitors"",""image"":""https://lh5.googleusercontent.com/p/AF1QipPo5v3f4V7D-Ich2vj-8UGClg7qAmVsRPfFmjcs=w638-h298-k-no""},{""title"":""By owner"",""image"":""https://lh5.googleusercontent.com/p/AF1QipM2FN0zCV8imk425z_WC1sDOmRKSKKn3fcnsJ74=w224-h335-k-no""}]",null,null,"{""link"":"""",""source"":""""}","{""id"":""101420569656075100422"",""name"":""Hotel Bond (Owner)"",""link"":""https://www.google.com/maps/contrib/101420569656075100422""}","{""borough"":"""",""street"":""49 Hledan Street"",""city"":""Yangon"",""postal_code"":"""",""state"":"""",""country"":""MM""}",null,"[{""Name"":""Trip.com Member"",""ProfilePicture"":""https://lh3.googleusercontent.com/local-reviews/AJMZ0QeCck1CfANpZm9bBk3PHtP97Kh9k25HZfvq9yAWlN3BaIyjSHUPEfWkhAJmuYiJsH-_6g=s120-c-br100"",""Rating"":0,""Description"":""A budget hotel with very friendly and helpful staff, offering a good breakfast with a buffet. Note that the rooms have a shared bathroom, which should be taken into account. The internet connection can occasionally be interrupted, so it’s better to have your own SIM card for work"",""Images"":null,""When"":""""},{""Name"":""Matthew Ortiz"",""ProfilePicture"":""https://lh3.googleusercontent.com/a-/ALV-UjXRWq-BNP10zsikF7cEz4hQxZ-OBwASD31FTupiRHyjoAXQoc0=s120-c-rp-mo-ba4-br100"",""Rating"":2,""Description"":""At first it looks like a very good deal, a whole apartment with 2 bedrooms and 2 bathrooms for a low price.  When you see how dirty it is then the price makes sense.\n\nBut, you are given 2 doorlocks for the two bedroons, there is no doorlock to the main living room.  At firsr it seemed like just a strange inconvenience because they are \""changing locks\"" but in hindsight I think this is just a socially acceptable excuse but in hindsight I believe it to be deception (based on their behavior of just entering the room when they feel like it.\n\nThe first time my wife was surprised and they were blessed by getting to see to much of her.  After that they kept coming back again and again under the guise of being extra helpful.\n\nTheir behavior was polite but I found it completely unacceptable.  At night I  dragged the couch in front of the door and put another chair on top of it and leaned against the door so that if someone tried to push the door opened then the chair should fall off and make a loud noise and alert me that someone was trying to enter the room at night.  At 11am exactly I heard the staff in the room.  They had come in to clean the room (without calling first) an hour before checkout time.\n\nWhen I went out I saw how he had quietly and carefully wedge the door open already expecting that there was such a trap; showing that he had developed this skill over time and that he was aware that he was sneaking in instead of calling.\n\nI was enraged!  I come from Texas where the law says that if someone did this at either my home OR A HOTEL that I would have the legal right to kill them.\n\nI know that Myanmar law does not allow that and I respect Myanmar law; however they need to realize that they are authorized for foreign customers and they should try to give reasonable respect that when we are paying to sleep in a place that we have a right to privacy.\n\nI cannot consider this hotel to be safe as you are not entitled to security of a safe space.\n\nI have talked to Myanmar friends and this behavior is also not acceptable by their own culture."",""Images"":null,""When"":""""},{""Name"":""Trip.com Member"",""ProfilePicture"":""https://lh3.googleusercontent.com/local-reviews/AJMZ0QeCck1CfANpZm9bBk3PHtP97Kh9k25HZfvq9yAWlN3BaIyjSHUPEfWkhAJmuYiJsH-_6g=s120-c-br100"",""Rating"":0,""Description"":""Smokers room and unable to sleep in room, called the reception they offered air freshener when I had booked a non-smoking room. Slept in hallway, got eaten by mosquitoes. Also on the 8th floor and no elevator. Not a restful room. Great location though."",""Images"":null,""When"":""""},{""Name"":""Maurice en Marijn Dröge-Rotteveel"",""ProfilePicture"":""https://lh3.googleusercontent.com/a-/ALV-UjXXx19PpyVZES6ZYWv0W8jmzX1gCnK71tSI4I4Wu7T68rQMYDTm3g=s120-c-rp-mo-br100"",""Rating"":5,""Description"":""Our number 1 hotel to go in Yangon.  Clean rooms, good staff, good location.  They were even waive our cancelation fees since we had an emergency.  Very good hotel. Will be coming back regularly."",""Images"":null,""When"":""""},{""Name"":""Naung Mon Oo"",""ProfilePicture"":""https://lh3.googleusercontent.com/a-/ALV-UjXu0YiordMk92v9mfW81SkmwOkJ6vURbRnkQ3-6uy7fORonHhsF_A=s120-c-rp-mo-ba4-br100"",""Rating"":1,""Description"":""I don't want to, but I have to say this: this hotel has the worst service. The staff isn't helpful; they can't smile, and some even have a bad attitude. They don't seem to care about the customers at all. The chair they placed outside the hotel is broken; I sat on it, and it broke on me. The staff and receptionist didn't even notice. When I told them the chair broke, they came and just put it back as it was before. I got some bruises, and they didn't even say sorry."",""Images"":[""www.google.com/local/imagery/report/?cb_client=maps_sv.tactile\u0026image_key=!1e10!2sAF1QipNsvAfIgy0-YEGlMAIYCLHXfohxuZrYzuyLvt7v\u0026fid=0x0:0x1f5edf542c88a65b""],""When"":""2023-10-18""},{""Name"":""Trina Taylor"",""ProfilePicture"":""https://lh3.googleusercontent.com/a/ACg8ocJc45quf8GKvNZR2kFNJotUX3LAUzZcwSnSi3Vd4XwsjfE2M_0=s120-c-rp-mo-br100"",""Rating"":5,""Description"":""The room was clean, the staff was very friendly and helpful. We stayed here for four days, and their breakfast changed everyday which is what we really enjoyed trying new food everyday. The location  was really good. There are a lot of street food around this area."",""Images"":null,""When"":""""},{""Name"":""Jason N"",""ProfilePicture"":""https://lh3.googleusercontent.com/local-reviews/AJMZ0Qdx0CtChWdL4amzhVtedU6JgNzs3A9KzPS8K998c7-u-mDeTb-7WQwuTD-PPX6BcVA5wg=s120-c-br100"",""Rating"":0,""Description"":""I didn't have high hopes for this hotel, but the photos and rating seemed good.  I should have been more cautious and read the reviews more carefully.  First, there is no elevator.  My fault for not checking that, so no negative rating for this.  The hotel has 8 floors so you may have to climb 8 stories to your room. The biggest shock factor was how old and beat up the rooms were.  The website pictures look nice but are either photoshopped or so old that they no longer are accurate.  The walls are dirty and covered in the blood of many dead mosquitoes.  The bathrooms used to have white grout, but now are black with mildew.  -2 rating for horribly accurate pictures.  Second, the hotel does nothing for mosquito control.  I stayed in multiple hotels throughout Myanmar and every hotel was proactive at controlling the mosquitoes.  This place does nothing and the rooms were filled with them.  We got bit multiple times during the night.  -1 rating for mosquito control.  We got the entire floor (two rooms), and one of the rooms smelled of cigarette smoke.  -1 rating for that.  +1 rating as the staff seemed nice, the breakfast was decent, and location was good.  That adds up to a +2 rating.  I would not recommend this place at all."",""Images"":null,""When"":""""},{""Name"":""Sarah R"",""ProfilePicture"":""https://lh3.googleusercontent.com/local-reviews/AJMZ0QeFH6dzZjd_ZFLhXHZKibEzXEy8hWzFB4Qa7PutLe3CnO2G7yVfjd4VSabiCQwQYo5W-g=s120-c-br100"",""Rating"":0,""Description"":""Coming from Siem Reap it took my brain a little bit to adjust to a new economy! The first hotel I booked at $20 per night was an absolute dive. I got out of there as quickly as I could! Walked into Hotel Bond having checked it out online, yes it was a higher price, but worth every penny. The staff were so welcoming when I turned up at 8 in the morning, got me settled into a room and even invited me to have breakfast. The staff carried my suitcase up the stairs and even with the shared bathroom, i never saw the other guest sharing the bathroom so there was no conflict there. The bathroom was excellent with a rainforest shower and a smaller shower head. My suggestions here would be to get some bigger shampoo and shower gel bottles, the tiny individual ones are a waste of plastic and in this case space given that it is a shared bathroom. Putting some floor mats for the bathroom would also be a good idea, 2-3 so each room can have their own.||The room was small but very comfortable and clean.||The breakfast was decent and the daily noodle dish was always vegetable only which is just perfect!||My only other recommendation would be large water refills. Whilst having large water bottles as well as small is a big step above most hotels, I would prefer to use no plastic at all. When I asked the guy at the desk where I might refill my bottle, he said he didn't know and to maybe try a pagoda, when I walked out the door it was less than 30 seconds before I saw that there are water tanks on the street all over the place and these are for anyone to use! Hurrah! Still it would be great if the hotel included water refills in their breakfast room."",""Images"":null,""When"":""""}]",
