input_id,link,title,category,address,open_hours,popular_times,website,phone,plus_code,review_count,review_rating,reviews_per_rating,latitude,longitude,cid,status,descriptions,reviews_link,thumbnail,timezone,price_range,data_id,images,reservations,order_online,menu,owner,complete_address,about,user_reviews,emails
acef974c-af2e-48d4-9916-dd775357ac5c,https://www.google.com/maps/place/Best+Western+Chinatown+Hotel/data=!4m10!3m9!1s0x30c1eb7ece0a7ae9:0x3e3b7ed3a49a55c1!5m2!4m1!1i2!8m2!3d16.777124!4d96.147972!16s%2Fg%2F11btv69msn!19sChIJ6XoKzn7rwTARwVWapNN-Oz4?authuser=0&hl=en&rclk=1,Best Western Chinatown Hotel,Hotel,"127/137, Anawrahta Road, Corner of, Lanmadaw St, Yangon 11131",{},{},http://www.chinatownhotelyangon.com/,01 251 086,Q4GX+R5 Yangon,978,4.000000,"{""1"":34,""2"":39,""3"":176,""4"":343,""5"":386}",16.777124,96.147972,4484317301442237889,,"Modern hotel offering warm, elegant rooms, some with pagoda views, plus a free breakfast buffet.",https://search.google.com/local/reviews?placeid=ChIJ6XoKzn7rwTARwVWapNN-Oz4&q=Best+Western+Chinatown+Hotel&authuser=0&hl=en&gl=MM,https://lh5.googleusercontent.com/p/AF1QipNHE0HyttIUQmbZnKVtldFG96OoYThzDBeYwYEU=w408-h272-k-no,Asia/Rangoon,,0x30c1eb7ece0a7ae9:0x3e3b7ed3a49a55c1,"[{""title"":""All"",""image"":""https://lh5.googleusercontent.com/p/AF1QipNHE0HyttIUQmbZnKVtldFG96OoYThzDBeYwYEU=w446-h298-k-no""},{""title"":""Rooms"",""image"":""https://lh5.googleusercontent.com/p/AF1QipOzBNiVXXrgvvwEPPi1Odhu_iZKFGeu8XFUgwMj=w446-h298-k-no""},{""title"":""Videos"",""image"":""https://lh3.googleusercontent.com/p/AF1QipPsw8PW4DzfAB5P4GqYvhKPiGIoQLp9s8jyj9cI=w224-h398-k-no""},{""title"":""Exterior"",""image"":""https://lh5.googleusercontent.com/p/AF1QipMIQmyIQMAd38CrRdzbACiaC2kenKcU7KWFpuJ6=w397-h298-k-no""},{""title"":""Food \u0026 drink"",""image"":""https://lh5.googleusercontent.com/p/AF1QipOuj35SVwl1axgGp-v54ulWX86Y-ZCr7DVVj_dE=w447-h298-k-no""},{""title"":""From visitors"",""image"":""https://lh3.googleusercontent.com/p/AF1QipNVTWWYyD3F-oAKao9LUluMbSUYmc2eisUM8Tcr=w224-h398-k-no""},{""title"":""By owner"",""image"":""https://lh5.googleusercontent.com/p/AF1QipOfcwYeNRhA8C9KV_MEBQ6-3PJw1ZZJCpKVghtj=w447-h298-k-no""}]",null,null,"{""link"":"""",""source"":""""}","{""id"":""111208950802984160190"",""name"":""Best Western Chinatown Hotel (Owner)"",""link"":""https://www.google.com/maps/contrib/111208950802984160190""}","{""borough"":"""",""street"":""127/137, Anawrahta Road, Corner of, Lanmadaw St"",""city"":""Yangon"",""postal_code"":""11131"",""state"":"""",""country"":""MM""}",null,"[{""Name"":""정민호"",""ProfilePicture"":""https://lh3.googleusercontent.com/a/ACg8ocL8ugON0h8jPtPhYK33YyAysSIMoAAURTNOJyzhbx0N4K-0vA=s120-c-rp-mo-ba2-br100"",""Rating"":1,""Description"":""Smells bad and i think nobody cleaned the room for a while..\nThe photos of the hotel are totally different from what it really looks. Never go there or you regert following my advice."",""Images"":null,""When"":""""},{""Name"":""E Examinex"",""ProfilePicture"":""https://lh3.googleusercontent.com/a-/ALV-UjVue8tvpGe3MdZgu_wrZD_J_kQqoaHL_tFmvdiTvzb2kiRxWOTa=s120-c-rp-mo-ba5-br100"",""Rating"":3,""Description"":""Location is very good, centre of the Yangon city\n\nEasy to access to any location\n\nBut the breakfast and room quality is just ok\n\nStaffs are very kind and welcome"",""Images"":[""www.google.com/local/imagery/report/?cb_client=maps_sv.tactile\u0026image_key=!1e10!2sAF1QipPcHr7DIf3kjyulNV0dQAu4jThLURqs7dUsG6LB\u0026fid=0x0:0x3e3b7ed3a49a55c1""],""When"":""2024-11-6""},{""Name"":""Trip.com Member"",""ProfilePicture"":""https://lh3.googleusercontent.com/local-reviews/AJMZ0QeCck1CfANpZm9bBk3PHtP97Kh9k25HZfvq9yAWlN3BaIyjSHUPEfWkhAJmuYiJsH-_6g=s120-c-br100"",""Rating"":0,""Description"":""1. The bathroom is not clean and has stains.2. When taking the elevator on each floor, the waiting area for the elevator does not have air conditioning.3. The restaurant air conditioner is not cool.4. There is not much food to choose from.5. The room is very small.6. Not worth the price paid7. The internet signal is not very strong.Overall the hotel needs to improve a lot."",""Images"":null,""When"":""""},{""Name"":""Shainna B"",""ProfilePicture"":""https://lh3.googleusercontent.com/local-reviews/AJMZ0QeFH6dzZjd_ZFLhXHZKibEzXEy8hWzFB4Qa7PutLe3CnO2G7yVfjd4VSabiCQwQYo5W-g=s120-c-br100"",""Rating"":0,""Description"":""Stayed 5 nights at this hotel with an entire football team (players \u0026 staff). Hotel staff and management worked really hard to accomodate the demands of our team (dining, gym, internet, etc.). Because of the staff and quality of the hotel amenities \u0026 food, the stay was very cozy and welcoming. Kudos to the manager and staff! Salamat!"",""Images"":null,""When"":""""},{""Name"":""Ayan G"",""ProfilePicture"":""https://lh3.googleusercontent.com/local-reviews/AJMZ0QfjHmZg8gr7jpDgKhrh5KsR_Mq7L6pkVedvpKQz-f3LMiOd3OjI90CK4uLtF3wE59zZgA=s120-c-br100"",""Rating"":0,""Description"":""Excellent accomodation with great staff, always ready to welcome you. The room service and housekeeping staff are always ready and active to serve you. The food is also fresh and good, especially the varieties in breakfast. Good experience all over."",""Images"":null,""When"":""""},{""Name"":""Michael Chen"",""ProfilePicture"":""https://lh3.googleusercontent.com/a-/ALV-UjV0ayoh0d_bWQZuHAhVyXD6052wq6JJogIvsv5LScfGRXLc0gE=s120-c-rp-mo-br100"",""Rating"":3,""Description"":""I went to this place, and it was awesome! location is not bad, do not feel safe at night as environment is dark with few or no people at night time, accessible to china town easily, lobby is small, people there are super nice, and they have yummy food. The spa people are really good at massages, too! In the morning, you can hear people at the bazaar, it's very noisy."",""Images"":null,""When"":""""},{""Name"":""tom y"",""ProfilePicture"":""https://lh3.googleusercontent.com/local-reviews/AJMZ0QeqQESQs2CRf2VRyln1Raq0k2FSdB19mGKme5Xh6nHXcs2V7pTrOayJAdxC-qWdu9VyTA=s120-c-br100"",""Rating"":0,""Description"":""That was the second trip in recent month, and I stayed the same place, Best Western China Town, Yangon, for the second time. I have stayed a full 28 days, a maximum allowance of Myanmar visa (Feb 26th-March 26th, so24). As always, all the staff, from the counter to the kitchen, I will give better than five stars, if there is a rating of more than five. ||||Thank you very much again to Operating Manager Ko Kyaw Swar Oo who always helps me all the way with any trivial thing. Thanks to Kitchen Staff, Ko Myo Swe and the rest of the staff including the two Chef who treated me like one of their family members. The four ladies from the front Desk, Swe Swe, and all. ||||There is nothing I can say better than Thank You so much to all of you. I genuinely appreciate all the staff that I have met. ||||I will be there again in the next few months. See you then…sincerely, Tom Yu"",""Images"":null,""When"":""""},{""Name"":""Trip.com Member"",""ProfilePicture"":""https://lh3.googleusercontent.com/local-reviews/AJMZ0QeCck1CfANpZm9bBk3PHtP97Kh9k25HZfvq9yAWlN3BaIyjSHUPEfWkhAJmuYiJsH-_6g=s120-c-br100"",""Rating"":0,""Description"":""The hotel is near Chinatown and all the places you need to visit. The hotel looks old from the outside but inside is ok. There’s nothing fancy about it but the location is very good. The staff are friendly and the food is not bad."",""Images"":null,""When"":""""}]",
acef974c-af2e-48d4-9916-dd775357ac5c,https://www.google.com/maps/place/Hotel+63/data=!4m10!3m9!1s0x30c1ec5f36b7d64b:0xf8cdaa85017da855!5m2!4m1!1i2!8m2!3d16.7709076!4d96.1793563!16s%2Fg%2F12hl0ndj4!19sChIJS9a3Nl_swTARVah9AYWqzfg?authuser=0&hl=en&rclk=1,Hotel 63,Hotel,"Q5CH+9Q7 Hotel 63, ကုန်သည်လမ်း, ၆၂ & ၆၃ လမ်း ကြား, ဗိုလ်တစ်ထောင်, ရန်ကုန် ဒေသကြီး, Merchant Rd, Yangon",{},{},http://hotel63myanmar.com/,09 45500 0386,,444,4.200000,"{""1"":17,""2"":19,""3"":76,""4"":65,""5"":267}",16.770908,96.179356,17928173179864197205,,"Unassuming quarters in a laid-back budget hotel offering a cafe/bar & a spa, plus a lounge.",https://search.google.com/local/reviews?placeid=ChIJS9a3Nl_swTARVah9AYWqzfg&q=Hotel+63&authuser=0&hl=en&gl=MM,https://lh3.googleusercontent.com/gps-proxy/ALd4DhFIL7n77hECDJWReSuBwbHym-ZwmTF1DdPaqvSxhCS-zrJPSmIpo3qmdGux0u1mloPsnoTXPvnA71M1yfL8s9sSoUhxb3Ia2tr-3_6ul0FHRKygeeRuLyRWrgcTQV1Uju7NINcfk2r6bWCjCiweTvWKOQYy6rUDtlKfvq0L0Y4vNrJGSnwdPlPUsA=w408-h306-k-no,Asia/Rangoon,,0x30c1ec5f36b7d64b:0xf8cdaa85017da855,"[{""title"":""All"",""image"":""https://lh5.googleusercontent.com/p/AF1QipNIiHSK4DpZNhrew6kdkCxhq_Ow0NV6a_xPeIVs=w530-h298-k-no""},{""title"":""Rooms"",""image"":""https://lh5.googleusercontent.com/p/AF1QipMg_XQ09AynwXmVJunSzWfutd9kO7RB5wmiq3HW=w448-h298-k-no""},{""title"":""Videos"",""image"":""https://lh3.googleusercontent.com/p/AF1QipP4qQviyTiBT7FccGOJGheajQUcP28l6H2BNCR-=w224-h398-k-no""},{""title"":""Exterior"",""image"":""https://lh5.googleusercontent.com/p/AF1QipOk_ieV8n5UtxxWq13lz9XmpzhYtI6cKIS3NUZD=w397-h298-k-no""},{""title"":""Food \u0026 drink"",""image"":""https://lh5.googleusercontent.com/p/AF1QipPV5eeUVt4Z5PBT8CP02kMGYWy-xdFWLJIbkElG=w529-h298-k-no""},{""title"":""From visitors"",""image"":""https://lh5.googleusercontent.com/p/AF1QipP3HgMytsEDrXTpJ_OvKAjCpOJ2MoTqFeIdlQmS=w529-h298-k-no""},{""title"":""By owner"",""image"":""https://lh3.googleusercontent.com/p/AF1QipPAQEqNDl65u6HY25Xbnlz6JHnMDzAI7WTQe1lK=w518-h298-k-no""}]",null,null,"{""link"":"""",""source"":""""}","{""id"":""105825018424360455691"",""name"":""Hotel 63 (Owner)"",""link"":""https://www.google.com/maps/contrib/105825018424360455691""}","{""borough"":"""",""street"":""Q5CH+9Q7, ကုန်သည်လမ်း, ၆၂ \u0026 ၆၃ လမ်း ကြား, ဗိုလ်တစ်ထောင်, ရန်ကုန် ဒေသကြီး, Merchant Rd"",""city"":""Yangon"",""postal_code"":"""",""state"":"""",""country"":""MM""}",null,"[{""Name"":""Hlaing Toe Wai (ARR KWEE)"",""ProfilePicture"":""https://lh3.googleusercontent.com/a-/ALV-UjV4v5HvdTjYUuzffVUkt9Xb6IDbiFWdEf--vahfVNAB5znVjkiH=s120-c-rp-mo-br100"",""Rating"":2,""Description"":""I went this hotel a few days ago and I found out my room's Toilet is really terrible. Basin pipes were junk and water didn't go through well, tap water is so salty, toilet tank lever is broken, cleaning is so bad. I think they didn't even make maintenance for facilities especially in toilet. Services are okay."",""Images"":null,""When"":""""},{""Name"":""Phyoaung Lynn"",""ProfilePicture"":""https://lh3.googleusercontent.com/a/ACg8ocIFeLryYwGqIrm8ZpRCMw8eOMEVk9jznC-cc_sY7gQ1yZJ25w=s120-c-rp-mo-br100"",""Rating"":5,""Description"":""Pork rib  \u0026 farmer soup from the menu of 63 Hotel is very good.\nI would like to recommend eating when you arrive.Others Service is high level  in this hotel ? Highly Recommend."",""Images"":null,""When"":""""},{""Name"":""redlabel rc"",""ProfilePicture"":""https://lh3.googleusercontent.com/a-/ALV-UjV751GTcpscGUIC0Nz4_RlKFAYhihVLvavExJx5iBU8c9dcjZls=s120-c-rp-mo-br100"",""Rating"":5,""Description"":""The manager and staff are very friendly, as well as good service, delicious food, and a very comfortable hotel, so it is a must-stay hotel."",""Images"":null,""When"":""""},{""Name"":""ya danar"",""ProfilePicture"":""https://lh3.googleusercontent.com/a/ACg8ocK9rVpfW-1iGsZ02UY7I7Jxa2HWJhPVj7O9v3_Re-KvhZDu8g=s120-c-rp-mo-br100"",""Rating"":5,""Description"":""buffet is good . Good service🥰🥰\nEvery Room are very clean and tidy.The food is nice. Great place 😍"",""Images"":null,""When"":""""},{""Name"":""Sandar Aung"",""ProfilePicture"":""https://lh3.googleusercontent.com/a/ACg8ocK3PQLt_Ia2OpfldoT6jebQ-l8lHzX3wq_uH9x4W1daZOx8sQ=s120-c-rp-mo-br100"",""Rating"":5,""Description"":""The restaurant is really nice.The foods are very delicious.I like ice coffee of this restaurant. I also like the buffet of this hotel."",""Images"":null,""When"":""""},{""Name"":""Aye Chann Moe"",""ProfilePicture"":""https://lh3.googleusercontent.com/a/ACg8ocI88dArClvCyK5e9uyOjncdQ84tK0IR5wcrjCDmYAKb0-gCQQ=s120-c-rp-mo-br100"",""Rating"":5,""Description"":""Delicious buffet , good service , feel excellant chilling in Retro Bar , Comfortable rooms and best place ever"",""Images"":null,""When"":""""},{""Name"":""Zin Ko Win"",""ProfilePicture"":""https://lh3.googleusercontent.com/a/ACg8ocJUaJfSH2kMilAbezD1AmcS0EC2FafyD6mwEkFzELzg19EQ0A=s120-c-rp-mo-br100"",""Rating"":5,""Description"":""Every room is clean and tidy, the food is good, and there is a spacious parking lot, so it's convenient."",""Images"":null,""When"":""""},{""Name"":""Aj Dhunraj"",""ProfilePicture"":""https://lh3.googleusercontent.com/a-/ALV-UjUoMkt8H_aoGZOJSU4CxvLSL-yB7dqDFALea7NpifM_9IBhy0lB=s120-c-rp-mo-ba4-br100"",""Rating"":3,""Description"":""It's a normal place to dive into but far away from areas.\nU will get taxis but 😁\nThere's a bar restaurant which is open 24/7 , massage , nice sweet family room."",""Images"":null,""When"":""""}]",
acef974c-af2e-48d4-9916-dd775357ac5c,https://www.google.com/maps/place/Sanctuary+Hotel+Yangon/data=!4m10!3m9!1s0x30c1ec871fce05af:0x8270cede795c888a!5m2!4m1!1i2!8m2!3d16.7761872!4d96.1594334!16s%2Fg%2F11frr2dzk8!19sChIJrwXOH4fswTARiohced7OcII?authuser=0&hl=en&rclk=1,Sanctuary Hotel Yangon,Hotel,"No.117/127 ,33 rd Street, Middle Block, 11182",{},{},,01 824 8082,Q5G5+FQ Yangon,122,3.600000,"{""1"":15,""2"":10,""3"":29,""4"":27,""5"":41}",16.776187,96.159433,9399239877236394122,,Unassuming rooms & dorms in a laid-back budget hotel offering a rooftop bar/restaurant.,https://search.google.com/local/reviews?placeid=ChIJrwXOH4fswTARiohced7OcII&q=Sanctuary+Hotel+Yangon&authuser=0&hl=en&gl=MM,https://lh3.googleusercontent.com/gps-proxy/ALd4DhE1DNoK7L87eOgaO4E--CfhX6DDH-KxPhqo2diP0xjota9UTaYA8JO0QIMStvS91xmAIt2Do1TW559C2-yDkjI81USIdixI3HRzoXge2AIDcCvzCdWgg8_VCkiWvsQPuMjrRRoGqW-Y_-IYFMIVQarPRHluOnPKgUPjfcP3rmg29S5oOgRhIEAO3Q=w426-h240-k-no,Asia/Rangoon,,0x30c1ec871fce05af:0x8270cede795c888a,"[{""title"":""All"",""image"":""https://lh5.googleusercontent.com/p/AF1QipPL0Um0fnKQdqq89vysXVR-cJilXWxU3MMgDGmV=w224-h298-k-no""},{""title"":""Rooms"",""image"":""https://lh5.googleusercontent.com/p/AF1QipM-9LRjxFba_IdcnUBujJx1_bMITm8DxGOgmhSV=w397-h298-k-no""},{""title"":""Videos"",""image"":""https://lh3.googleusercontent.com/p/AF1QipOYgXZ8AaB--Mc7JDQ1S9ImWVtOzK9RbieoQ8Bf=w298-h298-k-no""},{""title"":""Exterior"",""image"":""https://lh3.googleusercontent.com/p/AF1QipPi0FLAWZwCfrLxVsy7rUzX9gz_YUBmFFLYN2EU=w298-h298-k-no""},{""title"":""Food \u0026 drink"",""image"":""https://lh5.googleusercontent.com/p/AF1QipMTrdXnYYgDVTOTh1Hwz6YagIPh3iAWjxsY4lKP=w224-h298-k-no""},{""title"":""From visitors"",""image"":""https://lh3.googleusercontent.com/p/AF1QipNkDk6Qrhl8JZL6H8tpC3Rhwm_uaCcmIY9KiLto=w397-h298-k-no""},{""title"":""By owner"",""image"":""https://lh5.googleusercontent.com/p/AF1QipPwx8sJFg5M2q0BXhM-dU7MVHtOYJcsPyMxKqQ_=w397-h298-k-no""}]",null,null,"{""link"":"""",""source"":""""}","{""id"":""106849614742574609773"",""name"":""Sanctuary Hotel Yangon (Owner)"",""link"":""https://www.google.com/maps/contrib/106849614742574609773""}","{""borough"":"""",""street"":""No.117/127 ,33 rd Street, Middle Block"",""city"":""Yangon"",""postal_code"":""11182"",""state"":"""",""country"":""MM""}",null,"[{""Name"":""Marvin"",""ProfilePicture"":""https://lh3.googleusercontent.com/a/ACg8ocJT47lEvvYdLXh9Syk8UlzUTnAf4CHTAToCYOqqVifJB1L72w=s120-c-rp-mo-br100"",""Rating"":1,""Description"":""The room is really narrow and dirty. They only focus on couple who stay with section. They can’t handle the room service and there is also a very bad smell in the room. The white pillow case is turned into yellow.\nThere is no car parking and it’s very hard to drive in the road. If you hire a taxi to go to the hotel, the taxi driver may drop you off at the intersection and you will need to walk to the hotel by yourself.\n\nFor those who focus on cleanliness, this is a hotel you really shouldn't come to. 👎"",""Images"":null,""When"":""""},{""Name"":""TD"",""ProfilePicture"":""https://lh3.googleusercontent.com/a-/ALV-UjUBiWwLLqTQckPE1slGZ2TGARPmobL3s6kk88iTOjuc72k3rvk=s120-c-rp-mo-ba6-br100"",""Rating"":1,""Description"":""The high rated and the discount make me decided to book this hotel on a booking app. They booked me in the room on 4th floor. The room condition was ok for this discounted price. But less than 30  minutes after check-in, I found out that the hotel is renovating the 2nd and 3rd floor. Wall crushing hammering and drilling noise was as loud as they are working around my room. It not different from staying in the middle of construction site.  I went down to reception, she said they will noisy during workday 10AM to 5PM (but on Saturday, when I check-out, they were still continuing the hammering). I asked reception, if there any available room on the higher floor. She said no. So, I send email to the booking app's customer service right away with video clip to show them how crazy was the construction noise. (See the uploaded clip) Agoda never contact back. Next day I have to contact agoda again, they responded and said that they did not receive my first email. I send them more video clips, then they managed the hotel to move me to 6th floor.   Agoda do not provide direct complain channel, but ask me to complain via themselves, the customer service.\n\nNew room on 6th is quite quiet from the construction noise on lower floors BUT the room was full of strong smoking odour. My cloth was smell like the room when I unpacked my luggage at home.  The shower curtain was horribly mouldy. In the second night, there was a young local couple trying to get into my room with the correct key card. They can unlock electronically but stuck with manual lock from the inside. I am not sure who else got into my room when I was away. There were safebox but without manual. The walkway on 6th floor was so dark with red lanterns hanging along the corridor. There were lot of activities by their local guests in the late night on 6th floor. Which imply that they might provide hour rent for local kingky visit during the night.\n\nLater I provided negative feedback for Agoda as they requested via email. They gave USD3.60 back to my agoda account. I feel like being slapped with USD 3.60. My short trip was impacted from the time I spent on this problem for 2 rounds, then I have to spend 2nd night in the tobacco odour room.\n\nCleanliness, I would give 0/5. The pillow on 4th floor still have odour from previous sweaty guest. The blanket and pillow covers does not look like freshly washed. The shower curtains on 6th floor were mouldy.\n\nLocation I would rate 4/5 but at the moment the government put barbwire and barricade on the road around the city hall at the south end of the one-way 33th street, where the hotel located.  All of taxi and grab ride denied getting into this road, so I had to walk to/from main road for taxi and grab.\n\nI did not expect anything luxury room form this cheap rent at all but the common-sense of the hotel were absence: 1. They just crushing the building wall without considering that their guests might spend some hours during daytime in the room away from Yangon heat. Even they want to crush the 3rd floor, they can avoid accepting any booking into 4th floor during construction period. 2. It is OK for the hotel to have room for smoking guests but must not book non-smoking guest into that room. 3. After typing no.2. I just suspicious about smoke detector in the room. Should I expect fire safety from cheap hotel when I have to stay on the 6th floor with permanently locked iron grill on the window?\n\nI told Agoda that the customers need to be informed about the noisy condition. After that on agoda, I see the hotel still discounting without informing about noisy condition."",""Images"":[""www.google.com/local/imagery/report/?cb_client=maps_sv.tactile\u0026image_key=!1e10!2sAF1QipPuEx4JM1pu0g4dsnDsaGBLwHlSKqaKTUz0v-LL\u0026fid=0x0:0x8270cede795c888a""],""When"":""2022-10-17""},{""Name"":""Pyae Pyae Aung"",""ProfilePicture"":""https://lh3.googleusercontent.com/a-/ALV-UjV6oqumeMsDq8FuzZH7k_YeBeA5Q5Q8jfcCNQ9VMCeCUzdNNBnB=s120-c-rp-mo-ba2-br100"",""Rating"":1,""Description"":""I never used to write bad comment. But this one is the Worst hotel ever. Very disappointing. Room is very small. Food and service is poor . No respect to the guest, especially the receptionist girl. Keep using her phone while the guest is asking her and the way she talks to guest is very rude, like the guest is her staff and she is boss or manager. No feeling of basic service.\n\nRooftop bar and the staff up there is kind of okay."",""Images"":null,""When"":""""},{""Name"":""Orange G"",""ProfilePicture"":""https://lh3.googleusercontent.com/local-reviews/AJMZ0QfCm-MBS7Itwd4h-55xcyygsVKq1IZbUTNyg17UKkQsT2C3oSXBlQ_-pGTl8imnrFVtVw=s120-c-br100"",""Rating"":0,""Description"":""Trash weren't cleaned  .. Room service is too Bad even at executive room. Hot water don't work. Air Conditioner suck too. The worst thing is Waiting for Check-in took me about 15 minutes. Reception is too Crowd .. I feel pity for Receptionist she was alone busy trying to finish the job done. I hope whoever running this hotel should know his/her hotel not even worth one star rating. I've never felt this kind of the most disappointed check-in experience before."",""Images"":null,""When"":""""},{""Name"":""Bernard S"",""ProfilePicture"":""https://lh3.googleusercontent.com/local-reviews/AJMZ0QfHhPp0vyvo1Wo3WY4NH1G5QOPAHGBMv_XiebXLZtHzVwVa3wkRhb3dykyKrUCZPlawDA=s120-c-br100"",""Rating"":0,""Description"":""Two nights  in this just opened place, central located Everything is ok,good matress. . Very good breakfast with excellent coffee. Rooftop bar for the evening beer. They can organise a taxi to our next trip. Our deluxe room was close to the elevator and  users are a bit loud."",""Images"":null,""When"":""""},{""Name"":""Irmin Corona"",""ProfilePicture"":""https://lh3.googleusercontent.com/a-/ALV-UjVcwqwPGdpuYXU9UQ9lY3JHRN-xqVBSiD1KTgrDEVgSqWvJu8Io=s120-c-rp-mo-ba3-br100"",""Rating"":1,""Description"":""*1-Month Stay Review at Sanctuary Hotel*\nPros:\n✅Proximity to Shwedagon Pagoda and Sule Pagoda\n✅Fantastic Rooftop Views\n✅Prime Location\nCons:\n❌Blanket change requests went unnoticed, even after written reminders.\n❌I reported a rat on the ground floor, but no one took action.\n❌Daily reminders were necessary for room cleaning. ( I expect daily reminders in a guesthouse but not in a hotel)\n❌Language barriers are challenging, as staff generally need help with English communication.\n❌The affordable price of 405 USD for a month overshadows the poor service. Better options are available at a similar rate."",""Images"":[""www.google.com/local/imagery/report/?cb_client=maps_sv.tactile\u0026image_key=!1e10!2sAF1QipOgUycCR5QkTyWUXVmDQ0ROXGZD46_CHLxSOA3G\u0026fid=0x0:0x8270cede795c888a""],""When"":""2023-5-22""},{""Name"":""Sara B"",""ProfilePicture"":""https://lh3.googleusercontent.com/local-reviews/AJMZ0QeFH6dzZjd_ZFLhXHZKibEzXEy8hWzFB4Qa7PutLe3CnO2G7yVfjd4VSabiCQwQYo5W-g=s120-c-br100"",""Rating"":0,""Description"":""Staff are wonderful and friendly. We arrived on the opening night, they gave us free souvenirs and drinks and food!! The plugs didn't work with my adapter, but I think they will get the problem sorted. Looks a bit daunting arriving on the street but it's modern and extremely clean inside. It has a sky bar too!! Great location."",""Images"":null,""When"":""""},{""Name"":""Hnyoon KabyarShoon"",""ProfilePicture"":""https://lh3.googleusercontent.com/a-/ALV-UjUiKP-WsDalEzIUE1pimtwAro1zUJnnZVs9VAvBkI5i3mpiCDc=s120-c-rp-mo-br100"",""Rating"":1,""Description"":""Very poor service from front desk staff (eye glass girl,the girl in the picture).I can’t get a room even after booking.I also paid for a full room for a day.Price is too cost for early check in and late check out.Checkin time is 2pm but I didn’t get my room until after 6pm.However the receptionist did not apologize and behaved rudely.Staff are always use their phone that is no respect to the guest.Without standard Receptionist girl.But Receptionist boy is ok to talk."",""Images"":[""www.google.com/local/imagery/report/?cb_client=maps_sv.tactile\u0026image_key=!1e10!2sAF1QipP-umMMwRhrbgndzBmF0ZU__RxP-sI1nO-R987F\u0026fid=0x0:0x8270cede795c888a""],""When"":""2024-3-21""}]",
